A1: Identification | D1: Configuration Items | G1: Policies Executions | P1: Traceability Links
P2: Direct | V2: Indirect | AB2: Total
A3: Configuration | B3: Author | C3: Date | D3: Added | E3: Removed | F3: Modified | G3: Policy 1 | H3: Policy 2 | I3: Policy 3 | J3: Policy 4 | K3: Policy 5 | L3: Policy 6 | M3: Policy 7 | N3: Policy 8 | O3: Policy 9 | P3: Manual | R3: Automatic | T3: Lost | V3: Manual | X3: Automatic | Z3: Lost | AB3: Manual | AD3: Automatic | AF3: Lost
P4: Addition | Q4: Removal | R4: Addition | S4: Removal | T4: Addition | U4: Removal | V4: Addition | W4: Removal | X4: Addition | Y4: Removal | Z4: Addition | AA4: Removal | AB4: Addition | AC4: Removal | AD4: Addition | AE4: Removal | AF4: Addition | AG4: Removal
A5: 1 | B5: cvs2svn | C5: 37811.825567129628 | D5: 1 | E5: 0 | F5: 0 | G5: 0 | H5: 0 | I5: 0 | J5: 0 | K5: 0 | L5: 0 | M5: 0 | N5: 0 | O5: 0 | P5: 0 | Q5: 0 | R5: 0 | S5: 0 | T5: 0 | U5: 0 | V5: 0 | W5: 0 | X5: 0 | Y5: 0 | Z5: 0 | AA5: 0 | AB5: =V5+P5 -> 0 | AC5: =W5+Q5 -> 0 | AD5: =X5+R5 -> 0 | AE5: =Y5+S5 -> 0 | AF5: =Z5+T5 -> 0 | AG5: =AA5+U5 -> 0
A6: 2 | B6: carlosjr | C6: 37811.825567129628 | D6: 2017 | E6: 0 | F6: 0 | G6: 0 | H6: 0 | I6: 0 | J6: 0 | K6: 0 | L6: 0 | M6: 58 | N6: 0 | O6: 0 | P6: 161 | Q6: 0 | R6: 58 | S6: 0 | T6: 0 | U6: 0 | V6: 502 | W6: 0 | X6: 0 | Y6: 0 | Z6: 0 | AA6: 0 | AB6: =V6+P6 -> 663 | AC6: =W6+Q6 -> 0 | AD6: =X6+R6 -> 58 | AE6: =Y6+S6 -> 0 | AF6: =Z6+T6 -> 0 | AG6: =AA6+U6 -> 0
A7: 3 | B7: carlosjr | C7: 37816.73778935185 | D7: 0 | E7: 7 | F7: 1 | G7: 0 | H7: 0 | I7: 0 | J7: 0 | K7: 0 | L7: 0 | M7: 0 | N7: 0 | O7: 0 | P7: 0 | Q7: 0 | R7: 0 | S7: 0 | T7: 0 | U7: 0 | V7: 0 | W7: 0 | X7: 0 | Y7: 0 | Z7: 0 | AA7: 0 | AB7: =V7+P7 -> 0 | AC7: =W7+Q7 -> 0 | AD7: =X7+R7 -> 0 | AE7: =Y7+S7 -> 0 | AF7: =Z7+T7 -> 0 | AG7: =AA7+U7 -> 0
A8: 4 | B8: carlosjr | C8: 37816.748333333337 | D8: 0 | E8: 1 | F8: 0 | G8: 0 | H8: 0 | I8: 0 | J8: 0 | K8: 0 | L8: 0 | M8: 0 | N8: 0 | O8: 0 | P8: 0 | Q8: 0 | R8: 0 | S8: 0 | T8: 0 | U8: 0 | V8: 0 | W8: 0 | X8: 0 | Y8: 0 | Z8: 0 | AA8: 0 | AB8: =V8+P8 -> 0 | AC8: =W8+Q8 -> 0 | AD8: =X8+R8 -> 0 | AE8: =Y8+S8 -> 0 | AF8: =Z8+T8 -> 0 | AG8: =AA8+U8 -> 0
A9: 5 | B9: carlosjr | C9: 37817.704375000001 | D9: 0 | E9: 0 | F9: 1 | G9: 0 | H9: 0 | I9: 0 | J9: 0 | K9: 1 | L9: 0 | M9: 0 | N9: 0 | O9: 1 | P9: 0 | Q9: 0 | R9: 1 | S9: 1 | T9: 0 | U9: 0 | V9: 0 | W9: 0 | X9: 0 | Y9: 0 | Z9: 0 | AA9: 0 | AB9: =V9+P9 -> 0 | AC9: =W9+Q9 -> 0 | AD9: =X9+R9 -> 1 | AE9: =Y9+S9 -> 1 | AF9: =Z9+T9 -> 0 | AG9: =AA9+U9 -> 0
A10: 6 | B10: carlosjr | C10: 37817.710752314815 | D10: 0 | E10: 0 | F10: 8 | G10: 0 | H10: 0 | I10: 0 | J10: 0 | K10: 15 | L10: 0 | M10: 0 | N10: 0 | O10: 15 | P10: 0 | Q10: 0 | R10: 15 | S10: 15 | T10: 0 | U10: 0 | V10: 0 | W10: 0 | X10: 11 | Y10: 11 | Z10: 0 | AA10: 0 | AB10: =V10+P10 -> 0 | AC10: =W10+Q10 -> 0 | AD10: =X10+R10 -> 26 | AE10: =Y10+S10 -> 26 | AF10: =Z10+T10 -> 0 | AG10: =AA10+U10 -> 0
A11: 7 | B11: carlosjr | C11: 37817.741516203707 | D11: 0 | E11: 0 | F11: 5 | G11: 0 | H11: 0 | I11: 0 | J11: 0 | K11: 3 | L11: 0 | M11: 0 | N11: 0 | O11: 3 | P11: 0 | Q11: 0 | R11: 3 | S11: 3 | T11: 0 | U11: 0 | V11: 0 | W11: 0 | X11: 4 | Y11: 4 | Z11: 0 | AA11: 0 | AB11: =V11+P11 -> 0 | AC11: =W11+Q11 -> 0 | AD11: =X11+R11 -> 7 | AE11: =Y11+S11 -> 7 | AF11: =Z11+T11 -> 0 | AG11: =AA11+U11 -> 0
A12: 8 | B12: carlosjr | C12: 37820.602488425924 | D12: 0 | E12: 0 | F12: 8 | G12: 0 | H12: 0 | I12: 0 | J12: 0 | K12: 16 | L12: 0 | M12: 0 | N12: 0 | O12: 16 | P12: 0 | Q12: 0 | R12: 16 | S12: 16 | T12: 0 | U12: 0 | V12: 0 | W12: 0 | X12: 39 | Y12: 39 | Z12: 0 | AA12: 0 | AB12: =V12+P12 -> 0 | AC12: =W12+Q12 -> 0 | AD12: =X12+R12 -> 55 | AE12: =Y12+S12 -> 55 | AF12: =Z12+T12 -> 0 | AG12: =AA12+U12 -> 0
A13: 9 | B13: carlosjr | C13: 37831.613368055558 | D13: 0 | E13: 0 | F13: 7 | G13: 0 | H13: 0 | I13: 0 | J13: 0 | K13: 5 | L13: 0 | M13: 0 | N13: 0 | O13: 5 | P13: 0 | Q13: 0 | R13: 5 | S13: 5 | T13: 0 | U13: 0 | V13: 0 | W13: 0 | X13: 11 | Y13: 11 | Z13: 0 | AA13: 0 | AB13: =V13+P13 -> 0 | AC13: =W13+Q13 -> 0 | AD13: =X13+R13 -> 16 | AE13: =Y13+S13 -> 16 | AF13: =Z13+T13 -> 0 | AG13: =AA13+U13 -> 0
A14: 10 | B14: carlosjr | C14: 37832.559155092589 | D14: 0 | E14: 0 | F14: 5 | G14: 0 | H14: 0 | I14: 0 | J14: 0 | K14: 12 | L14: 0 | M14: 0 | N14: 0 | O14: 12 | P14: 0 | Q14: 0 | R14: 12 | S14: 12 | T14: 0 | U14: 0 | V14: 0 | W14: 0 | X14: 7 | Y14: 7 | Z14: 0 | AA14: 0 | AB14: =V14+P14 -> 0 | AC14: =W14+Q14 -> 0 | AD14: =X14+R14 -> 19 | AE14: =Y14+S14 -> 19 | AF14: =Z14+T14 -> 0 | AG14: =AA14+U14 -> 0
A15: 11 | B15: anapaula | C15: 37922.786261574074 | D15: 62 | E15: 0 | F15: 5 | G15: 0 | H15: 0 | I15: 0 | J15: 0 | K15: 3 | L15: 0 | M15: 0 | N15: 0 | O15: 3 | P15: 2 | Q15: 0 | R15: 3 | S15: 3 | T15: 0 | U15: 0 | V15: 55 | W15: 0 | X15: 4 | Y15: 4 | Z15: 0 | AA15: 0 | AB15: =V15+P15 -> 57 | AC15: =W15+Q15 -> 0 | AD15: =X15+R15 -> 7 | AE15: =Y15+S15 -> 7 | AF15: =Z15+T15 -> 0 | AG15: =AA15+U15 -> 0
A16: 12 | B16: natanael | C16: 37923.712754629632 | D16: 0 | E16: 0 | F16: 1 | G16: 0 | H16: 0 | I16: 0 | J16: 0 | K16: 2 | L16: 0 | M16: 0 | N16: 0 | O16: 2 | P16: 0 | Q16: 0 | R16: 2 | S16: 2 | T16: 0 | U16: 0 | V16: 0 | W16: 0 | X16: 8 | Y16: 8 | Z16: 0 | AA16: 0 | AB16: =V16+P16 -> 0 | AC16: =W16+Q16 -> 0 | AD16: =X16+R16 -> 10 | AE16: =Y16+S16 -> 10 | AF16: =Z16+T16 -> 0 | AG16: =AA16+U16 -> 0
A17: 13 | B17: natanael | C17: 37923.727407407408 | D17: 0 | E17: 0 | F17: 1 | G17: 0 | H17: 0 | I17: 0 | J17: 0 | K17: 1 | L17: 0 | M17: 0 | N17: 0 | O17: 1 | P17: 0 | Q17: 0 | R17: 1 | S17: 1 | T17: 0 | U17: 0 | V17: 0 | W17: 0 | X17: 12 | Y17: 12 | Z17: 0 | AA17: 0 | AB17: =V17+P17 -> 0 | AC17: =W17+Q17 -> 0 | AD17: =X17+R17 -> 13 | AE17: =Y17+S17 -> 13 | AF17: =Z17+T17 -> 0 | AG17: =AA17+U17 -> 0
A18: 14 | B18: murta | C18: 37930.733240740738 | D18: 0 | E18: 0 | F18: 1 | G18: 0 | H18: 0 | I18: 0 | J18: 0 | K18: 1 | L18: 0 | M18: 0 | N18: 0 | O18: 1 | P18: 0 | Q18: 0 | R18: 1 | S18: 1 | T18: 0 | U18: 0 | V18: 0 | W18: 0 | X18: 0 | Y18: 0 | Z18: 0 | AA18: 0 | AB18: =V18+P18 -> 0 | AC18: =W18+Q18 -> 0 | AD18: =X18+R18 -> 1 | AE18: =Y18+S18 -> 1 | AF18: =Z18+T18 -> 0 | AG18: =AA18+U18 -> 0
A19: 15 | B19: mangan | C19: 37940.053541666668 | D19: 0 | E19: 69 | F19: 2 | G19: 0 | H19: 0 | I19: 0 | J19: 0 | K19: 1 | L19: 0 | M19: 0 | N19: 0 | O19: 1 | P19: 0 | Q19: 0 | R19: 1 | S19: 1 | T19: 0 | U19: 0 | V19: 0 | W19: 0 | X19: 4 | Y19: 4 | Z19: 0 | AA19: 0 | AB19: =V19+P19 -> 0 | AC19: =W19+Q19 -> 0 | AD19: =X19+R19 -> 5 | AE19: =Y19+S19 -> 5 | AF19: =Z19+T19 -> 0 | AG19: =AA19+U19 -> 0
A20: 16 | B20: mangan | C20: 37940.0621875 | D20: 0 | E20: 0 | F20: 1 | G20: 0 | H20: 0 | I20: 0 | J20: 0 | K20: 1 | L20: 0 | M20: 0 | N20: 0 | O20: 1 | P20: 0 | Q20: 0 | R20: 1 | S20: 1 | T20: 0 | U20: 0 | V20: 0 | W20: 0 | X20: 4 | Y20: 4 | Z20: 0 | AA20: 0 | AB20: =V20+P20 -> 0 | AC20: =W20+Q20 -> 0 | AD20: =X20+R20 -> 5 | AE20: =Y20+S20 -> 5 | AF20: =Z20+T20 -> 0 | AG20: =AA20+U20 -> 0
A21: 17 | B21: mangan | C21: 37940.40353009259 | D21: 0 | E21: 0 | F21: 1 | G21: 0 | H21: 0 | I21: 0 | J21: 0 | K21: 1 | L21: 0 | M21: 0 | N21: 0 | O21: 1 | P21: 0 | Q21: 0 | R21: 1 | S21: 1 | T21: 0 | U21: 0 | V21: 0 | W21: 0 | X21: 4 | Y21: 4 | Z21: 0 | AA21: 0 | AB21: =V21+P21 -> 0 | AC21: =W21+Q21 -> 0 | AD21: =X21+R21 -> 5 | AE21: =Y21+S21 -> 5 | AF21: =Z21+T21 -> 0 | AG21: =AA21+U21 -> 0
A22: 18 | B22: mangan | C22: 37941.515208333331 | D22: 0 | E22: 1 | F22: 4 | G22: 0 | H22: 0 | I22: 0 | J22: 0 | K22: 8 | L22: 0 | M22: 0 | N22: 0 | O22: 8 | P22: 0 | Q22: 0 | R22: 8 | S22: 8 | T22: 0 | U22: 0 | V22: 0 | W22: 0 | X22: 49 | Y22: 50 | Z22: 0 | AA22: 0 | AB22: =V22+P22 -> 0 | AC22: =W22+Q22 -> 0 | AD22: =X22+R22 -> 57 | AE22: =Y22+S22 -> 58 | AF22: =Z22+T22 -> 0 | AG22: =AA22+U22 -> 0
A23: 19 | B23: mangan | C23: 37941.551770833335 | D23: 5 | E23: 0 | F23: 2 | G23: 0 | H23: 0 | I23: 0 | J23: 0 | K23: 0 | L23: 0 | M23: 0 | N23: 0 | O23: 0 | P23: 0 | Q23: 0 | R23: 0 | S23: 0 | T23: 0 | U23: 0 | V23: 0 | W23: 0 | X23: 0 | Y23: 0 | Z23: 0 | AA23: 0 | AB23: =V23+P23 -> 0 | AC23: =W23+Q23 -> 0 | AD23: =X23+R23 -> 0 | AE23: =Y23+S23 -> 0 | AF23: =Z23+T23 -> 0 | AG23: =AA23+U23 -> 0
A24: 20 | B24: mangan | C24: 37943.429120370369 | D24: 0 | E24: 0 | F24: 1 | G24: 0 | H24: 0 | I24: 0 | J24: 0 | K24: 1 | L24: 0 | M24: 0 | N24: 0 | O24: 1 | P24: 0 | Q24: 0 | R24: 1 | S24: 1 | T24: 0 | U24: 0 | V24: 0 | W24: 0 | X24: 5 | Y24: 5 | Z24: 0 | AA24: 0 | AB24: =V24+P24 -> 0 | AC24: =W24+Q24 -> 0 | AD24: =X24+R24 -> 6 | AE24: =Y24+S24 -> 6 | AF24: =Z24+T24 -> 0 | AG24: =AA24+U24 -> 0
A25: 21 | B25: murta | C25: 37950.01939814815 | D25: 0 | E25: 1 | F25: 0 | G25: 0 | H25: 0 | I25: 0 | J25: 0 | K25: 0 | L25: 0 | M25: 0 | N25: 0 | O25: 0 | P25: 0 | Q25: 0 | R25: 0 | S25: 0 | T25: 0 | U25: 0 | V25: 0 | W25: 0 | X25: 0 | Y25: 0 | Z25: 0 | AA25: 0 | AB25: =V25+P25 -> 0 | AC25: =W25+Q25 -> 0 | AD25: =X25+R25 -> 0 | AE25: =Y25+S25 -> 0 | AF25: =Z25+T25 -> 0 | AG25: =AA25+U25 -> 0
A26: 22 | B26: murta | C26: 37950.55574074074 | D26: 1 | E26: 0 | F26: 2 | G26: 0 | H26: 0 | I26: 0 | J26: 0 | K26: 0 | L26: 0 | M26: 0 | N26: 0 | O26: 0 | P26: 0 | Q26: 0 | R26: 0 | S26: 0 | T26: 0 | U26: 0 | V26: 0 | W26: 0 | X26: 0 | Y26: 0 | Z26: 0 | AA26: 0 | AB26: =V26+P26 -> 0 | AC26: =W26+Q26 -> 0 | AD26: =X26+R26 -> 0 | AE26: =Y26+S26 -> 0 | AF26: =Z26+T26 -> 0 | AG26: =AA26+U26 -> 0
A27: 23 | B27: murta | C27: 37950.657800925925 | D27: 24 | E27: 10 | F27: 5 | G27: 0 | H27: 0 | I27: 0 | J27: 0 | K27: 15 | L27: 0 | M27: 0 | N27: 0 | O27: 15 | P27: 0 | Q27: 0 | R27: 15 | S27: 15 | T27: 0 | U27: 0 | V27: 0 | W27: 0 | X27: 43 | Y27: 43 | Z27: 0 | AA27: 0 | AB27: =V27+P27 -> 0 | AC27: =W27+Q27 -> 0 | AD27: =X27+R27 -> 58 | AE27: =Y27+S27 -> 58 | AF27: =Z27+T27 -> 0 | AG27: =AA27+U27 -> 0
A28: 24 | B28: murta | C28: 37950.666724537034 | D28: 0 | E28: 7 | F28: 0 | G28: 0 | H28: 0 | I28: 0 | J28: 0 | K28: 0 | L28: 0 | M28: 0 | N28: 0 | O28: 0 | P28: 0 | Q28: 0 | R28: 0 | S28: 0 | T28: 0 | U28: 0 | V28: 0 | W28: 0 | X28: 0 | Y28: 0 | Z28: 0 | AA28: 0 | AB28: =V28+P28 -> 0 | AC28: =W28+Q28 -> 0 | AD28: =X28+R28 -> 0 | AE28: =Y28+S28 -> 0 | AF28: =Z28+T28 -> 0 | AG28: =AA28+U28 -> 0
A29: 25 | B29: natanael | C29: 37950.667962962965 | D29: 3 | E29: 0 | F29: 0 | G29: 0 | H29: 0 | I29: 0 | J29: 0 | K29: 1 | L29: 0 | M29: 0 | N29: 0 | O29: 1 | P29: 0 | Q29: 0 | R29: 1 | S29: 1 | T29: 0 | U29: 0 | V29: 0 | W29: 0 | X29: 12 | Y29: 9 | Z29: 0 | AA29: 0 | AB29: =V29+P29 -> 0 | AC29: =W29+Q29 -> 0 | AD29: =X29+R29 -> 13 | AE29: =Y29+S29 -> 10 | AF29: =Z29+T29 -> 0 | AG29: =AA29+U29 -> 0
A30: 26 | B30: natanael | C30: 37950.686180555553 | D30: 8 | E30: 0 | F30: 14 | G30: 0 | H30: 0 | I30: 0 | J30: 0 | K30: 90 | L30: 0 | M30: 0 | N30: 0 | O30: 90 | P30: 0 | Q30: 0 | R30: 90 | S30: 90 | T30: 0 | U30: 0 | V30: 0 | W30: 0 | X30: 70 | Y30: 62 | Z30: 0 | AA30: 0 | AB30: =V30+P30 -> 0 | AC30: =W30+Q30 -> 0 | AD30: =X30+R30 -> 160 | AE30: =Y30+S30 -> 152 | AF30: =Z30+T30 -> 0 | AG30: =AA30+U30 -> 0
A31: 27 | B31: murta | C31: 37950.705370370371 | D31: 0 | E31: 0 | F31: 370 | G31: 0 | H31: 0 | I31: 0 | J31: 0 | K31: 178 | L31: 0 | M31: 0 | N31: 0 | O31: 178 | P31: 0 | Q31: 0 | R31: 178 | S31: 178 | T31: 0 | U31: 0 | V31: 0 | W31: 0 | X31: 405 | Y31: 405 | Z31: 0 | AA31: 0 | AB31: =V31+P31 -> 0 | AC31: =W31+Q31 -> 0 | AD31: =X31+R31 -> 583 | AE31: =Y31+S31 -> 583 | AF31: =Z31+T31 -> 0 | AG31: =AA31+U31 -> 0
A32: 28 | B32: murta | C32: 37950.708599537036 | D32: 0 | E32: 0 | F32: 4 | G32: 0 | H32: 0 | I32: 0 | J32: 0 | K32: 23 | L32: 0 | M32: 0 | N32: 0 | O32: 23 | P32: 0 | Q32: 0 | R32: 23 | S32: 23 | T32: 0 | U32: 0 | V32: 0 | W32: 0 | X32: 16 | Y32: 16 | Z32: 0 | AA32: 0 | AB32: =V32+P32 -> 0 | AC32: =W32+Q32 -> 0 | AD32: =X32+R32 -> 39 | AE32: =Y32+S32 -> 39 | AF32: =Z32+T32 -> 0 | AG32: =AA32+U32 -> 0
A33: 29 | B33: murta | C33: 37950.710428240738 | D33: 0 | E33: 0 | F33: 9 | G33: 0 | H33: 0 | I33: 0 | J33: 0 | K33: 13 | L33: 0 | M33: 0 | N33: 0 | O33: 13 | P33: 0 | Q33: 0 | R33: 13 | S33: 13 | T33: 0 | U33: 0 | V33: 0 | W33: 0 | X33: 31 | Y33: 31 | Z33: 0 | AA33: 0 | AB33: =V33+P33 -> 0 | AC33: =W33+Q33 -> 0 | AD33: =X33+R33 -> 44 | AE33: =Y33+S33 -> 44 | AF33: =Z33+T33 -> 0 | AG33: =AA33+U33 -> 0
A34: 30 | B34: natanael | C34: 37950.710995370369 | D34: 1 | E34: 0 | F34: 0 | G34: 0 | H34: 0 | I34: 0 | J34: 0 | K34: 1 | L34: 0 | M34: 0 | N34: 0 | O34: 1 | P34: 0 | Q34: 0 | R34: 1 | S34: 1 | T34: 0 | U34: 0 | V34: 0 | W34: 0 | X34: 17 | Y34: 16 | Z34: 0 | AA34: 0 | AB34: =V34+P34 -> 0 | AC34: =W34+Q34 -> 0 | AD34: =X34+R34 -> 18 | AE34: =Y34+S34 -> 17 | AF34: =Z34+T34 -> 0 | AG34: =AA34+U34 -> 0
A35: 31 | B35: natanael | C35: 37950.71130787037 | D35: 1 | E35: 0 | F35: 0 | G35: 0 | H35: 0 | I35: 0 | J35: 0 | K35: 1 | L35: 0 | M35: 0 | N35: 0 | O35: 1 | P35: 0 | Q35: 0 | R35: 1 | S35: 1 | T35: 0 | U35: 0 | V35: 0 | W35: 0 | X35: 18 | Y35: 17 | Z35: 0 | AA35: 0 | AB35: =V35+P35 -> 0 | AC35: =W35+Q35 -> 0 | AD35: =X35+R35 -> 19 | AE35: =Y35+S35 -> 18 | AF35: =Z35+T35 -> 0 | AG35: =AA35+U35 -> 0
A36: 32 | B36: murta | C36: 37950.718518518515 | D36: 148 | E36: 0 | F36: 1 | G36: 0 | H36: 0 | I36: 0 | J36: 0 | K36: 0 | L36: 0 | M36: 0 | N36: 0 | O36: 0 | P36: 0 | Q36: 0 | R36: 0 | S36: 0 | T36: 12 | U36: 12 | V36: 0 | W36: 0 | X36: 0 | Y36: 0 | Z36: 113 | AA36: 113 | AB36: =V36+P36 -> 0 | AC36: =W36+Q36 -> 0 | AD36: =X36+R36 -> 0 | AE36: =Y36+S36 -> 0 | AF36: =Z36+T36 -> 125 | AG36: =AA36+U36 -> 125
A37: 33 | B37: murta | C37: 37950.729490740741 | D37: 0 | E37: 0 | F37: 1 | G37: 0 | H37: 0 | I37: 0 | J37: 0 | K37: 0 | L37: 0 | M37: 0 | N37: 0 | O37: 0 | P37: 0 | Q37: 0 | R37: 0 | S37: 0 | T37: 0 | U37: 0 | V37: 0 | W37: 0 | X37: 0 | Y37: 0 | Z37: 0 | AA37: 0 | AB37: =V37+P37 -> 0 | AC37: =W37+Q37 -> 0 | AD37: =X37+R37 -> 0 | AE37: =Y37+S37 -> 0 | AF37: =Z37+T37 -> 0 | AG37: =AA37+U37 -> 0
A38: 34 | B38: murta | C38: 37950.767534722225 | D38: 0 | E38: 2 | F38: 1 | G38: 0 | H38: 0 | I38: 0 | J38: 0 | K38: 12 | L38: 0 | M38: 0 | N38: 0 | O38: 12 | P38: 0 | Q38: 0 | R38: 12 | S38: 12 | T38: 0 | U38: 0 | V38: 0 | W38: 0 | X38: 16 | Y38: 18 | Z38: 0 | AA38: 0 | AB38: =V38+P38 -> 0 | AC38: =W38+Q38 -> 0 | AD38: =X38+R38 -> 28 | AE38: =Y38+S38 -> 30 | AF38: =Z38+T38 -> 0 | AG38: =AA38+U38 -> 0
A39: 35 | B39: regiane | C39: 37950.79859953704 | D39: 8 | E39: 0 | F39: 0 | G39: 0 | H39: 0 | I39: 0 | J39: 0 | K39: 1 | L39: 0 | M39: 0 | N39: 0 | O39: 1 | P39: 0 | Q39: 0 | R39: 1 | S39: 1 | T39: 0 | U39: 0 | V39: 0 | W39: 0 | X39: 32 | Y39: 24 | Z39: 0 | AA39: 0 | AB39: =V39+P39 -> 0 | AC39: =W39+Q39 -> 0 | AD39: =X39+R39 -> 33 | AE39: =Y39+S39 -> 25 | AF39: =Z39+T39 -> 0 | AG39: =AA39+U39 -> 0
A40: 36 | B40: regiane | C40: 37950.799131944441 | D40: 0 | E40: 0 | F40: 1 | G40: 0 | H40: 0 | I40: 0 | J40: 0 | K40: 1 | L40: 0 | M40: 0 | N40: 0 | O40: 1 | P40: 0 | Q40: 0 | R40: 1 | S40: 1 | T40: 0 | U40: 0 | V40: 0 | W40: 0 | X40: 4 | Y40: 4 | Z40: 0 | AA40: 0 | AB40: =V40+P40 -> 0 | AC40: =W40+Q40 -> 0 | AD40: =X40+R40 -> 5 | AE40: =Y40+S40 -> 5 | AF40: =Z40+T40 -> 0 | AG40: =AA40+U40 -> 0
A41: 37 | B41: cristine | C41: 37951.419050925928 | D41: 0 | E41: 0 | F41: 5 | G41: 0 | H41: 0 | I41: 0 | J41: 0 | K41: 3 | L41: 0 | M41: 0 | N41: 0 | O41: 3 | P41: 0 | Q41: 0 | R41: 3 | S41: 3 | T41: 0 | U41: 0 | V41: 0 | W41: 0 | X41: 17 | Y41: 17 | Z41: 0 | AA41: 0 | AB41: =V41+P41 -> 0 | AC41: =W41+Q41 -> 0 | AD41: =X41+R41 -> 20 | AE41: =Y41+S41 -> 20 | AF41: =Z41+T41 -> 0 | AG41: =AA41+U41 -> 0
A42: 38 | B42: cristine | C42: 37951.421018518522 | D42: 0 | E42: 0 | F42: 3 | G42: 0 | H42: 0 | I42: 0 | J42: 0 | K42: 2 | L42: 0 | M42: 0 | N42: 0 | O42: 2 | P42: 0 | Q42: 0 | R42: 2 | S42: 2 | T42: 0 | U42: 0 | V42: 0 | W42: 0 | X42: 16 | Y42: 16 | Z42: 0 | AA42: 0 | AB42: =V42+P42 -> 0 | AC42: =W42+Q42 -> 0 | AD42: =X42+R42 -> 18 | AE42: =Y42+S42 -> 18 | AF42: =Z42+T42 -> 0 | AG42: =AA42+U42 -> 0
A43: 39 | B43: cristine | C43: 37951.42224537037 | D43: 1 | E43: 0 | F43: 3 | G43: 0 | H43: 0 | I43: 0 | J43: 0 | K43: 14 | L43: 0 | M43: 0 | N43: 0 | O43: 14 | P43: 0 | Q43: 0 | R43: 14 | S43: 14 | T43: 0 | U43: 0 | V43: 0 | W43: 0 | X43: 31 | Y43: 30 | Z43: 0 | AA43: 0 | AB43: =V43+P43 -> 0 | AC43: =W43+Q43 -> 0 | AD43: =X43+R43 -> 45 | AE43: =Y43+S43 -> 44 | AF43: =Z43+T43 -> 0 | AG43: =AA43+U43 -> 0
A44: 40 | B44: murta | C44: 37951.696226851855 | D44: 554 | E44: 3 | F44: 4 | G44: 0 | H44: 0 | I44: 0 | J44: 0 | K44: 207 | L44: 0 | M44: 0 | N44: 0 | O44: 207 | P44: 0 | Q44: 0 | R44: 207 | S44: 207 | T44: 0 | U44: 1 | V44: 0 | W44: 0 | X44: 442 | Y44: 411 | Z44: 0 | AA44: 3 | AB44: =V44+P44 -> 0 | AC44: =W44+Q44 -> 0 | AD44: =X44+R44 -> 649 | AE44: =Y44+S44 -> 618 | AF44: =Z44+T44 -> 0 | AG44: =AA44+U44 -> 4
A45: 41 | B45: murta | C45: 37951.711481481485 | D45: 0 | E45: 6 | F45: 0 | G45: 0 | H45: 0 | I45: 0 | J45: 0 | K45: 0 | L45: 0 | M45: 0 | N45: 0 | O45: 0 | P45: 0 | Q45: 0 | R45: 0 | S45: 0 | T45: 0 | U45: 0 | V45: 0 | W45: 0 | X45: 0 | Y45: 0 | Z45: 0 | AA45: 0 | AB45: =V45+P45 -> 0 | AC45: =W45+Q45 -> 0 | AD45: =X45+R45 -> 0 | AE45: =Y45+S45 -> 0 | AF45: =Z45+T45 -> 0 | AG45: =AA45+U45 -> 0
A46: 42 | B46: murta | C46: 37951.717812499999 | D46: 0 | E46: 0 | F46: 1 | G46: 0 | H46: 0 | I46: 0 | J46: 0 | K46: 0 | L46: 0 | M46: 0 | N46: 0 | O46: 0 | P46: 0 | Q46: 0 | R46: 0 | S46: 0 | T46: 0 | U46: 0 | V46: 0 | W46: 0 | X46: 0 | Y46: 0 | Z46: 0 | AA46: 0 | AB46: =V46+P46 -> 0 | AC46: =W46+Q46 -> 0 | AD46: =X46+R46 -> 0 | AE46: =Y46+S46 -> 0 | AF46: =Z46+T46 -> 0 | AG46: =AA46+U46 -> 0
A47: 43 | B47: murta | C47: 37951.726875 | D47: 1 | E47: 0 | F47: 3 | G47: 0 | H47: 0 | I47: 0 | J47: 0 | K47: 0 | L47: 0 | M47: 0 | N47: 0 | O47: 0 | P47: 0 | Q47: 0 | R47: 0 | S47: 0 | T47: 0 | U47: 0 | V47: 0 | W47: 0 | X47: 0 | Y47: 0 | Z47: 0 | AA47: 0 | AB47: =V47+P47 -> 0 | AC47: =W47+Q47 -> 0 | AD47: =X47+R47 -> 0 | AE47: =Y47+S47 -> 0 | AF47: =Z47+T47 -> 0 | AG47: =AA47+U47 -> 0
A48: 44 | B48: murta | C48: 37951.741875 | D48: 8 | E48: 0 | F48: 2 | G48: 0 | H48: 0 | I48: 0 | J48: 0 | K48: 0 | L48: 0 | M48: 0 | N48: 0 | O48: 0 | P48: 0 | Q48: 0 | R48: 0 | S48: 0 | T48: 0 | U48: 0 | V48: 0 | W48: 0 | X48: 0 | Y48: 0 | Z48: 0 | AA48: 0 | AB48: =V48+P48 -> 0 | AC48: =W48+Q48 -> 0 | AD48: =X48+R48 -> 0 | AE48: =Y48+S48 -> 0 | AF48: =Z48+T48 -> 0 | AG48: =AA48+U48 -> 0
A49: 45 | B49: carlosjr | C49: 37952.726689814815 | D49: 0 | E49: 0 | F49: 2 | G49: 0 | H49: 0 | I49: 0 | J49: 0 | K49: 1 | L49: 0 | M49: 0 | N49: 0 | O49: 1 | P49: 0 | Q49: 0 | R49: 1 | S49: 1 | T49: 0 | U49: 0 | V49: 0 | W49: 0 | X49: 35 | Y49: 35 | Z49: 0 | AA49: 0 | AB49: =V49+P49 -> 0 | AC49: =W49+Q49 -> 0 | AD49: =X49+R49 -> 36 | AE49: =Y49+S49 -> 36 | AF49: =Z49+T49 -> 0 | AG49: =AA49+U49 -> 0
A50: 46 | B50: natanael | C50: 37952.775972222225 | D50: 0 | E50: 0 | F50: 1 | G50: 0 | H50: 0 | I50: 0 | J50: 0 | K50: 1 | L50: 0 | M50: 0 | N50: 0 | O50: 1 | P50: 0 | Q50: 0 | R50: 1 | S50: 1 | T50: 0 | U50: 0 | V50: 0 | W50: 0 | X50: 6 | Y50: 6 | Z50: 0 | AA50: 0 | AB50: =V50+P50 -> 0 | AC50: =W50+Q50 -> 0 | AD50: =X50+R50 -> 7 | AE50: =Y50+S50 -> 7 | AF50: =Z50+T50 -> 0 | AG50: =AA50+U50 -> 0
A51: 47 | B51: murta | C51: 37953.56627314815 | D51: 2 | E51: 0 | F51: 2 | G51: 0 | H51: 0 | I51: 0 | J51: 0 | K51: 0 | L51: 0 | M51: 0 | N51: 0 | O51: 0 | P51: 0 | Q51: 0 | R51: 0 | S51: 0 | T51: 0 | U51: 0 | V51: 0 | W51: 0 | X51: 0 | Y51: 0 | Z51: 0 | AA51: 0 | AB51: =V51+P51 -> 0 | AC51: =W51+Q51 -> 0 | AD51: =X51+R51 -> 0 | AE51: =Y51+S51 -> 0 | AF51: =Z51+T51 -> 0 | AG51: =AA51+U51 -> 0
A52: 48 | B52: murta | C52: 37953.56994212963 | D52: 0 | E52: 0 | F52: 1 | G52: 0 | H52: 0 | I52: 0 | J52: 0 | K52: 0 | L52: 0 | M52: 0 | N52: 0 | O52: 0 | P52: 0 | Q52: 0 | R52: 0 | S52: 0 | T52: 0 | U52: 0 | V52: 0 | W52: 0 | X52: 0 | Y52: 0 | Z52: 0 | AA52: 0 | AB52: =V52+P52 -> 0 | AC52: =W52+Q52 -> 0 | AD52: =X52+R52 -> 0 | AE52: =Y52+S52 -> 0 | AF52: =Z52+T52 -> 0 | AG52: =AA52+U52 -> 0
A53: 49 | B53: murta | C53: 37953.630983796298 | D53: 0 | E53: 0 | F53: 1 | G53: 0 | H53: 0 | I53: 0 | J53: 0 | K53: 0 | L53: 0 | M53: 0 | N53: 0 | O53: 0 | P53: 0 | Q53: 0 | R53: 0 | S53: 0 | T53: 0 | U53: 0 | V53: 0 | W53: 0 | X53: 0 | Y53: 0 | Z53: 0 | AA53: 0 | AB53: =V53+P53 -> 0 | AC53: =W53+Q53 -> 0 | AD53: =X53+R53 -> 0 | AE53: =Y53+S53 -> 0 | AF53: =Z53+T53 -> 0 | AG53: =AA53+U53 -> 0
A54: 50 | B54: cristine | C54: 37953.704664351855 | D54: 1 | E54: 0 | F54: 6 | G54: 0 | H54: 0 | I54: 0 | J54: 0 | K54: 17 | L54: 0 | M54: 0 | N54: 0 | O54: 17 | P54: 0 | Q54: 0 | R54: 17 | S54: 17 | T54: 0 | U54: 0 | V54: 0 | W54: 0 | X54: 44 | Y54: 43 | Z54: 0 | AA54: 0 | AB54: =V54+P54 -> 0 | AC54: =W54+Q54 -> 0 | AD54: =X54+R54 -> 61 | AE54: =Y54+S54 -> 60 | AF54: =Z54+T54 -> 0 | AG54: =AA54+U54 -> 0
A55: 51 | B55: murta | C55: 37953.762118055558 | D55: 0 | E55: 0 | F55: 7 | G55: 0 | H55: 0 | I55: 0 | J55: 0 | K55: 54 | L55: 0 | M55: 0 | N55: 0 | O55: 54 | P55: 0 | Q55: 0 | R55: 54 | S55: 54 | T55: 0 | U55: 0 | V55: 0 | W55: 0 | X55: 39 | Y55: 39 | Z55: 0 | AA55: 0 | AB55: =V55+P55 -> 0 | AC55: =W55+Q55 -> 0 | AD55: =X55+R55 -> 93 | AE55: =Y55+S55 -> 93 | AF55: =Z55+T55 -> 0 | AG55: =AA55+U55 -> 0
A56: 52 | B56: cristine | C56: 37956.45689814815 | D56: 0 | E56: 0 | F56: 4 | G56: 0 | H56: 0 | I56: 0 | J56: 0 | K56: 3 | L56: 0 | M56: 0 | N56: 0 | O56: 3 | P56: 0 | Q56: 0 | R56: 3 | S56: 3 | T56: 0 | U56: 0 | V56: 0 | W56: 0 | X56: 13 | Y56: 13 | Z56: 0 | AA56: 0 | AB56: =V56+P56 -> 0 | AC56: =W56+Q56 -> 0 | AD56: =X56+R56 -> 16 | AE56: =Y56+S56 -> 16 | AF56: =Z56+T56 -> 0 | AG56: =AA56+U56 -> 0
A57: 53 | B57: natanael | C57: 37956.741041666668 | D57: 1 | E57: 0 | F57: 0 | G57: 0 | H57: 0 | I57: 0 | J57: 0 | K57: 1 | L57: 0 | M57: 0 | N57: 0 | O57: 1 | P57: 0 | Q57: 0 | R57: 1 | S57: 1 | T57: 0 | U57: 0 | V57: 0 | W57: 0 | X57: 7 | Y57: 6 | Z57: 0 | AA57: 0 | AB57: =V57+P57 -> 0 | AC57: =W57+Q57 -> 0 | AD57: =X57+R57 -> 8 | AE57: =Y57+S57 -> 7 | AF57: =Z57+T57 -> 0 | AG57: =AA57+U57 -> 0
A58: 54 | B58: natanael | C58: 37956.743935185186 | D58: 0 | E58: 0 | F58: 1 | G58: 0 | H58: 0 | I58: 0 | J58: 0 | K58: 11 | L58: 0 | M58: 0 | N58: 0 | O58: 11 | P58: 0 | Q58: 0 | R58: 11 | S58: 11 | T58: 0 | U58: 0 | V58: 0 | W58: 0 | X58: 0 | Y58: 0 | Z58: 0 | AA58: 0 | AB58: =V58+P58 -> 0 | AC58: =W58+Q58 -> 0 | AD58: =X58+R58 -> 11 | AE58: =Y58+S58 -> 11 | AF58: =Z58+T58 -> 0 | AG58: =AA58+U58 -> 0
A59: 55 | B59: natanael | C59: 37956.745219907411 | D59: 0 | E59: 0 | F59: 1 | G59: 0 | H59: 0 | I59: 0 | J59: 0 | K59: 1 | L59: 0 | M59: 0 | N59: 0 | O59: 1 | P59: 0 | Q59: 0 | R59: 1 | S59: 1 | T59: 0 | U59: 0 | V59: 0 | W59: 0 | X59: 7 | Y59: 7 | Z59: 0 | AA59: 0 | AB59: =V59+P59 -> 0 | AC59: =W59+Q59 -> 0 | AD59: =X59+R59 -> 8 | AE59: =Y59+S59 -> 8 | AF59: =Z59+T59 -> 0 | AG59: =AA59+U59 -> 0
A60: 56 | B60: natanael | C60: 37956.746400462966 | D60: 0 | E60: 0 | F60: 1 | G60: 0 | H60: 0 | I60: 0 | J60: 0 | K60: 1 | L60: 0 | M60: 0 | N60: 0 | O60: 1 | P60: 0 | Q60: 0 | R60: 1 | S60: 1 | T60: 0 | U60: 0 | V60: 0 | W60: 0 | X60: 7 | Y60: 7 | Z60: 0 | AA60: 0 | AB60: =V60+P60 -> 0 | AC60: =W60+Q60 -> 0 | AD60: =X60+R60 -> 8 | AE60: =Y60+S60 -> 8 | AF60: =Z60+T60 -> 0 | AG60: =AA60+U60 -> 0
A61: 57 | B61: natanael | C61: 37956.748819444445 | D61: 0 | E61: 0 | F61: 1 | G61: 0 | H61: 0 | I61: 0 | J61: 0 | K61: 1 | L61: 0 | M61: 0 | N61: 0 | O61: 1 | P61: 0 | Q61: 0 | R61: 1 | S61: 1 | T61: 0 | U61: 0 | V61: 0 | W61: 0 | X61: 16 | Y61: 16 | Z61: 0 | AA61: 0 | AB61: =V61+P61 -> 0 | AC61: =W61+Q61 -> 0 | AD61: =X61+R61 -> 17 | AE61: =Y61+S61 -> 17 | AF61: =Z61+T61 -> 0 | AG61: =AA61+U61 -> 0
A62: 58 | B62: natanael | C62: 37956.750833333332 | D62: 0 | E62: 0 | F62: 3 | G62: 0 | H62: 0 | I62: 0 | J62: 0 | K62: 1 | L62: 0 | M62: 0 | N62: 0 | O62: 1 | P62: 0 | Q62: 0 | R62: 1 | S62: 1 | T62: 0 | U62: 0 | V62: 0 | W62: 0 | X62: 16 | Y62: 16 | Z62: 0 | AA62: 0 | AB62: =V62+P62 -> 0 | AC62: =W62+Q62 -> 0 | AD62: =X62+R62 -> 17 | AE62: =Y62+S62 -> 17 | AF62: =Z62+T62 -> 0 | AG62: =AA62+U62 -> 0
A63: 59 | B63: natanael | C63: 37956.789618055554 | D63: 3 | E63: 0 | F63: 0 | G63: 0 | H63: 0 | I63: 0 | J63: 0 | K63: 0 | L63: 0 | M63: 0 | N63: 0 | O63: 0 | P63: 0 | Q63: 0 | R63: 0 | S63: 0 | T63: 0 | U63: 0 | V63: 0 | W63: 0 | X63: 0 | Y63: 0 | Z63: 3 | AA63: 0 | AB63: =V63+P63 -> 0 | AC63: =W63+Q63 -> 0 | AD63: =X63+R63 -> 0 | AE63: =Y63+S63 -> 0 | AF63: =Z63+T63 -> 3 | AG63: =AA63+U63 -> 0
A64: 60 | B64: natanael | C64: 37956.810902777775 | D64: 0 | E64: 0 | F64: 1 | G64: 0 | H64: 0 | I64: 0 | J64: 0 | K64: 1 | L64: 0 | M64: 0 | N64: 0 | O64: 1 | P64: 0 | Q64: 0 | R64: 1 | S64: 1 | T64: 0 | U64: 0 | V64: 0 | W64: 0 | X64: 9 | Y64: 9 | Z64: 0 | AA64: 0 | AB64: =V64+P64 -> 0 | AC64: =W64+Q64 -> 0 | AD64: =X64+R64 -> 10 | AE64: =Y64+S64 -> 10 | AF64: =Z64+T64 -> 0 | AG64: =AA64+U64 -> 0
A65: 61 | B65: natanael | C65: 37956.811226851853 | D65: 0 | E65: 0 | F65: 2 | G65: 0 | H65: 0 | I65: 0 | J65: 0 | K65: 22 | L65: 0 | M65: 0 | N65: 0 | O65: 22 | P65: 0 | Q65: 0 | R65: 22 | S65: 22 | T65: 0 | U65: 0 | V65: 0 | W65: 0 | X65: 39 | Y65: 39 | Z65: 0 | AA65: 0 | AB65: =V65+P65 -> 0 | AC65: =W65+Q65 -> 0 | AD65: =X65+R65 -> 61 | AE65: =Y65+S65 -> 61 | AF65: =Z65+T65 -> 0 | AG65: =AA65+U65 -> 0
A66: 62 | B66: natanael | C66: 37956.814942129633 | D66: 6 | E66: 0 | F66: 0 | G66: 0 | H66: 0 | I66: 0 | J66: 0 | K66: 0 | L66: 0 | M66: 0 | N66: 0 | O66: 0 | P66: 0 | Q66: 0 | R66: 0 | S66: 0 | T66: 0 | U66: 0 | V66: 0 | W66: 0 | X66: 0 | Y66: 0 | Z66: 6 | AA66: 0 | AB66: =V66+P66 -> 0 | AC66: =W66+Q66 -> 0 | AD66: =X66+R66 -> 0 | AE66: =Y66+S66 -> 0 | AF66: =Z66+T66 -> 6 | AG66: =AA66+U66 -> 0
A67: 63 | B67: murta | C67: 37957.876585648148 | D67: 10 | E67: 0 | F67: 5 | G67: 0 | H67: 0 | I67: 0 | J67: 0 | K67: 45 | L67: 0 | M67: 0 | N67: 0 | O67: 45 | P67: 0 | Q67: 0 | R67: 45 | S67: 45 | T67: 8 | U67: 0 | V67: 0 | W67: 0 | X67: 39 | Y67: 39 | Z67: 7 | AA67: 0 | AB67: =V67+P67 -> 0 | AC67: =W67+Q67 -> 0 | AD67: =X67+R67 -> 84 | AE67: =Y67+S67 -> 84 | AF67: =Z67+T67 -> 15 | AG67: =AA67+U67 -> 0
A68: 64 | B68: cristine | C68: 37958.067523148151 | D68: 0 | E68: 0 | F68: 5 | G68: 0 | H68: 0 | I68: 0 | J68: 0 | K68: 3 | L68: 0 | M68: 0 | N68: 0 | O68: 3 | P68: 0 | Q68: 0 | R68: 3 | S68: 3 | T68: 0 | U68: 0 | V68: 0 | W68: 0 | X68: 13 | Y68: 13 | Z68: 0 | AA68: 0 | AB68: =V68+P68 -> 0 | AC68: =W68+Q68 -> 0 | AD68: =X68+R68 -> 16 | AE68: =Y68+S68 -> 16 | AF68: =Z68+T68 -> 0 | AG68: =AA68+U68 -> 0
A69: 65 | B69: murta | C69: 37958.770277777781 | D69: 1 | E69: 0 | F69: 6 | G69: 0 | H69: 0 | I69: 0 | J69: 0 | K69: 3 | L69: 0 | M69: 0 | N69: 0 | O69: 3 | P69: 0 | Q69: 0 | R69: 3 | S69: 3 | T69: 0 | U69: 0 | V69: 0 | W69: 0 | X69: 38 | Y69: 37 | Z69: 0 | AA69: 0 | AB69: =V69+P69 -> 0 | AC69: =W69+Q69 -> 0 | AD69: =X69+R69 -> 41 | AE69: =Y69+S69 -> 40 | AF69: =Z69+T69 -> 0 | AG69: =AA69+U69 -> 0
A70: 66 | B70: natanael | C70: 37959.619733796295 | D70: 2 | E70: 0 | F70: 0 | G70: 0 | H70: 0 | I70: 0 | J70: 0 | K70: 0 | L70: 0 | M70: 0 | N70: 0 | O70: 0 | P70: 0 | Q70: 0 | R70: 0 | S70: 0 | T70: 0 | U70: 0 | V70: 0 | W70: 0 | X70: 0 | Y70: 0 | Z70: 2 | AA70: 0 | AB70: =V70+P70 -> 0 | AC70: =W70+Q70 -> 0 | AD70: =X70+R70 -> 0 | AE70: =Y70+S70 -> 0 | AF70: =Z70+T70 -> 2 | AG70: =AA70+U70 -> 0
A71: 67 | B71: regiane | C71: 37959.694791666669 | D71: 1 | E71: 0 | F71: 6 | G71: 0 | H71: 0 | I71: 0 | J71: 0 | K71: 1 | L71: 0 | M71: 0 | N71: 0 | O71: 1 | P71: 0 | Q71: 0 | R71: 1 | S71: 1 | T71: 0 | U71: 0 | V71: 0 | W71: 0 | X71: 33 | Y71: 32 | Z71: 0 | AA71: 0 | AB71: =V71+P71 -> 0 | AC71: =W71+Q71 -> 0 | AD71: =X71+R71 -> 34 | AE71: =Y71+S71 -> 33 | AF71: =Z71+T71 -> 0 | AG71: =AA71+U71 -> 0
A72: 68 | B72: murta | C72: 37959.925023148149 | D72: 10 | E72: 3 | F72: 20 | G72: 0 | H72: 0 | I72: 0 | J72: 0 | K72: 60 | L72: 0 | M72: 0 | N72: 0 | O72: 60 | P72: 0 | Q72: 0 | R72: 60 | S72: 60 | T72: 0 | U72: 0 | V72: 0 | W72: 0 | X72: 56 | Y72: 57 | Z72: 10 | AA72: 2 | AB72: =V72+P72 -> 0 | AC72: =W72+Q72 -> 0 | AD72: =X72+R72 -> 116 | AE72: =Y72+S72 -> 117 | AF72: =Z72+T72 -> 10 | AG72: =AA72+U72 -> 2
A73: 69 | B73: lages | C73: 37960.002939814818 | D73: 5 | E73: 0 | F73: 1 | G73: 0 | H73: 0 | I73: 0 | J73: 0 | K73: 0 | L73: 0 | M73: 0 | N73: 0 | O73: 0 | P73: 0 | Q73: 0 | R73: 0 | S73: 0 | T73: 1 | U73: 0 | V73: 0 | W73: 0 | X73: 0 | Y73: 0 | Z73: 4 | AA73: 0 | AB73: =V73+P73 -> 0 | AC73: =W73+Q73 -> 0 | AD73: =X73+R73 -> 0 | AE73: =Y73+S73 -> 0 | AF73: =Z73+T73 -> 5 | AG73: =AA73+U73 -> 0
A74: 70 | B74: lages | C74: 37960.100023148145 | D74: 4 | E74: 0 | F74: 0 | G74: 0 | H74: 0 | I74: 0 | J74: 0 | K74: 0 | L74: 0 | M74: 0 | N74: 0 | O74: 0 | P74: 0 | Q74: 0 | R74: 0 | S74: 0 | T74: 0 | U74: 0 | V74: 0 | W74: 0 | X74: 0 | Y74: 0 | Z74: 0 | AA74: 0 | AB74: =V74+P74 -> 0 | AC74: =W74+Q74 -> 0 | AD74: =X74+R74 -> 0 | AE74: =Y74+S74 -> 0 | AF74: =Z74+T74 -> 0 | AG74: =AA74+U74 -> 0
A75: 71 | B75: natanael | C75: 37960.837905092594 | D75: 0 | E75: 2 | F75: 0 | G75: 0 | H75: 0 | I75: 0 | J75: 0 | K75: 0 | L75: 0 | M75: 0 | N75: 0 | O75: 0 | P75: 0 | Q75: 0 | R75: 0 | S75: 0 | T75: 0 | U75: 0 | V75: 0 | W75: 0 | X75: 0 | Y75: 0 | Z75: 0 | AA75: 2 | AB75: =V75+P75 -> 0 | AC75: =W75+Q75 -> 0 | AD75: =X75+R75 -> 0 | AE75: =Y75+S75 -> 0 | AF75: =Z75+T75 -> 0 | AG75: =AA75+U75 -> 2
A76: 72 | B76: natanael | C76: 37960.841620370367 | D76: 0 | E76: 1 | F76: 0 | G76: 0 | H76: 0 | I76: 0 | J76: 0 | K76: 1 | L76: 0 | M76: 0 | N76: 0 | O76: 1 | P76: 0 | Q76: 0 | R76: 1 | S76: 1 | T76: 0 | U76: 0 | V76: 0 | W76: 0 | X76: 6 | Y76: 7 | Z76: 0 | AA76: 0 | AB76: =V76+P76 -> 0 | AC76: =W76+Q76 -> 0 | AD76: =X76+R76 -> 7 | AE76: =Y76+S76 -> 8 | AF76: =Z76+T76 -> 0 | AG76: =AA76+U76 -> 0
A77: 73 | B77: murta | C77: 37961.457430555558 | D77: 0 | E77: 5 | F77: 1 | G77: 0 | H77: 0 | I77: 0 | J77: 0 | K77: 0 | L77: 0 | M77: 0 | N77: 0 | O77: 0 | P77: 0 | Q77: 0 | R77: 0 | S77: 0 | T77: 0 | U77: 1 | V77: 0 | W77: 0 | X77: 0 | Y77: 0 | Z77: 0 | AA77: 4 | AB77: =V77+P77 -> 0 | AC77: =W77+Q77 -> 0 | AD77: =X77+R77 -> 0 | AE77: =Y77+S77 -> 0 | AF77: =Z77+T77 -> 0 | AG77: =AA77+U77 -> 5
A78: 74 | B78: murta | C78: 37961.516018518516 | D78: 3 | E78: 4 | F78: 6 | G78: 0 | H78: 0 | I78: 0 | J78: 0 | K78: 12 | L78: 0 | M78: 0 | N78: 0 | O78: 12 | P78: 0 | Q78: 0 | R78: 12 | S78: 12 | T78: 0 | U78: 0 | V78: 0 | W78: 0 | X78: 44 | Y78: 44 | Z78: 3 | AA78: 4 | AB78: =V78+P78 -> 0 | AC78: =W78+Q78 -> 0 | AD78: =X78+R78 -> 56 | AE78: =Y78+S78 -> 56 | AF78: =Z78+T78 -> 3 | AG78: =AA78+U78 -> 4
A79: 75 | B79: murta | C79: 37961.568090277775 | D79: 0 | E79: 0 | F79: 1 | G79: 0 | H79: 0 | I79: 0 | J79: 0 | K79: 1 | L79: 0 | M79: 0 | N79: 0 | O79: 1 | P79: 0 | Q79: 0 | R79: 1 | S79: 1 | T79: 0 | U79: 0 | V79: 0 | W79: 0 | X79: 5 | Y79: 5 | Z79: 0 | AA79: 0 | AB79: =V79+P79 -> 0 | AC79: =W79+Q79 -> 0 | AD79: =X79+R79 -> 6 | AE79: =Y79+S79 -> 6 | AF79: =Z79+T79 -> 0 | AG79: =AA79+U79 -> 0
A80: 76 | B80: murta | C80: 37961.849745370368 | D80: 3 | E80: 0 | F80: 6 | G80: 0 | H80: 0 | I80: 0 | J80: 0 | K80: 14 | L80: 0 | M80: 0 | N80: 0 | O80: 14 | P80: 0 | Q80: 0 | R80: 14 | S80: 14 | T80: 0 | U80: 0 | V80: 0 | W80: 0 | X80: 51 | Y80: 48 | Z80: 0 | AA80: 0 | AB80: =V80+P80 -> 0 | AC80: =W80+Q80 -> 0 | AD80: =X80+R80 -> 65 | AE80: =Y80+S80 -> 62 | AF80: =Z80+T80 -> 0 | AG80: =AA80+U80 -> 0
A81: 77 | B81: cristine | C81: 37963.003888888888 | D81: 0 | E81: 0 | F81: 3 | G81: 0 | H81: 0 | I81: 0 | J81: 0 | K81: 3 | L81: 0 | M81: 0 | N81: 0 | O81: 3 | P81: 0 | Q81: 0 | R81: 3 | S81: 3 | T81: 0 | U81: 0 | V81: 0 | W81: 0 | X81: 19 | Y81: 19 | Z81: 0 | AA81: 0 | AB81: =V81+P81 -> 0 | AC81: =W81+Q81 -> 0 | AD81: =X81+R81 -> 22 | AE81: =Y81+S81 -> 22 | AF81: =Z81+T81 -> 0 | AG81: =AA81+U81 -> 0
A82: 78 | B82: murta | C82: 37963.671689814815 | D82: 0 | E82: 0 | F82: 5 | G82: 0 | H82: 0 | I82: 0 | J82: 0 | K82: 1 | L82: 0 | M82: 0 | N82: 0 | O82: 1 | P82: 0 | Q82: 0 | R82: 1 | S82: 1 | T82: 0 | U82: 0 | V82: 0 | W82: 0 | X82: 8 | Y82: 8 | Z82: 0 | AA82: 0 | AB82: =V82+P82 -> 0 | AC82: =W82+Q82 -> 0 | AD82: =X82+R82 -> 9 | AE82: =Y82+S82 -> 9 | AF82: =Z82+T82 -> 0 | AG82: =AA82+U82 -> 0
A83: 79 | B83: carlosjr | C83: 37963.807696759257 | D83: 0 | E83: 0 | F83: 16 | G83: 0 | H83: 0 | I83: 0 | J83: 0 | K83: 7 | L83: 0 | M83: 0 | N83: 0 | O83: 7 | P83: 0 | Q83: 0 | R83: 7 | S83: 7 | T83: 0 | U83: 0 | V83: 0 | W83: 0 | X83: 76 | Y83: 76 | Z83: 0 | AA83: 0 | AB83: =V83+P83 -> 0 | AC83: =W83+Q83 -> 0 | AD83: =X83+R83 -> 83 | AE83: =Y83+S83 -> 83 | AF83: =Z83+T83 -> 0 | AG83: =AA83+U83 -> 0
A84: 80 | B84: murta | C84: 37963.997974537036 | D84: 0 | E84: 0 | F84: 1 | G84: 0 | H84: 0 | I84: 0 | J84: 0 | K84: 0 | L84: 0 | M84: 0 | N84: 0 | O84: 0 | P84: 0 | Q84: 0 | R84: 0 | S84: 0 | T84: 0 | U84: 0 | V84: 0 | W84: 0 | X84: 0 | Y84: 0 | Z84: 0 | AA84: 0 | AB84: =V84+P84 -> 0 | AC84: =W84+Q84 -> 0 | AD84: =X84+R84 -> 0 | AE84: =Y84+S84 -> 0 | AF84: =Z84+T84 -> 0 | AG84: =AA84+U84 -> 0
A85: 81 | B85: murta | C85: 37964.193912037037 | D85: 1 | E85: 0 | F85: 4 | G85: 0 | H85: 0 | I85: 0 | J85: 0 | K85: 2 | L85: 0 | M85: 0 | N85: 0 | O85: 2 | P85: 0 | Q85: 0 | R85: 2 | S85: 2 | T85: 0 | U85: 0 | V85: 0 | W85: 0 | X85: 48 | Y85: 47 | Z85: 0 | AA85: 0 | AB85: =V85+P85 -> 0 | AC85: =W85+Q85 -> 0 | AD85: =X85+R85 -> 50 | AE85: =Y85+S85 -> 49 | AF85: =Z85+T85 -> 0 | AG85: =AA85+U85 -> 0
A86: 82 | B86: murta | C86: 37964.879131944443 | D86: 2 | E86: 1 | F86: 6 | G86: 0 | H86: 0 | I86: 0 | J86: 0 | K86: 2 | L86: 0 | M86: 0 | N86: 0 | O86: 2 | P86: 0 | Q86: 0 | R86: 2 | S86: 2 | T86: 0 | U86: 0 | V86: 0 | W86: 0 | X86: 10 | Y86: 9 | Z86: 0 | AA86: 0 | AB86: =V86+P86 -> 0 | AC86: =W86+Q86 -> 0 | AD86: =X86+R86 -> 12 | AE86: =Y86+S86 -> 11 | AF86: =Z86+T86 -> 0 | AG86: =AA86+U86 -> 0
A87: 83 | B87: natanael | C87: 37965.110115740739 | D87: 0 | E87: 0 | F87: 3 | G87: 0 | H87: 0 | I87: 0 | J87: 0 | K87: 13 | L87: 0 | M87: 0 | N87: 0 | O87: 13 | P87: 0 | Q87: 0 | R87: 13 | S87: 13 | T87: 0 | U87: 0 | V87: 0 | W87: 0 | X87: 25 | Y87: 25 | Z87: 0 | AA87: 0 | AB87: =V87+P87 -> 0 | AC87: =W87+Q87 -> 0 | AD87: =X87+R87 -> 38 | AE87: =Y87+S87 -> 38 | AF87: =Z87+T87 -> 0 | AG87: =AA87+U87 -> 0
A88: 84 | B88: cristine | C88: 37965.11246527778 | D88: 0 | E88: 0 | F88: 4 | G88: 0 | H88: 0 | I88: 0 | J88: 0 | K88: 4 | L88: 0 | M88: 0 | N88: 0 | O88: 4 | P88: 0 | Q88: 0 | R88: 4 | S88: 4 | T88: 0 | U88: 0 | V88: 0 | W88: 0 | X88: 16 | Y88: 16 | Z88: 0 | AA88: 0 | AB88: =V88+P88 -> 0 | AC88: =W88+Q88 -> 0 | AD88: =X88+R88 -> 20 | AE88: =Y88+S88 -> 20 | AF88: =Z88+T88 -> 0 | AG88: =AA88+U88 -> 0
A89: 85 | B89: regiane | C89: 37965.777465277781 | D89: 0 | E89: 2 | F89: 0 | G89: 0 | H89: 0 | I89: 0 | J89: 0 | K89: 1 | L89: 0 | M89: 0 | N89: 0 | O89: 1 | P89: 0 | Q89: 0 | R89: 1 | S89: 1 | T89: 0 | U89: 0 | V89: 0 | W89: 0 | X89: 31 | Y89: 33 | Z89: 0 | AA89: 0 | AB89: =V89+P89 -> 0 | AC89: =W89+Q89 -> 0 | AD89: =X89+R89 -> 32 | AE89: =Y89+S89 -> 34 | AF89: =Z89+T89 -> 0 | AG89: =AA89+U89 -> 0
A90: 86 | B90: regiane | C90: 37965.815810185188 | D90: 7 | E90: 0 | F90: 0 | G90: 0 | H90: 0 | I90: 0 | J90: 0 | K90: 1 | L90: 0 | M90: 0 | N90: 0 | O90: 1 | P90: 0 | Q90: 0 | R90: 1 | S90: 1 | T90: 0 | U90: 0 | V90: 0 | W90: 0 | X90: 38 | Y90: 31 | Z90: 0 | AA90: 0 | AB90: =V90+P90 -> 0 | AC90: =W90+Q90 -> 0 | AD90: =X90+R90 -> 39 | AE90: =Y90+S90 -> 32 | AF90: =Z90+T90 -> 0 | AG90: =AA90+U90 -> 0
A91: 87 | B91: regiane | C91: 37965.816307870373 | D91: 0 | E91: 0 | F91: 1 | G91: 0 | H91: 0 | I91: 0 | J91: 0 | K91: 1 | L91: 0 | M91: 0 | N91: 0 | O91: 1 | P91: 0 | Q91: 0 | R91: 1 | S91: 1 | T91: 0 | U91: 0 | V91: 0 | W91: 0 | X91: 4 | Y91: 4 | Z91: 0 | AA91: 0 | AB91: =V91+P91 -> 0 | AC91: =W91+Q91 -> 0 | AD91: =X91+R91 -> 5 | AE91: =Y91+S91 -> 5 | AF91: =Z91+T91 -> 0 | AG91: =AA91+U91 -> 0
A92: 88 | B92: regiane | C92: 37965.822326388887 | D92: 0 | E92: 5 | F92: 0 | G92: 0 | H92: 0 | I92: 0 | J92: 0 | K92: 1 | L92: 0 | M92: 0 | N92: 0 | O92: 1 | P92: 0 | Q92: 0 | R92: 1 | S92: 1 | T92: 0 | U92: 0 | V92: 0 | W92: 0 | X92: 33 | Y92: 38 | Z92: 0 | AA92: 0 | AB92: =V92+P92 -> 0 | AC92: =W92+Q92 -> 0 | AD92: =X92+R92 -> 34 | AE92: =Y92+S92 -> 39 | AF92: =Z92+T92 -> 0 | AG92: =AA92+U92 -> 0
A93: 89 | B93: regiane | C93: 37966.508090277777 | D93: 0 | E93: 0 | F93: 1 | G93: 0 | H93: 0 | I93: 0 | J93: 0 | K93: 1 | L93: 0 | M93: 0 | N93: 0 | O93: 1 | P93: 0 | Q93: 0 | R93: 1 | S93: 1 | T93: 0 | U93: 0 | V93: 0 | W93: 0 | X93: 33 | Y93: 33 | Z93: 0 | AA93: 0 | AB93: =V93+P93 -> 0 | AC93: =W93+Q93 -> 0 | AD93: =X93+R93 -> 34 | AE93: =Y93+S93 -> 34 | AF93: =Z93+T93 -> 0 | AG93: =AA93+U93 -> 0
A94: 90 | B94: regiane | C94: 37966.637974537036 | D94: 0 | E94: 0 | F94: 3 | G94: 0 | H94: 0 | I94: 0 | J94: 0 | K94: 2 | L94: 0 | M94: 0 | N94: 0 | O94: 2 | P94: 0 | Q94: 0 | R94: 2 | S94: 2 | T94: 0 | U94: 0 | V94: 0 | W94: 0 | X94: 10 | Y94: 10 | Z94: 0 | AA94: 0 | AB94: =V94+P94 -> 0 | AC94: =W94+Q94 -> 0 | AD94: =X94+R94 -> 12 | AE94: =Y94+S94 -> 12 | AF94: =Z94+T94 -> 0 | AG94: =AA94+U94 -> 0
A95: 91 | B95: regiane | C95: 37966.650347222225 | D95: 0 | E95: 0 | F95: 20 | G95: 0 | H95: 0 | I95: 0 | J95: 0 | K95: 7 | L95: 0 | M95: 0 | N95: 0 | O95: 7 | P95: 0 | Q95: 0 | R95: 7 | S95: 7 | T95: 0 | U95: 0 | V95: 0 | W95: 0 | X95: 48 | Y95: 48 | Z95: 0 | AA95: 0 | AB95: =V95+P95 -> 0 | AC95: =W95+Q95 -> 0 | AD95: =X95+R95 -> 55 | AE95: =Y95+S95 -> 55 | AF95: =Z95+T95 -> 0 | AG95: =AA95+U95 -> 0
A96: 92 | B96: regiane | C96: 37966.658900462964 | D96: 0 | E96: 0 | F96: 6 | G96: 0 | H96: 0 | I96: 0 | J96: 0 | K96: 3 | L96: 0 | M96: 0 | N96: 0 | O96: 3 | P96: 0 | Q96: 0 | R96: 3 | S96: 3 | T96: 0 | U96: 0 | V96: 0 | W96: 0 | X96: 45 | Y96: 45 | Z96: 0 | AA96: 0 | AB96: =V96+P96 -> 0 | AC96: =W96+Q96 -> 0 | AD96: =X96+R96 -> 48 | AE96: =Y96+S96 -> 48 | AF96: =Z96+T96 -> 0 | AG96: =AA96+U96 -> 0
A97: 93 | B97: murta | C97: 37966.754652777781 | D97: 0 | E97: 0 | F97: 1 | G97: 0 | H97: 0 | I97: 0 | J97: 0 | K97: 0 | L97: 0 | M97: 0 | N97: 0 | O97: 0 | P97: 0 | Q97: 0 | R97: 0 | S97: 0 | T97: 0 | U97: 0 | V97: 0 | W97: 0 | X97: 0 | Y97: 0 | Z97: 0 | AA97: 0 | AB97: =V97+P97 -> 0 | AC97: =W97+Q97 -> 0 | AD97: =X97+R97 -> 0 | AE97: =Y97+S97 -> 0 | AF97: =Z97+T97 -> 0 | AG97: =AA97+U97 -> 0
A98: 94 | B98: murta | C98: 37966.756053240744 | D98: 0 | E98: 0 | F98: 1 | G98: 0 | H98: 0 | I98: 0 | J98: 0 | K98: 1 | L98: 0 | M98: 0 | N98: 0 | O98: 1 | P98: 0 | Q98: 0 | R98: 1 | S98: 1 | T98: 0 | U98: 0 | V98: 0 | W98: 0 | X98: 0 | Y98: 0 | Z98: 0 | AA98: 0 | AB98: =V98+P98 -> 0 | AC98: =W98+Q98 -> 0 | AD98: =X98+R98 -> 1 | AE98: =Y98+S98 -> 1 | AF98: =Z98+T98 -> 0 | AG98: =AA98+U98 -> 0
A99: 95 | B99: regiane | C99: 37966.761863425927 | D99: 1 | E99: 0 | F99: 4 | G99: 0 | H99: 0 | I99: 0 | J99: 0 | K99: 1 | L99: 0 | M99: 0 | N99: 0 | O99: 1 | P99: 0 | Q99: 0 | R99: 1 | S99: 1 | T99: 0 | U99: 0 | V99: 0 | W99: 0 | X99: 34 | Y99: 33 | Z99: 0 | AA99: 0 | AB99: =V99+P99 -> 0 | AC99: =W99+Q99 -> 0 | AD99: =X99+R99 -> 35 | AE99: =Y99+S99 -> 34 | AF99: =Z99+T99 -> 0 | AG99: =AA99+U99 -> 0
A100: 96 | B100: murta | C100: 37966.802800925929 | D100: 0 | E100: 0 | F100: 2 | G100: 0 | H100: 0 | I100: 0 | J100: 0 | K100: 1 | L100: 0 | M100: 0 | N100: 0 | O100: 1 | P100: 0 | Q100: 0 | R100: 1 | S100: 1 | T100: 0 | U100: 0 | V100: 0 | W100: 0 | X100: 10 | Y100: 10 | Z100: 0 | AA100: 0 | AB100: =V100+P100 -> 0 | AC100: =W100+Q100 -> 0 | AD100: =X100+R100 -> 11 | AE100: =Y100+S100 -> 11 | AF100: =Z100+T100 -> 0 | AG100: =AA100+U100 -> 0
A101: 97 | B101: natanael | C101: 37967.507233796299 | D101: 1 | E101: 1 | F101: 1 | G101: 0 | H101: 0 | I101: 0 | J101: 0 | K101: 12 | L101: 0 | M101: 0 | N101: 0 | O101: 12 | P101: 0 | Q101: 0 | R101: 12 | S101: 12 | T101: 0 | U101: 0 | V101: 0 | W101: 0 | X101: 6 | Y101: 6 | Z101: 0 | AA101: 0 | AB101: =V101+P101 -> 0 | AC101: =W101+Q101 -> 0 | AD101: =X101+R101 -> 18 | AE101: =Y101+S101 -> 18 | AF101: =Z101+T101 -> 0 | AG101: =AA101+U101 -> 0
A102: 98 | B102: mangan | C102: 37967.554594907408 | D102: 2 | E102: 0 | F102: 0 | G102: 0 | H102: 0 | I102: 0 | J102: 0 | K102: 0 | L102: 0 | M102: 0 | N102: 0 | O102: 0 | P102: 0 | Q102: 0 | R102: 0 | S102: 0 | T102: 0 | U102: 0 | V102: 0 | W102: 0 | X102: 0 | Y102: 0 | Z102: 0 | AA102: 0 | AB102: =V102+P102 -> 0 | AC102: =W102+Q102 -> 0 | AD102: =X102+R102 -> 0 | AE102: =Y102+S102 -> 0 | AF102: =Z102+T102 -> 0 | AG102: =AA102+U102 -> 0
A103: 99 | B103: mangan | C103: 37967.578888888886 | D103: 0 | E103: 0 | F103: 1 | G103: 0 | H103: 0 | I103: 0 | J103: 0 | K103: 1 | L103: 0 | M103: 0 | N103: 0 | O103: 1 | P103: 0 | Q103: 0 | R103: 1 | S103: 1 | T103: 0 | U103: 0 | V103: 0 | W103: 0 | X103: 10 | Y103: 10 | Z103: 0 | AA103: 0 | AB103: =V103+P103 -> 0 | AC103: =W103+Q103 -> 0 | AD103: =X103+R103 -> 11 | AE103: =Y103+S103 -> 11 | AF103: =Z103+T103 -> 0 | AG103: =AA103+U103 -> 0
A104: 100 | B104: murta | C104: 37970.5703587963 | D104: 0 | E104: 0 | F104: 1 | G104: 0 | H104: 0 | I104: 0 | J104: 0 | K104: 1 | L104: 0 | M104: 0 | N104: 0 | O104: 1 | P104: 0 | Q104: 0 | R104: 1 | S104: 1 | T104: 0 | U104: 0 | V104: 0 | W104: 0 | X104: 0 | Y104: 0 | Z104: 0 | AA104: 0 | AB104: =V104+P104 -> 0 | AC104: =W104+Q104 -> 0 | AD104: =X104+R104 -> 1 | AE104: =Y104+S104 -> 1 | AF104: =Z104+T104 -> 0 | AG104: =AA104+U104 -> 0
A105: 101 | B105: murta | C105: 37970.574490740742 | D105: 0 | E105: 1 | F105: 1 | G105: 0 | H105: 0 | I105: 0 | J105: 0 | K105: 1 | L105: 0 | M105: 0 | N105: 0 | O105: 1 | P105: 0 | Q105: 0 | R105: 1 | S105: 1 | T105: 0 | U105: 0 | V105: 0 | W105: 0 | X105: 0 | Y105: 0 | Z105: 0 | AA105: 0 | AB105: =V105+P105 -> 0 | AC105: =W105+Q105 -> 0 | AD105: =X105+R105 -> 1 | AE105: =Y105+S105 -> 1 | AF105: =Z105+T105 -> 0 | AG105: =AA105+U105 -> 0
A106: 102 | B106: murta | C106: 37970.672523148147 | D106: 0 | E106: 0 | F106: 3 | G106: 0 | H106: 0 | I106: 0 | J106: 0 | K106: 1 | L106: 0 | M106: 0 | N106: 0 | O106: 1 | P106: 0 | Q106: 0 | R106: 1 | S106: 1 | T106: 0 | U106: 0 | V106: 0 | W106: 0 | X106: 10 | Y106: 10 | Z106: 0 | AA106: 0 | AB106: =V106+P106 -> 0 | AC106: =W106+Q106 -> 0 | AD106: =X106+R106 -> 11 | AE106: =Y106+S106 -> 11 | AF106: =Z106+T106 -> 0 | AG106: =AA106+U106 -> 0
A107: 103 | B107: cristine | C107: 37970.834178240744 | D107: 0 | E107: 0 | F107: 2 | G107: 0 | H107: 0 | I107: 0 | J107: 0 | K107: 2 | L107: 0 | M107: 0 | N107: 0 | O107: 2 | P107: 0 | Q107: 0 | R107: 2 | S107: 2 | T107: 0 | U107: 0 | V107: 0 | W107: 0 | X107: 25 | Y107: 25 | Z107: 0 | AA107: 0 | AB107: =V107+P107 -> 0 | AC107: =W107+Q107 -> 0 | AD107: =X107+R107 -> 27 | AE107: =Y107+S107 -> 27 | AF107: =Z107+T107 -> 0 | AG107: =AA107+U107 -> 0
A108: 104 | B108: cristine | C108: 37970.842199074075 | D108: 0 | E108: 0 | F108: 1 | G108: 0 | H108: 0 | I108: 0 | J108: 0 | K108: 1 | L108: 0 | M108: 0 | N108: 0 | O108: 1 | P108: 0 | Q108: 0 | R108: 1 | S108: 1 | T108: 0 | U108: 0 | V108: 0 | W108: 0 | X108: 6 | Y108: 6 | Z108: 0 | AA108: 0 | AB108: =V108+P108 -> 0 | AC108: =W108+Q108 -> 0 | AD108: =X108+R108 -> 7 | AE108: =Y108+S108 -> 7 | AF108: =Z108+T108 -> 0 | AG108: =AA108+U108 -> 0
A109: 105 | B109: regiane | C109: 37971.70511574074 | D109: 0 | E109: 0 | F109: 1 | G109: 0 | H109: 0 | I109: 0 | J109: 0 | K109: 1 | L109: 0 | M109: 0 | N109: 0 | O109: 1 | P109: 0 | Q109: 0 | R109: 1 | S109: 1 | T109: 0 | U109: 0 | V109: 0 | W109: 0 | X109: 34 | Y109: 34 | Z109: 0 | AA109: 0 | AB109: =V109+P109 -> 0 | AC109: =W109+Q109 -> 0 | AD109: =X109+R109 -> 35 | AE109: =Y109+S109 -> 35 | AF109: =Z109+T109 -> 0 | AG109: =AA109+U109 -> 0
A110: 106 | B110: murta | C110: 37971.775405092594 | D110: 2 | E110: 2 | F110: 5 | G110: 0 | H110: 0 | I110: 0 | J110: 0 | K110: 3 | L110: 0 | M110: 0 | N110: 0 | O110: 3 | P110: 0 | Q110: 0 | R110: 3 | S110: 3 | T110: 0 | U110: 0 | V110: 0 | W110: 0 | X110: 10 | Y110: 10 | Z110: 0 | AA110: 0 | AB110: =V110+P110 -> 0 | AC110: =W110+Q110 -> 0 | AD110: =X110+R110 -> 13 | AE110: =Y110+S110 -> 13 | AF110: =Z110+T110 -> 0 | AG110: =AA110+U110 -> 0
A111: 107 | B111: carlosjr | C111: 37971.812928240739 | D111: 1 | E111: 0 | F111: 5 | G111: 0 | H111: 0 | I111: 0 | J111: 0 | K111: 3 | L111: 0 | M111: 0 | N111: 0 | O111: 3 | P111: 0 | Q111: 0 | R111: 3 | S111: 3 | T111: 0 | U111: 0 | V111: 0 | W111: 0 | X111: 43 | Y111: 43 | Z111: 0 | AA111: 0 | AB111: =V111+P111 -> 0 | AC111: =W111+Q111 -> 0 | AD111: =X111+R111 -> 46 | AE111: =Y111+S111 -> 46 | AF111: =Z111+T111 -> 0 | AG111: =AA111+U111 -> 0
A112: 108 | B112: cristine | C112: 37972.606145833335 | D112: 0 | E112: 0 | F112: 4 | G112: 0 | H112: 0 | I112: 0 | J112: 0 | K112: 4 | L112: 0 | M112: 0 | N112: 0 | O112: 4 | P112: 0 | Q112: 0 | R112: 4 | S112: 4 | T112: 0 | U112: 0 | V112: 0 | W112: 0 | X112: 36 | Y112: 36 | Z112: 0 | AA112: 0 | AB112: =V112+P112 -> 0 | AC112: =W112+Q112 -> 0 | AD112: =X112+R112 -> 40 | AE112: =Y112+S112 -> 40 | AF112: =Z112+T112 -> 0 | AG112: =AA112+U112 -> 0
A113: 109 | B113: lages | C113: 37972.7184375 | D113: 0 | E113: 0 | F113: 1 | G113: 0 | H113: 0 | I113: 0 | J113: 0 | K113: 0 | L113: 0 | M113: 0 | N113: 0 | O113: 0 | P113: 0 | Q113: 0 | R113: 0 | S113: 0 | T113: 0 | U113: 0 | V113: 0 | W113: 0 | X113: 0 | Y113: 0 | Z113: 0 | AA113: 0 | AB113: =V113+P113 -> 0 | AC113: =W113+Q113 -> 0 | AD113: =X113+R113 -> 0 | AE113: =Y113+S113 -> 0 | AF113: =Z113+T113 -> 0 | AG113: =AA113+U113 -> 0
A114: 110 | B114: carlosjr | C114: 37972.814097222225 | D114: 1 | E114: 0 | F114: 8 | G114: 0 | H114: 0 | I114: 0 | J114: 0 | K114: 4 | L114: 0 | M114: 0 | N114: 0 | O114: 4 | P114: 0 | Q114: 0 | R114: 4 | S114: 4 | T114: 1 | U114: 0 | V114: 0 | W114: 0 | X114: 47 | Y114: 47 | Z114: 0 | AA114: 0 | AB114: =V114+P114 -> 0 | AC114: =W114+Q114 -> 0 | AD114: =X114+R114 -> 51 | AE114: =Y114+S114 -> 51 | AF114: =Z114+T114 -> 1 | AG114: =AA114+U114 -> 0
A115: 111 | B115: mangan | C115: 37976.434849537036 | D115: 0 | E115: 0 | F115: 2 | G115: 0 | H115: 0 | I115: 0 | J115: 0 | K115: 2 | L115: 0 | M115: 0 | N115: 0 | O115: 2 | P115: 0 | Q115: 0 | R115: 2 | S115: 2 | T115: 0 | U115: 0 | V115: 0 | W115: 0 | X115: 10 | Y115: 10 | Z115: 0 | AA115: 0 | AB115: =V115+P115 -> 0 | AC115: =W115+Q115 -> 0 | AD115: =X115+R115 -> 12 | AE115: =Y115+S115 -> 12 | AF115: =Z115+T115 -> 0 | AG115: =AA115+U115 -> 0
A116: 112 | B116: mangan | C116: 37993.005393518521 | D116: 0 | E116: 0 | F116: 2 | G116: 0 | H116: 0 | I116: 0 | J116: 0 | K116: 1 | L116: 0 | M116: 0 | N116: 0 | O116: 1 | P116: 0 | Q116: 0 | R116: 1 | S116: 1 | T116: 0 | U116: 0 | V116: 0 | W116: 0 | X116: 0 | Y116: 0 | Z116: 0 | AA116: 0 | AB116: =V116+P116 -> 0 | AC116: =W116+Q116 -> 0 | AD116: =X116+R116 -> 1 | AE116: =Y116+S116 -> 1 | AF116: =Z116+T116 -> 0 | AG116: =AA116+U116 -> 0
A117: 113 | B117: mangan | C117: 37993.006689814814 | D117: 0 | E117: 0 | F117: 1 | G117: 0 | H117: 0 | I117: 0 | J117: 0 | K117: 1 | L117: 0 | M117: 0 | N117: 0 | O117: 1 | P117: 0 | Q117: 0 | R117: 1 | S117: 1 | T117: 0 | U117: 0 | V117: 0 | W117: 0 | X117: 0 | Y117: 0 | Z117: 0 | AA117: 0 | AB117: =V117+P117 -> 0 | AC117: =W117+Q117 -> 0 | AD117: =X117+R117 -> 1 | AE117: =Y117+S117 -> 1 | AF117: =Z117+T117 -> 0 | AG117: =AA117+U117 -> 0
A118: 114 | B118: mangan | C118: 37993.135196759256 | D118: 2 | E118: 0 | F118: 0 | G118: 0 | H118: 0 | I118: 0 | J118: 0 | K118: 0 | L118: 0 | M118: 0 | N118: 0 | O118: 0 | P118: 0 | Q118: 0 | R118: 0 | S118: 0 | T118: 0 | U118: 0 | V118: 0 | W118: 0 | X118: 0 | Y118: 0 | Z118: 0 | AA118: 0 | AB118: =V118+P118 -> 0 | AC118: =W118+Q118 -> 0 | AD118: =X118+R118 -> 0 | AE118: =Y118+S118 -> 0 | AF118: =Z118+T118 -> 0 | AG118: =AA118+U118 -> 0
A119: 115 | B119: mangan | C119: 37994.20144675926 | D119: 0 | E119: 0 | F119: 1 | G119: 0 | H119: 0 | I119: 0 | J119: 0 | K119: 0 | L119: 0 | M119: 0 | N119: 0 | O119: 0 | P119: 0 | Q119: 0 | R119: 0 | S119: 0 | T119: 0 | U119: 0 | V119: 0 | W119: 0 | X119: 0 | Y119: 0 | Z119: 0 | AA119: 0 | AB119: =V119+P119 -> 0 | AC119: =W119+Q119 -> 0 | AD119: =X119+R119 -> 0 | AE119: =Y119+S119 -> 0 | AF119: =Z119+T119 -> 0 | AG119: =AA119+U119 -> 0
A120: 116 | B120: mangan | C120: 37995.662430555552 | D120: 0 | E120: 0 | F120: 2 | G120: 0 | H120: 0 | I120: 0 | J120: 0 | K120: 1 | L120: 0 | M120: 0 | N120: 0 | O120: 1 | P120: 0 | Q120: 0 | R120: 1 | S120: 1 | T120: 0 | U120: 0 | V120: 0 | W120: 0 | X120: 10 | Y120: 10 | Z120: 0 | AA120: 0 | AB120: =V120+P120 -> 0 | AC120: =W120+Q120 -> 0 | AD120: =X120+R120 -> 11 | AE120: =Y120+S120 -> 11 | AF120: =Z120+T120 -> 0 | AG120: =AA120+U120 -> 0
A121: 117 | B121: mangan | C121: 37995.664201388892 | D121: 2 | E121: 0 | F121: 0 | G121: 0 | H121: 0 | I121: 0 | J121: 0 | K121: 0 | L121: 0 | M121: 0 | N121: 0 | O121: 0 | P121: 0 | Q121: 0 | R121: 0 | S121: 0 | T121: 0 | U121: 0 | V121: 0 | W121: 0 | X121: 0 | Y121: 0 | Z121: 0 | AA121: 0 | AB121: =V121+P121 -> 0 | AC121: =W121+Q121 -> 0 | AD121: =X121+R121 -> 0 | AE121: =Y121+S121 -> 0 | AF121: =Z121+T121 -> 0 | AG121: =AA121+U121 -> 0
A122: 118 | B122: mangan | C122: 37998.580682870372 | D122: 0 | E122: 0 | F122: 5 | G122: 0 | H122: 0 | I122: 0 | J122: 0 | K122: 14 | L122: 0 | M122: 0 | N122: 0 | O122: 14 | P122: 0 | Q122: 0 | R122: 14 | S122: 14 | T122: 0 | U122: 0 | V122: 0 | W122: 0 | X122: 4 | Y122: 4 | Z122: 0 | AA122: 0 | AB122: =V122+P122 -> 0 | AC122: =W122+Q122 -> 0 | AD122: =X122+R122 -> 18 | AE122: =Y122+S122 -> 18 | AF122: =Z122+T122 -> 0 | AG122: =AA122+U122 -> 0
A123: 119 | B123: mangan | C123: 37998.677025462966 | D123: 0 | E123: 0 | F123: 4 | G123: 0 | H123: 0 | I123: 0 | J123: 0 | K123: 3 | L123: 0 | M123: 0 | N123: 0 | O123: 3 | P123: 0 | Q123: 0 | R123: 3 | S123: 3 | T123: 0 | U123: 0 | V123: 0 | W123: 0 | X123: 47 | Y123: 47 | Z123: 0 | AA123: 0 | AB123: =V123+P123 -> 0 | AC123: =W123+Q123 -> 0 | AD123: =X123+R123 -> 50 | AE123: =Y123+S123 -> 50 | AF123: =Z123+T123 -> 0 | AG123: =AA123+U123 -> 0
A124: 120 | B124: murta | C124: 37998.791250000002 | D124: 0 | E124: 0 | F124: 3 | G124: 0 | H124: 0 | I124: 0 | J124: 0 | K124: 3 | L124: 0 | M124: 0 | N124: 0 | O124: 3 | P124: 0 | Q124: 0 | R124: 3 | S124: 3 | T124: 0 | U124: 0 | V124: 0 | W124: 0 | X124: 9 | Y124: 9 | Z124: 0 | AA124: 0 | AB124: =V124+P124 -> 0 | AC124: =W124+Q124 -> 0 | AD124: =X124+R124 -> 12 | AE124: =Y124+S124 -> 12 | AF124: =Z124+T124 -> 0 | AG124: =AA124+U124 -> 0
A125: 121 | B125: natanael | C125: 38007.56591435185 | D125: 0 | E125: 1 | F125: 7 | G125: 0 | H125: 0 | I125: 0 | J125: 0 | K125: 57 | L125: 0 | M125: 0 | N125: 0 | O125: 57 | P125: 0 | Q125: 0 | R125: 57 | S125: 57 | T125: 0 | U125: 0 | V125: 0 | W125: 0 | X125: 21 | Y125: 22 | Z125: 0 | AA125: 0 | AB125: =V125+P125 -> 0 | AC125: =W125+Q125 -> 0 | AD125: =X125+R125 -> 78 | AE125: =Y125+S125 -> 79 | AF125: =Z125+T125 -> 0 | AG125: =AA125+U125 -> 0
A126: 122 | B126: natanael | C126: 38007.589212962965 | D126: 0 | E126: 0 | F126: 6 | G126: 0 | H126: 0 | I126: 0 | J126: 0 | K126: 14 | L126: 0 | M126: 0 | N126: 0 | O126: 14 | P126: 0 | Q126: 0 | R126: 14 | S126: 14 | T126: 0 | U126: 0 | V126: 0 | W126: 0 | X126: 30 | Y126: 30 | Z126: 0 | AA126: 0 | AB126: =V126+P126 -> 0 | AC126: =W126+Q126 -> 0 | AD126: =X126+R126 -> 44 | AE126: =Y126+S126 -> 44 | AF126: =Z126+T126 -> 0 | AG126: =AA126+U126 -> 0
A127: 123 | B127: cristine | C127: 38018.029467592591 | D127: 0 | E127: 0 | F127: 11 | G127: 0 | H127: 0 | I127: 0 | J127: 0 | K127: 9 | L127: 0 | M127: 0 | N127: 0 | O127: 9 | P127: 0 | Q127: 0 | R127: 9 | S127: 9 | T127: 0 | U127: 0 | V127: 0 | W127: 0 | X127: 80 | Y127: 80 | Z127: 0 | AA127: 0 | AB127: =V127+P127 -> 0 | AC127: =W127+Q127 -> 0 | AD127: =X127+R127 -> 89 | AE127: =Y127+S127 -> 89 | AF127: =Z127+T127 -> 0 | AG127: =AA127+U127 -> 0
A128: 124 | B128: cristine | C128: 38019.813240740739 | D128: 0 | E128: 0 | F128: 2 | G128: 0 | H128: 0 | I128: 0 | J128: 0 | K128: 2 | L128: 0 | M128: 0 | N128: 0 | O128: 2 | P128: 0 | Q128: 0 | R128: 2 | S128: 2 | T128: 0 | U128: 0 | V128: 0 | W128: 0 | X128: 0 | Y128: 0 | Z128: 0 | AA128: 0 | AB128: =V128+P128 -> 0 | AC128: =W128+Q128 -> 0 | AD128: =X128+R128 -> 2 | AE128: =Y128+S128 -> 2 | AF128: =Z128+T128 -> 0 | AG128: =AA128+U128 -> 0
A129: 125 | B129: natanael | C129: 38020.752337962964 | D129: 1 | E129: 0 | F129: 1 | G129: 0 | H129: 0 | I129: 0 | J129: 0 | K129: 5 | L129: 0 | M129: 0 | N129: 0 | O129: 5 | P129: 0 | Q129: 0 | R129: 5 | S129: 5 | T129: 0 | U129: 0 | V129: 0 | W129: 0 | X129: 11 | Y129: 10 | Z129: 0 | AA129: 0 | AB129: =V129+P129 -> 0 | AC129: =W129+Q129 -> 0 | AD129: =X129+R129 -> 16 | AE129: =Y129+S129 -> 15 | AF129: =Z129+T129 -> 0 | AG129: =AA129+U129 -> 0
A130: 126 | B130: natanael | C130: 38020.772557870368 | D130: 0 | E130: 0 | F130: 4 | G130: 0 | H130: 0 | I130: 0 | J130: 0 | K130: 2 | L130: 0 | M130: 0 | N130: 0 | O130: 2 | P130: 0 | Q130: 0 | R130: 2 | S130: 2 | T130: 0 | U130: 0 | V130: 0 | W130: 0 | X130: 21 | Y130: 21 | Z130: 0 | AA130: 0 | AB130: =V130+P130 -> 0 | AC130: =W130+Q130 -> 0 | AD130: =X130+R130 -> 23 | AE130: =Y130+S130 -> 23 | AF130: =Z130+T130 -> 0 | AG130: =AA130+U130 -> 0
A131: 127 | B131: cristine | C131: 38023.813946759263 | D131: 0 | E131: 0 | F131: 2 | G131: 0 | H131: 0 | I131: 0 | J131: 0 | K131: 1 | L131: 0 | M131: 0 | N131: 0 | O131: 1 | P131: 0 | Q131: 0 | R131: 1 | S131: 1 | T131: 0 | U131: 0 | V131: 0 | W131: 0 | X131: 10 | Y131: 10 | Z131: 0 | AA131: 0 | AB131: =V131+P131 -> 0 | AC131: =W131+Q131 -> 0 | AD131: =X131+R131 -> 11 | AE131: =Y131+S131 -> 11 | AF131: =Z131+T131 -> 0 | AG131: =AA131+U131 -> 0
A132: 128 | B132: natanael | C132: 38025.824201388888 | D132: 10 | E132: 0 | F132: 10 | G132: 0 | H132: 0 | I132: 0 | J132: 0 | K132: 48 | L132: 0 | M132: 0 | N132: 0 | O132: 48 | P132: 0 | Q132: 0 | R132: 48 | S132: 48 | T132: 0 | U132: 0 | V132: 0 | W132: 0 | X132: 77 | Y132: 69 | Z132: 2 | AA132: 0 | AB132: =V132+P132 -> 0 | AC132: =W132+Q132 -> 0 | AD132: =X132+R132 -> 125 | AE132: =Y132+S132 -> 117 | AF132: =Z132+T132 -> 2 | AG132: =AA132+U132 -> 0
A133: 129 | B133: natanael | C133: 38025.892916666664 | D133: 0 | E133: 0 | F133: 2 | G133: 0 | H133: 0 | I133: 0 | J133: 0 | K133: 2 | L133: 0 | M133: 0 | N133: 0 | O133: 2 | P133: 0 | Q133: 0 | R133: 2 | S133: 2 | T133: 0 | U133: 0 | V133: 0 | W133: 0 | X133: 23 | Y133: 23 | Z133: 0 | AA133: 0 | AB133: =V133+P133 -> 0 | AC133: =W133+Q133 -> 0 | AD133: =X133+R133 -> 25 | AE133: =Y133+S133 -> 25 | AF133: =Z133+T133 -> 0 | AG133: =AA133+U133 -> 0
A134: 130 | B134: natanael | C134: 38025.895844907405 | D134: 0 | E134: 0 | F134: 2 | G134: 0 | H134: 0 | I134: 0 | J134: 0 | K134: 5 | L134: 0 | M134: 0 | N134: 0 | O134: 5 | P134: 0 | Q134: 0 | R134: 5 | S134: 5 | T134: 0 | U134: 0 | V134: 0 | W134: 0 | X134: 11 | Y134: 11 | Z134: 0 | AA134: 0 | AB134: =V134+P134 -> 0 | AC134: =W134+Q134 -> 0 | AD134: =X134+R134 -> 16 | AE134: =Y134+S134 -> 16 | AF134: =Z134+T134 -> 0 | AG134: =AA134+U134 -> 0
A135: 131 | B135: natanael | C135: 38026.542326388888 | D135: 0 | E135: 0 | F135: 1 | G135: 0 | H135: 0 | I135: 0 | J135: 0 | K135: 1 | L135: 0 | M135: 0 | N135: 0 | O135: 1 | P135: 0 | Q135: 0 | R135: 1 | S135: 1 | T135: 0 | U135: 0 | V135: 0 | W135: 0 | X135: 11 | Y135: 11 | Z135: 0 | AA135: 0 | AB135: =V135+P135 -> 0 | AC135: =W135+Q135 -> 0 | AD135: =X135+R135 -> 12 | AE135: =Y135+S135 -> 12 | AF135: =Z135+T135 -> 0 | AG135: =AA135+U135 -> 0
A136: 132 | B136: murta | C136: 38026.932430555556 | D136: 0 | E136: 0 | F136: 3 | G136: 0 | H136: 0 | I136: 0 | J136: 0 | K136: 1 | L136: 0 | M136: 0 | N136: 0 | O136: 1 | P136: 0 | Q136: 0 | R136: 1 | S136: 1 | T136: 0 | U136: 0 | V136: 0 | W136: 0 | X136: 10 | Y136: 10 | Z136: 0 | AA136: 0 | AB136: =V136+P136 -> 0 | AC136: =W136+Q136 -> 0 | AD136: =X136+R136 -> 11 | AE136: =Y136+S136 -> 11 | AF136: =Z136+T136 -> 0 | AG136: =AA136+U136 -> 0
A137: 133 | B137: murta | C137: 38026.938194444447 | D137: 0 | E137: 0 | F137: 1 | G137: 0 | H137: 0 | I137: 0 | J137: 0 | K137: 0 | L137: 0 | M137: 0 | N137: 0 | O137: 0 | P137: 0 | Q137: 0 | R137: 0 | S137: 0 | T137: 0 | U137: 0 | V137: 0 | W137: 0 | X137: 0 | Y137: 0 | Z137: 0 | AA137: 0 | AB137: =V137+P137 -> 0 | AC137: =W137+Q137 -> 0 | AD137: =X137+R137 -> 0 | AE137: =Y137+S137 -> 0 | AF137: =Z137+T137 -> 0 | AG137: =AA137+U137 -> 0
A138: 134 | B138: murta | C138: 38026.941840277781 | D138: 0 | E138: 0 | F138: 2 | G138: 0 | H138: 0 | I138: 0 | J138: 0 | K138: 1 | L138: 0 | M138: 0 | N138: 0 | O138: 1 | P138: 0 | Q138: 0 | R138: 1 | S138: 1 | T138: 0 | U138: 0 | V138: 0 | W138: 0 | X138: 10 | Y138: 10 | Z138: 0 | AA138: 0 | AB138: =V138+P138 -> 0 | AC138: =W138+Q138 -> 0 | AD138: =X138+R138 -> 11 | AE138: =Y138+S138 -> 11 | AF138: =Z138+T138 -> 0 | AG138: =AA138+U138 -> 0
A139: 135 | B139: natanael | C139: 38027.11383101852 | D139: 0 | E139: 0 | F139: 1 | G139: 0 | H139: 0 | I139: 0 | J139: 0 | K139: 1 | L139: 0 | M139: 0 | N139: 0 | O139: 1 | P139: 0 | Q139: 0 | R139: 1 | S139: 1 | T139: 0 | U139: 0 | V139: 0 | W139: 0 | X139: 4 | Y139: 4 | Z139: 0 | AA139: 0 | AB139: =V139+P139 -> 0 | AC139: =W139+Q139 -> 0 | AD139: =X139+R139 -> 5 | AE139: =Y139+S139 -> 5 | AF139: =Z139+T139 -> 0 | AG139: =AA139+U139 -> 0
A140: 136 | B140: natanael | C140: 38027.579930555556 | D140: 0 | E140: 0 | F140: 1 | G140: 0 | H140: 0 | I140: 0 | J140: 0 | K140: 1 | L140: 0 | M140: 0 | N140: 0 | O140: 1 | P140: 0 | Q140: 0 | R140: 1 | S140: 1 | T140: 0 | U140: 0 | V140: 0 | W140: 0 | X140: 9 | Y140: 9 | Z140: 0 | AA140: 0 | AB140: =V140+P140 -> 0 | AC140: =W140+Q140 -> 0 | AD140: =X140+R140 -> 10 | AE140: =Y140+S140 -> 10 | AF140: =Z140+T140 -> 0 | AG140: =AA140+U140 -> 0
A141: 137 | B141: stainam | C141: 38028.009236111109 | D141: 1 | E141: 0 | F141: 11 | G141: 0 | H141: 0 | I141: 0 | J141: 0 | K141: 44 | L141: 0 | M141: 0 | N141: 0 | O141: 44 | P141: 0 | Q141: 0 | R141: 44 | S141: 44 | T141: 0 | U141: 0 | V141: 0 | W141: 0 | X141: 61 | Y141: 60 | Z141: 0 | AA141: 0 | AB141: =V141+P141 -> 0 | AC141: =W141+Q141 -> 0 | AD141: =X141+R141 -> 105 | AE141: =Y141+S141 -> 104 | AF141: =Z141+T141 -> 0 | AG141: =AA141+U141 -> 0
A142: 138 | B142: cristine | C142: 38028.822766203702 | D142: 0 | E142: 0 | F142: 2 | G142: 0 | H142: 0 | I142: 0 | J142: 0 | K142: 2 | L142: 0 | M142: 0 | N142: 0 | O142: 2 | P142: 0 | Q142: 0 | R142: 2 | S142: 2 | T142: 0 | U142: 0 | V142: 0 | W142: 0 | X142: 4 | Y142: 4 | Z142: 0 | AA142: 0 | AB142: =V142+P142 -> 0 | AC142: =W142+Q142 -> 0 | AD142: =X142+R142 -> 6 | AE142: =Y142+S142 -> 6 | AF142: =Z142+T142 -> 0 | AG142: =AA142+U142 -> 0
A143: 139 | B143: natanael | C143: 38028.857858796298 | D143: 0 | E143: 0 | F143: 2 | G143: 0 | H143: 0 | I143: 0 | J143: 0 | K143: 0 | L143: 0 | M143: 0 | N143: 0 | O143: 0 | P143: 0 | Q143: 0 | R143: 0 | S143: 0 | T143: 0 | U143: 0 | V143: 0 | W143: 0 | X143: 0 | Y143: 0 | Z143: 0 | AA143: 0 | AB143: =V143+P143 -> 0 | AC143: =W143+Q143 -> 0 | AD143: =X143+R143 -> 0 | AE143: =Y143+S143 -> 0 | AF143: =Z143+T143 -> 0 | AG143: =AA143+U143 -> 0
A144: 140 | B144: natanael | C144: 38028.868194444447 | D144: 0 | E144: 0 | F144: 8 | G144: 0 | H144: 0 | I144: 0 | J144: 0 | K144: 17 | L144: 0 | M144: 0 | N144: 0 | O144: 17 | P144: 0 | Q144: 0 | R144: 17 | S144: 17 | T144: 0 | U144: 0 | V144: 0 | W144: 0 | X144: 63 | Y144: 63 | Z144: 0 | AA144: 0 | AB144: =V144+P144 -> 0 | AC144: =W144+Q144 -> 0 | AD144: =X144+R144 -> 80 | AE144: =Y144+S144 -> 80 | AF144: =Z144+T144 -> 0 | AG144: =AA144+U144 -> 0
A145: 141 | B145: natanael | C145: 38028.871817129628 | D145: 0 | E145: 0 | F145: 1 | G145: 0 | H145: 0 | I145: 0 | J145: 0 | K145: 4 | L145: 0 | M145: 0 | N145: 0 | O145: 4 | P145: 0 | Q145: 0 | R145: 4 | S145: 4 | T145: 0 | U145: 0 | V145: 0 | W145: 0 | X145: 0 | Y145: 0 | Z145: 0 | AA145: 0 | AB145: =V145+P145 -> 0 | AC145: =W145+Q145 -> 0 | AD145: =X145+R145 -> 4 | AE145: =Y145+S145 -> 4 | AF145: =Z145+T145 -> 0 | AG145: =AA145+U145 -> 0
A146: 142 | B146: regiane | C146: 38029.552743055552 | D146: 0 | E146: 0 | F146: 5 | G146: 0 | H146: 0 | I146: 0 | J146: 0 | K146: 1 | L146: 0 | M146: 0 | N146: 0 | O146: 1 | P146: 0 | Q146: 0 | R146: 1 | S146: 1 | T146: 0 | U146: 0 | V146: 0 | W146: 0 | X146: 34 | Y146: 34 | Z146: 0 | AA146: 0 | AB146: =V146+P146 -> 0 | AC146: =W146+Q146 -> 0 | AD146: =X146+R146 -> 35 | AE146: =Y146+S146 -> 35 | AF146: =Z146+T146 -> 0 | AG146: =AA146+U146 -> 0
A147: 143 | B147: natanael | C147: 38029.683611111112 | D147: 0 | E147: 0 | F147: 1 | G147: 0 | H147: 0 | I147: 0 | J147: 0 | K147: 1 | L147: 0 | M147: 0 | N147: 0 | O147: 1 | P147: 0 | Q147: 0 | R147: 1 | S147: 1 | T147: 0 | U147: 0 | V147: 0 | W147: 0 | X147: 9 | Y147: 9 | Z147: 0 | AA147: 0 | AB147: =V147+P147 -> 0 | AC147: =W147+Q147 -> 0 | AD147: =X147+R147 -> 10 | AE147: =Y147+S147 -> 10 | AF147: =Z147+T147 -> 0 | AG147: =AA147+U147 -> 0
A148: 144 | B148: natanael | C148: 38030.129814814813 | D148: 0 | E148: 0 | F148: 1 | G148: 0 | H148: 0 | I148: 0 | J148: 0 | K148: 1 | L148: 0 | M148: 0 | N148: 0 | O148: 1 | P148: 0 | Q148: 0 | R148: 1 | S148: 1 | T148: 0 | U148: 0 | V148: 0 | W148: 0 | X148: 4 | Y148: 4 | Z148: 0 | AA148: 0 | AB148: =V148+P148 -> 0 | AC148: =W148+Q148 -> 0 | AD148: =X148+R148 -> 5 | AE148: =Y148+S148 -> 5 | AF148: =Z148+T148 -> 0 | AG148: =AA148+U148 -> 0
A149: 145 | B149: natanael | C149: 38030.131238425929 | D149: 0 | E149: 0 | F149: 2 | G149: 0 | H149: 0 | I149: 0 | J149: 0 | K149: 2 | L149: 0 | M149: 0 | N149: 0 | O149: 2 | P149: 0 | Q149: 0 | R149: 2 | S149: 2 | T149: 0 | U149: 0 | V149: 0 | W149: 0 | X149: 35 | Y149: 35 | Z149: 0 | AA149: 0 | AB149: =V149+P149 -> 0 | AC149: =W149+Q149 -> 0 | AD149: =X149+R149 -> 37 | AE149: =Y149+S149 -> 37 | AF149: =Z149+T149 -> 0 | AG149: =AA149+U149 -> 0
A150: 146 | B150: anapaula | C150: 38030.773819444446 | D150: 0 | E150: 0 | F150: 2 | G150: 0 | H150: 0 | I150: 0 | J150: 0 | K150: 1 | L150: 0 | M150: 0 | N150: 0 | O150: 1 | P150: 0 | Q150: 0 | R150: 1 | S150: 1 | T150: 0 | U150: 0 | V150: 0 | W150: 0 | X150: 34 | Y150: 34 | Z150: 0 | AA150: 0 | AB150: =V150+P150 -> 0 | AC150: =W150+Q150 -> 0 | AD150: =X150+R150 -> 35 | AE150: =Y150+S150 -> 35 | AF150: =Z150+T150 -> 0 | AG150: =AA150+U150 -> 0
A151: 147 | B151: cristine | C151: 38031.904745370368 | D151: 0 | E151: 0 | F151: 2 | G151: 0 | H151: 0 | I151: 0 | J151: 0 | K151: 2 | L151: 0 | M151: 0 | N151: 0 | O151: 2 | P151: 0 | Q151: 0 | R151: 2 | S151: 2 | T151: 0 | U151: 0 | V151: 0 | W151: 0 | X151: 14 | Y151: 14 | Z151: 0 | AA151: 0 | AB151: =V151+P151 -> 0 | AC151: =W151+Q151 -> 0 | AD151: =X151+R151 -> 16 | AE151: =Y151+S151 -> 16 | AF151: =Z151+T151 -> 0 | AG151: =AA151+U151 -> 0
A152: 148 | B152: natanael | C152: 38034.725601851853 | D152: 0 | E152: 0 | F152: 1 | G152: 0 | H152: 0 | I152: 0 | J152: 0 | K152: 4 | L152: 0 | M152: 0 | N152: 0 | O152: 4 | P152: 0 | Q152: 0 | R152: 4 | S152: 4 | T152: 0 | U152: 0 | V152: 0 | W152: 0 | X152: 0 | Y152: 0 | Z152: 0 | AA152: 0 | AB152: =V152+P152 -> 0 | AC152: =W152+Q152 -> 0 | AD152: =X152+R152 -> 4 | AE152: =Y152+S152 -> 4 | AF152: =Z152+T152 -> 0 | AG152: =AA152+U152 -> 0
A153: 149 | B153: hamilton | C153: 38035.447592592594 | D153: 0 | E153: 0 | F153: 2 | G153: 0 | H153: 0 | I153: 0 | J153: 0 | K153: 0 | L153: 0 | M153: 0 | N153: 0 | O153: 0 | P153: 0 | Q153: 0 | R153: 0 | S153: 0 | T153: 0 | U153: 0 | V153: 0 | W153: 0 | X153: 0 | Y153: 0 | Z153: 0 | AA153: 0 | AB153: =V153+P153 -> 0 | AC153: =W153+Q153 -> 0 | AD153: =X153+R153 -> 0 | AE153: =Y153+S153 -> 0 | AF153: =Z153+T153 -> 0 | AG153: =AA153+U153 -> 0
A154: 150 | B154: carlosjr | C154: 38037.250590277778 | D154: 0 | E154: 0 | F154: 1 | G154: 0 | H154: 0 | I154: 0 | J154: 0 | K154: 1 | L154: 0 | M154: 0 | N154: 0 | O154: 1 | P154: 0 | Q154: 0 | R154: 1 | S154: 1 | T154: 0 | U154: 0 | V154: 0 | W154: 0 | X154: 39 | Y154: 39 | Z154: 0 | AA154: 0 | AB154: =V154+P154 -> 0 | AC154: =W154+Q154 -> 0 | AD154: =X154+R154 -> 40 | AE154: =Y154+S154 -> 40 | AF154: =Z154+T154 -> 0 | AG154: =AA154+U154 -> 0
A155: 151 | B155: cristine | C155: 38038.103576388887 | D155: 0 | E155: 0 | F155: 3 | G155: 0 | H155: 0 | I155: 0 | J155: 0 | K155: 3 | L155: 0 | M155: 0 | N155: 0 | O155: 3 | P155: 0 | Q155: 0 | R155: 3 | S155: 3 | T155: 0 | U155: 0 | V155: 0 | W155: 0 | X155: 10 | Y155: 10 | Z155: 0 | AA155: 0 | AB155: =V155+P155 -> 0 | AC155: =W155+Q155 -> 0 | AD155: =X155+R155 -> 13 | AE155: =Y155+S155 -> 13 | AF155: =Z155+T155 -> 0 | AG155: =AA155+U155 -> 0
A156: 152 | B156: cristine | C156: 38038.783692129633 | D156: 0 | E156: 0 | F156: 1 | G156: 0 | H156: 0 | I156: 0 | J156: 0 | K156: 1 | L156: 0 | M156: 0 | N156: 0 | O156: 1 | P156: 0 | Q156: 0 | R156: 1 | S156: 1 | T156: 0 | U156: 0 | V156: 0 | W156: 0 | X156: 10 | Y156: 10 | Z156: 0 | AA156: 0 | AB156: =V156+P156 -> 0 | AC156: =W156+Q156 -> 0 | AD156: =X156+R156 -> 11 | AE156: =Y156+S156 -> 11 | AF156: =Z156+T156 -> 0 | AG156: =AA156+U156 -> 0
A157: 153 | B157: carlosjr | C157: 38044.925694444442 | D157: 0 | E157: 0 | F157: 1 | G157: 0 | H157: 0 | I157: 0 | J157: 0 | K157: 1 | L157: 0 | M157: 0 | N157: 0 | O157: 1 | P157: 0 | Q157: 0 | R157: 1 | S157: 1 | T157: 0 | U157: 0 | V157: 0 | W157: 0 | X157: 39 | Y157: 39 | Z157: 0 | AA157: 0 | AB157: =V157+P157 -> 0 | AC157: =W157+Q157 -> 0 | AD157: =X157+R157 -> 40 | AE157: =Y157+S157 -> 40 | AF157: =Z157+T157 -> 0 | AG157: =AA157+U157 -> 0
A158: 154 | B158: natanael | C158: 38051.51189814815 | D158: 0 | E158: 0 | F158: 1 | G158: 0 | H158: 0 | I158: 0 | J158: 0 | K158: 1 | L158: 0 | M158: 0 | N158: 0 | O158: 1 | P158: 0 | Q158: 0 | R158: 1 | S158: 1 | T158: 0 | U158: 0 | V158: 0 | W158: 0 | X158: 14 | Y158: 14 | Z158: 0 | AA158: 0 | AB158: =V158+P158 -> 0 | AC158: =W158+Q158 -> 0 | AD158: =X158+R158 -> 15 | AE158: =Y158+S158 -> 15 | AF158: =Z158+T158 -> 0 | AG158: =AA158+U158 -> 0
A159: 155 | B159: natanael | C159: 38051.513182870367 | D159: 0 | E159: 0 | F159: 1 | G159: 0 | H159: 0 | I159: 0 | J159: 0 | K159: 1 | L159: 0 | M159: 0 | N159: 0 | O159: 1 | P159: 0 | Q159: 0 | R159: 1 | S159: 1 | T159: 0 | U159: 0 | V159: 0 | W159: 0 | X159: 6 | Y159: 6 | Z159: 0 | AA159: 0 | AB159: =V159+P159 -> 0 | AC159: =W159+Q159 -> 0 | AD159: =X159+R159 -> 7 | AE159: =Y159+S159 -> 7 | AF159: =Z159+T159 -> 0 | AG159: =AA159+U159 -> 0
A160: 156 | B160: stainam | C160: 38058.935856481483 | D160: 0 | E160: 0 | F160: 3 | G160: 0 | H160: 0 | I160: 0 | J160: 0 | K160: 6 | L160: 0 | M160: 0 | N160: 0 | O160: 6 | P160: 0 | Q160: 0 | R160: 6 | S160: 6 | T160: 0 | U160: 0 | V160: 0 | W160: 0 | X160: 28 | Y160: 28 | Z160: 0 | AA160: 0 | AB160: =V160+P160 -> 0 | AC160: =W160+Q160 -> 0 | AD160: =X160+R160 -> 34 | AE160: =Y160+S160 -> 34 | AF160: =Z160+T160 -> 0 | AG160: =AA160+U160 -> 0
A161: 157 | B161: carlosjr | C161: 38068.684837962966 | D161: 0 | E161: 0 | F161: 8 | G161: 0 | H161: 0 | I161: 0 | J161: 0 | K161: 15 | L161: 0 | M161: 0 | N161: 0 | O161: 15 | P161: 0 | Q161: 0 | R161: 15 | S161: 15 | T161: 0 | U161: 0 | V161: 0 | W161: 0 | X161: 53 | Y161: 53 | Z161: 0 | AA161: 0 | AB161: =V161+P161 -> 0 | AC161: =W161+Q161 -> 0 | AD161: =X161+R161 -> 68 | AE161: =Y161+S161 -> 68 | AF161: =Z161+T161 -> 0 | AG161: =AA161+U161 -> 0
A162: 158 | B162: carlosjr | C162: 38075.603564814817 | D162: 0 | E162: 0 | F162: 3 | G162: 0 | H162: 0 | I162: 0 | J162: 0 | K162: 1 | L162: 0 | M162: 0 | N162: 0 | O162: 1 | P162: 0 | Q162: 0 | R162: 1 | S162: 1 | T162: 0 | U162: 0 | V162: 0 | W162: 0 | X162: 10 | Y162: 10 | Z162: 0 | AA162: 0 | AB162: =V162+P162 -> 0 | AC162: =W162+Q162 -> 0 | AD162: =X162+R162 -> 11 | AE162: =Y162+S162 -> 11 | AF162: =Z162+T162 -> 0 | AG162: =AA162+U162 -> 0
A163: 159 | B163: mlopes | C163: 38091.280821759261 | D163: 0 | E163: 0 | F163: 1 | G163: 0 | H163: 0 | I163: 0 | J163: 0 | K163: 0 | L163: 0 | M163: 0 | N163: 0 | O163: 0 | P163: 0 | Q163: 0 | R163: 0 | S163: 0 | T163: 0 | U163: 0 | V163: 0 | W163: 0 | X163: 0 | Y163: 0 | Z163: 0 | AA163: 0 | AB163: =V163+P163 -> 0 | AC163: =W163+Q163 -> 0 | AD163: =X163+R163 -> 0 | AE163: =Y163+S163 -> 0 | AF163: =Z163+T163 -> 0 | AG163: =AA163+U163 -> 0
A164: 160 | B164: mlopes | C164: 38091.989317129628 | D164: 0 | E164: 0 | F164: 2 | G164: 0 | H164: 0 | I164: 0 | J164: 0 | K164: 1 | L164: 0 | M164: 0 | N164: 0 | O164: 1 | P164: 0 | Q164: 0 | R164: 1 | S164: 1 | T164: 0 | U164: 0 | V164: 0 | W164: 0 | X164: 4 | Y164: 4 | Z164: 0 | AA164: 0 | AB164: =V164+P164 -> 0 | AC164: =W164+Q164 -> 0 | AD164: =X164+R164 -> 5 | AE164: =Y164+S164 -> 5 | AF164: =Z164+T164 -> 0 | AG164: =AA164+U164 -> 0
A165: 161 | B165: murta | C165: 38112.731932870367 | D165: 0 | E165: 0 | F165: 10 | G165: 0 | H165: 0 | I165: 0 | J165: 0 | K165: 2 | L165: 0 | M165: 0 | N165: 0 | O165: 2 | P165: 0 | Q165: 0 | R165: 2 | S165: 2 | T165: 0 | U165: 0 | V165: 0 | W165: 0 | X165: 10 | Y165: 10 | Z165: 0 | AA165: 0 | AB165: =V165+P165 -> 0 | AC165: =W165+Q165 -> 0 | AD165: =X165+R165 -> 12 | AE165: =Y165+S165 -> 12 | AF165: =Z165+T165 -> 0 | AG165: =AA165+U165 -> 0
A166: 162 | B166: carlosjr | C166: 38122.878784722219 | D166: 3 | E166: 0 | F166: 0 | G166: 0 | H166: 0 | I166: 0 | J166: 0 | K166: 1 | L166: 0 | M166: 0 | N166: 0 | O166: 1 | P166: 0 | Q166: 0 | R166: 1 | S166: 1 | T166: 0 | U166: 0 | V166: 0 | W166: 0 | X166: 13 | Y166: 10 | Z166: 0 | AA166: 0 | AB166: =V166+P166 -> 0 | AC166: =W166+Q166 -> 0 | AD166: =X166+R166 -> 14 | AE166: =Y166+S166 -> 11 | AF166: =Z166+T166 -> 0 | AG166: =AA166+U166 -> 0
A167: 163 | B167: carlosjr | C167: 38123.216215277775 | D167: 0 | E167: 0 | F167: 3 | G167: 0 | H167: 0 | I167: 0 | J167: 0 | K167: 1 | L167: 0 | M167: 0 | N167: 0 | O167: 1 | P167: 0 | Q167: 0 | R167: 1 | S167: 1 | T167: 0 | U167: 0 | V167: 0 | W167: 0 | X167: 4 | Y167: 4 | Z167: 0 | AA167: 0 | AB167: =V167+P167 -> 0 | AC167: =W167+Q167 -> 0 | AD167: =X167+R167 -> 5 | AE167: =Y167+S167 -> 5 | AF167: =Z167+T167 -> 0 | AG167: =AA167+U167 -> 0
A168: 164 | B168: carlosjr | C168: 38123.21837962963 | D168: 0 | E168: 1 | F168: 1 | G168: 0 | H168: 0 | I168: 0 | J168: 0 | K168: 12 | L168: 0 | M168: 0 | N168: 0 | O168: 12 | P168: 0 | Q168: 0 | R168: 12 | S168: 12 | T168: 0 | U168: 0 | V168: 0 | W168: 0 | X168: 12 | Y168: 13 | Z168: 0 | AA168: 0 | AB168: =V168+P168 -> 0 | AC168: =W168+Q168 -> 0 | AD168: =X168+R168 -> 24 | AE168: =Y168+S168 -> 25 | AF168: =Z168+T168 -> 0 | AG168: =AA168+U168 -> 0
A169: 165 | B169: carlosjr | C169: 38123.218773148146 | D169: 0 | E169: 2 | F169: 3 | G169: 0 | H169: 0 | I169: 0 | J169: 0 | K169: 1 | L169: 0 | M169: 0 | N169: 0 | O169: 1 | P169: 0 | Q169: 0 | R169: 1 | S169: 1 | T169: 0 | U169: 0 | V169: 0 | W169: 0 | X169: 10 | Y169: 12 | Z169: 0 | AA169: 0 | AB169: =V169+P169 -> 0 | AC169: =W169+Q169 -> 0 | AD169: =X169+R169 -> 11 | AE169: =Y169+S169 -> 13 | AF169: =Z169+T169 -> 0 | AG169: =AA169+U169 -> 0
A170: 166 | B170: murta | C170: 38123.653912037036 | D170: 0 | E170: 0 | F170: 14 | G170: 0 | H170: 0 | I170: 0 | J170: 0 | K170: 14 | L170: 0 | M170: 0 | N170: 0 | O170: 14 | P170: 0 | Q170: 0 | R170: 14 | S170: 14 | T170: 0 | U170: 0 | V170: 0 | W170: 0 | X170: 86 | Y170: 86 | Z170: 0 | AA170: 0 | AB170: =V170+P170 -> 0 | AC170: =W170+Q170 -> 0 | AD170: =X170+R170 -> 100 | AE170: =Y170+S170 -> 100 | AF170: =Z170+T170 -> 0 | AG170: =AA170+U170 -> 0
A171: 167 | B171: carlosjr | C171: 38123.799629629626 | D171: 0 | E171: 0 | F171: 6 | G171: 0 | H171: 0 | I171: 0 | J171: 0 | K171: 15 | L171: 0 | M171: 0 | N171: 0 | O171: 15 | P171: 0 | Q171: 0 | R171: 15 | S171: 15 | T171: 0 | U171: 0 | V171: 0 | W171: 0 | X171: 56 | Y171: 56 | Z171: 0 | AA171: 0 | AB171: =V171+P171 -> 0 | AC171: =W171+Q171 -> 0 | AD171: =X171+R171 -> 71 | AE171: =Y171+S171 -> 71 | AF171: =Z171+T171 -> 0 | AG171: =AA171+U171 -> 0
A172: 168 | B172: carlosjr | C172: 38123.824247685188 | D172: 0 | E172: 0 | F172: 2 | G172: 0 | H172: 0 | I172: 0 | J172: 0 | K172: 1 | L172: 0 | M172: 0 | N172: 0 | O172: 1 | P172: 0 | Q172: 0 | R172: 1 | S172: 1 | T172: 0 | U172: 0 | V172: 0 | W172: 0 | X172: 4 | Y172: 4 | Z172: 0 | AA172: 0 | AB172: =V172+P172 -> 0 | AC172: =W172+Q172 -> 0 | AD172: =X172+R172 -> 5 | AE172: =Y172+S172 -> 5 | AF172: =Z172+T172 -> 0 | AG172: =AA172+U172 -> 0
A173: 169 | B173: carlosjr | C173: 38123.826249999998 | D173: 0 | E173: 0 | F173: 1 | G173: 0 | H173: 0 | I173: 0 | J173: 0 | K173: 1 | L173: 0 | M173: 0 | N173: 0 | O173: 1 | P173: 0 | Q173: 0 | R173: 1 | S173: 1 | T173: 0 | U173: 0 | V173: 0 | W173: 0 | X173: 4 | Y173: 4 | Z173: 0 | AA173: 0 | AB173: =V173+P173 -> 0 | AC173: =W173+Q173 -> 0 | AD173: =X173+R173 -> 5 | AE173: =Y173+S173 -> 5 | AF173: =Z173+T173 -> 0 | AG173: =AA173+U173 -> 0
A174: 170 | B174: murta | C174: 38123.896874999999 | D174: 0 | E174: 0 | F174: 1 | G174: 0 | H174: 0 | I174: 0 | J174: 0 | K174: 0 | L174: 0 | M174: 0 | N174: 0 | O174: 0 | P174: 0 | Q174: 0 | R174: 0 | S174: 0 | T174: 0 | U174: 0 | V174: 0 | W174: 0 | X174: 0 | Y174: 0 | Z174: 0 | AA174: 0 | AB174: =V174+P174 -> 0 | AC174: =W174+Q174 -> 0 | AD174: =X174+R174 -> 0 | AE174: =Y174+S174 -> 0 | AF174: =Z174+T174 -> 0 | AG174: =AA174+U174 -> 0
A175: 171 | B175: murta | C175: 38123.904039351852 | D175: 0 | E175: 0 | F175: 1 | G175: 0 | H175: 0 | I175: 0 | J175: 0 | K175: 0 | L175: 0 | M175: 0 | N175: 0 | O175: 0 | P175: 0 | Q175: 0 | R175: 0 | S175: 0 | T175: 0 | U175: 0 | V175: 0 | W175: 0 | X175: 0 | Y175: 0 | Z175: 0 | AA175: 0 | AB175: =V175+P175 -> 0 | AC175: =W175+Q175 -> 0 | AD175: =X175+R175 -> 0 | AE175: =Y175+S175 -> 0 | AF175: =Z175+T175 -> 0 | AG175: =AA175+U175 -> 0
A176: 172 | B176: murta | C176: 38123.951701388891 | D176: 0 | E176: 0 | F176: 1 | G176: 0 | H176: 0 | I176: 0 | J176: 0 | K176: 1 | L176: 0 | M176: 0 | N176: 0 | O176: 1 | P176: 0 | Q176: 0 | R176: 1 | S176: 1 | T176: 0 | U176: 0 | V176: 0 | W176: 0 | X176: 4 | Y176: 4 | Z176: 0 | AA176: 0 | AB176: =V176+P176 -> 0 | AC176: =W176+Q176 -> 0 | AD176: =X176+R176 -> 5 | AE176: =Y176+S176 -> 5 | AF176: =Z176+T176 -> 0 | AG176: =AA176+U176 -> 0
A177: 173 | B177: murta | C177: 38123.996111111112 | D177: 0 | E177: 0 | F177: 2 | G177: 0 | H177: 0 | I177: 0 | J177: 0 | K177: 1 | L177: 0 | M177: 0 | N177: 0 | O177: 1 | P177: 0 | Q177: 0 | R177: 1 | S177: 1 | T177: 0 | U177: 0 | V177: 0 | W177: 0 | X177: 4 | Y177: 4 | Z177: 0 | AA177: 0 | AB177: =V177+P177 -> 0 | AC177: =W177+Q177 -> 0 | AD177: =X177+R177 -> 5 | AE177: =Y177+S177 -> 5 | AF177: =Z177+T177 -> 0 | AG177: =AA177+U177 -> 0
A178: 174 | B178: murta | C178: 38124.619456018518 | D178: 0 | E178: 0 | F178: 2 | G178: 0 | H178: 0 | I178: 0 | J178: 0 | K178: 1 | L178: 0 | M178: 0 | N178: 0 | O178: 1 | P178: 0 | Q178: 0 | R178: 1 | S178: 1 | T178: 0 | U178: 0 | V178: 0 | W178: 0 | X178: 0 | Y178: 0 | Z178: 0 | AA178: 0 | AB178: =V178+P178 -> 0 | AC178: =W178+Q178 -> 0 | AD178: =X178+R178 -> 1 | AE178: =Y178+S178 -> 1 | AF178: =Z178+T178 -> 0 | AG178: =AA178+U178 -> 0
A179: 175 | B179: murta | C179: 38124.622800925928 | D179: 0 | E179: 0 | F179: 1 | G179: 0 | H179: 0 | I179: 0 | J179: 0 | K179: 0 | L179: 0 | M179: 0 | N179: 0 | O179: 0 | P179: 0 | Q179: 0 | R179: 0 | S179: 0 | T179: 0 | U179: 0 | V179: 0 | W179: 0 | X179: 0 | Y179: 0 | Z179: 0 | AA179: 0 | AB179: =V179+P179 -> 0 | AC179: =W179+Q179 -> 0 | AD179: =X179+R179 -> 0 | AE179: =Y179+S179 -> 0 | AF179: =Z179+T179 -> 0 | AG179: =AA179+U179 -> 0
A180: 176 | B180: murta | C180: 38124.640138888892 | D180: 0 | E180: 0 | F180: 1 | G180: 0 | H180: 0 | I180: 0 | J180: 0 | K180: 0 | L180: 0 | M180: 0 | N180: 0 | O180: 0 | P180: 0 | Q180: 0 | R180: 0 | S180: 0 | T180: 0 | U180: 0 | V180: 0 | W180: 0 | X180: 0 | Y180: 0 | Z180: 0 | AA180: 0 | AB180: =V180+P180 -> 0 | AC180: =W180+Q180 -> 0 | AD180: =X180+R180 -> 0 | AE180: =Y180+S180 -> 0 | AF180: =Z180+T180 -> 0 | AG180: =AA180+U180 -> 0
A181: 177 | B181: murta | C181: 38124.65792824074 | D181: 0 | E181: 0 | F181: 2 | G181: 0 | H181: 0 | I181: 0 | J181: 0 | K181: 2 | L181: 0 | M181: 0 | N181: 220 | O181: 2 | P181: 0 | Q181: 0 | R181: 222 | S181: 2 | T181: 0 | U181: 0 | V181: 0 | W181: 0 | X181: 575 | Y181: 0 | Z181: 0 | AA181: 0 | AB181: =V181+P181 -> 0 | AC181: =W181+Q181 -> 0 | AD181: =X181+R181 -> 797 | AE181: =Y181+S181 -> 2 | AF181: =Z181+T181 -> 0 | AG181: =AA181+U181 -> 0
A182: 178 | B182: carlosjr | C182: 38124.693449074075 | D182: 0 | E182: 0 | F182: 19 | G182: 0 | H182: 29 | I182: 0 | J182: 0 | K182: 29 | L182: 0 | M182: 0 | N182: 0 | O182: 58 | P182: 0 | Q182: 0 | R182: 29 | S182: 29 | T182: 0 | U182: 0 | V182: 0 | W182: 0 | X182: 204 | Y182: 204 | Z182: 0 | AA182: 0 | AB182: =V182+P182 -> 0 | AC182: =W182+Q182 -> 0 | AD182: =X182+R182 -> 233 | AE182: =Y182+S182 -> 233 | AF182: =Z182+T182 -> 0 | AG182: =AA182+U182 -> 0
A183: 179 | B183: carlosjr | C183: 38124.729826388888 | D183: 0 | E183: 1 | F183: 10 | G183: 0 | H183: 6 | I183: 0 | J183: 0 | K183: 6 | L183: 0 | M183: 0 | N183: 0 | O183: 12 | P183: 0 | Q183: 0 | R183: 6 | S183: 6 | T183: 0 | U183: 0 | V183: 0 | W183: 0 | X183: 83 | Y183: 83 | Z183: 0 | AA183: 0 | AB183: =V183+P183 -> 0 | AC183: =W183+Q183 -> 0 | AD183: =X183+R183 -> 89 | AE183: =Y183+S183 -> 89 | AF183: =Z183+T183 -> 0 | AG183: =AA183+U183 -> 0
A184: 180 | B184: carlosjr | C184: 38124.774942129632 | D184: 0 | E184: 0 | F184: 1 | G184: 0 | H184: 1 | I184: 0 | J184: 0 | K184: 1 | L184: 0 | M184: 0 | N184: 0 | O184: 2 | P184: 0 | Q184: 0 | R184: 1 | S184: 1 | T184: 0 | U184: 0 | V184: 0 | W184: 0 | X184: 10 | Y184: 10 | Z184: 0 | AA184: 0 | AB184: =V184+P184 -> 0 | AC184: =W184+Q184 -> 0 | AD184: =X184+R184 -> 11 | AE184: =Y184+S184 -> 11 | AF184: =Z184+T184 -> 0 | AG184: =AA184+U184 -> 0
A185: 181 | B185: carlosjr | C185: 38126.879224537035 | D185: 0 | E185: 0 | F185: 1 | G185: 0 | H185: 11 | I185: 0 | J185: 0 | K185: 11 | L185: 0 | M185: 0 | N185: 0 | O185: 22 | P185: 0 | Q185: 0 | R185: 11 | S185: 11 | T185: 0 | U185: 0 | V185: 0 | W185: 0 | X185: 0 | Y185: 0 | Z185: 0 | AA185: 0 | AB185: =V185+P185 -> 0 | AC185: =W185+Q185 -> 0 | AD185: =X185+R185 -> 11 | AE185: =Y185+S185 -> 11 | AF185: =Z185+T185 -> 0 | AG185: =AA185+U185 -> 0
A186: 182 | B186: carlosjr | C186: 38126.88484953704 | D186: 0 | E186: 0 | F186: 2 | G186: 0 | H186: 1 | I186: 0 | J186: 0 | K186: 1 | L186: 0 | M186: 0 | N186: 0 | O186: 2 | P186: 0 | Q186: 0 | R186: 1 | S186: 1 | T186: 0 | U186: 0 | V186: 0 | W186: 0 | X186: 4 | Y186: 4 | Z186: 0 | AA186: 0 | AB186: =V186+P186 -> 0 | AC186: =W186+Q186 -> 0 | AD186: =X186+R186 -> 5 | AE186: =Y186+S186 -> 5 | AF186: =Z186+T186 -> 0 | AG186: =AA186+U186 -> 0
A187: 183 | B187: carlosjr | C187: 38128.845451388886 | D187: 0 | E187: 0 | F187: 5 | G187: 0 | H187: 1 | I187: 0 | J187: 0 | K187: 1 | L187: 0 | M187: 0 | N187: 0 | O187: 2 | P187: 0 | Q187: 0 | R187: 1 | S187: 1 | T187: 0 | U187: 0 | V187: 0 | W187: 0 | X187: 10 | Y187: 10 | Z187: 0 | AA187: 0 | AB187: =V187+P187 -> 0 | AC187: =W187+Q187 -> 0 | AD187: =X187+R187 -> 11 | AE187: =Y187+S187 -> 11 | AF187: =Z187+T187 -> 0 | AG187: =AA187+U187 -> 0
A188: 184 | B188: carlosjr | C188: 38128.873090277775 | D188: 0 | E188: 0 | F188: 1 | G188: 0 | H188: 1 | I188: 0 | J188: 0 | K188: 1 | L188: 0 | M188: 0 | N188: 0 | O188: 2 | P188: 0 | Q188: 0 | R188: 1 | S188: 1 | T188: 0 | U188: 0 | V188: 0 | W188: 0 | X188: 10 | Y188: 10 | Z188: 0 | AA188: 0 | AB188: =V188+P188 -> 0 | AC188: =W188+Q188 -> 0 | AD188: =X188+R188 -> 11 | AE188: =Y188+S188 -> 11 | AF188: =Z188+T188 -> 0 | AG188: =AA188+U188 -> 0
A189: 185 | B189: carlosjr | C189: 38128.934444444443 | D189: 0 | E189: 0 | F189: 1 | G189: 0 | H189: 1 | I189: 0 | J189: 0 | K189: 1 | L189: 0 | M189: 0 | N189: 0 | O189: 2 | P189: 0 | Q189: 0 | R189: 1 | S189: 1 | T189: 0 | U189: 0 | V189: 0 | W189: 0 | X189: 10 | Y189: 10 | Z189: 0 | AA189: 0 | AB189: =V189+P189 -> 0 | AC189: =W189+Q189 -> 0 | AD189: =X189+R189 -> 11 | AE189: =Y189+S189 -> 11 | AF189: =Z189+T189 -> 0 | AG189: =AA189+U189 -> 0
A190: 186 | B190: carlosjr | C190: 38131.712719907409 | D190: 0 | E190: 0 | F190: 1 | G190: 0 | H190: 4 | I190: 0 | J190: 0 | K190: 4 | L190: 0 | M190: 0 | N190: 0 | O190: 8 | P190: 0 | Q190: 0 | R190: 4 | S190: 4 | T190: 0 | U190: 0 | V190: 0 | W190: 0 | X190: 0 | Y190: 0 | Z190: 0 | AA190: 0 | AB190: =V190+P190 -> 0 | AC190: =W190+Q190 -> 0 | AD190: =X190+R190 -> 4 | AE190: =Y190+S190 -> 4 | AF190: =Z190+T190 -> 0 | AG190: =AA190+U190 -> 0
A191: 187 | B191: carlosjr | C191: 38131.713206018518 | D191: 0 | E191: 0 | F191: 6 | G191: 0 | H191: 1 | I191: 0 | J191: 0 | K191: 1 | L191: 0 | M191: 0 | N191: 0 | O191: 2 | P191: 0 | Q191: 0 | R191: 1 | S191: 1 | T191: 0 | U191: 0 | V191: 0 | W191: 0 | X191: 10 | Y191: 10 | Z191: 0 | AA191: 0 | AB191: =V191+P191 -> 0 | AC191: =W191+Q191 -> 0 | AD191: =X191+R191 -> 11 | AE191: =Y191+S191 -> 11 | AF191: =Z191+T191 -> 0 | AG191: =AA191+U191 -> 0
A192: 188 | B192: carlosjr | C192: 38131.801898148151 | D192: 0 | E192: 0 | F192: 4 | G192: 0 | H192: 1 | I192: 0 | J192: 0 | K192: 1 | L192: 0 | M192: 0 | N192: 0 | O192: 2 | P192: 0 | Q192: 0 | R192: 1 | S192: 1 | T192: 0 | U192: 0 | V192: 0 | W192: 0 | X192: 10 | Y192: 10 | Z192: 0 | AA192: 0 | AB192: =V192+P192 -> 0 | AC192: =W192+Q192 -> 0 | AD192: =X192+R192 -> 11 | AE192: =Y192+S192 -> 11 | AF192: =Z192+T192 -> 0 | AG192: =AA192+U192 -> 0
A193: 189 | B193: carlosjr | C193: 38131.858634259261 | D193: 0 | E193: 0 | F193: 4 | G193: 0 | H193: 1 | I193: 0 | J193: 0 | K193: 1 | L193: 0 | M193: 0 | N193: 0 | O193: 2 | P193: 0 | Q193: 0 | R193: 1 | S193: 1 | T193: 0 | U193: 0 | V193: 0 | W193: 0 | X193: 10 | Y193: 10 | Z193: 0 | AA193: 0 | AB193: =V193+P193 -> 0 | AC193: =W193+Q193 -> 0 | AD193: =X193+R193 -> 11 | AE193: =Y193+S193 -> 11 | AF193: =Z193+T193 -> 0 | AG193: =AA193+U193 -> 0
A194: 190 | B194: murta | C194: 38132.073495370372 | D194: 0 | E194: 0 | F194: 1 | G194: 0 | H194: 4 | I194: 0 | J194: 0 | K194: 4 | L194: 0 | M194: 0 | N194: 0 | O194: 8 | P194: 0 | Q194: 0 | R194: 4 | S194: 4 | T194: 0 | U194: 0 | V194: 0 | W194: 0 | X194: 0 | Y194: 0 | Z194: 0 | AA194: 0 | AB194: =V194+P194 -> 0 | AC194: =W194+Q194 -> 0 | AD194: =X194+R194 -> 4 | AE194: =Y194+S194 -> 4 | AF194: =Z194+T194 -> 0 | AG194: =AA194+U194 -> 0
A195: 191 | B195: carlosjr | C195: 38132.811018518521 | D195: 0 | E195: 0 | F195: 2 | G195: 0 | H195: 1 | I195: 0 | J195: 0 | K195: 1 | L195: 0 | M195: 0 | N195: 0 | O195: 2 | P195: 0 | Q195: 0 | R195: 1 | S195: 1 | T195: 0 | U195: 0 | V195: 0 | W195: 0 | X195: 10 | Y195: 10 | Z195: 0 | AA195: 0 | AB195: =V195+P195 -> 0 | AC195: =W195+Q195 -> 0 | AD195: =X195+R195 -> 11 | AE195: =Y195+S195 -> 11 | AF195: =Z195+T195 -> 0 | AG195: =AA195+U195 -> 0
A196: 192 | B196: mlopes | C196: 38133.305451388886 | D196: 0 | E196: 0 | F196: 1 | G196: 0 | H196: 0 | I196: 0 | J196: 0 | K196: 0 | L196: 0 | M196: 0 | N196: 0 | O196: 0 | P196: 0 | Q196: 0 | R196: 0 | S196: 0 | T196: 0 | U196: 0 | V196: 0 | W196: 0 | X196: 0 | Y196: 0 | Z196: 0 | AA196: 0 | AB196: =V196+P196 -> 0 | AC196: =W196+Q196 -> 0 | AD196: =X196+R196 -> 0 | AE196: =Y196+S196 -> 0 | AF196: =Z196+T196 -> 0 | AG196: =AA196+U196 -> 0
A197: 193 | B197: cristine | C197: 38133.711180555554 | D197: 8 | E197: 0 | F197: 1 | G197: 0 | H197: 0 | I197: 0 | J197: 0 | K197: 0 | L197: 0 | M197: 0 | N197: 0 | O197: 0 | P197: 0 | Q197: 0 | R197: 0 | S197: 0 | T197: 0 | U197: 0 | V197: 0 | W197: 0 | X197: 0 | Y197: 0 | Z197: 0 | AA197: 0 | AB197: =V197+P197 -> 0 | AC197: =W197+Q197 -> 0 | AD197: =X197+R197 -> 0 | AE197: =Y197+S197 -> 0 | AF197: =Z197+T197 -> 0 | AG197: =AA197+U197 -> 0
A198: 194 | B198: murta | C198: 38136.855127314811 | D198: 0 | E198: 8 | F198: 0 | G198: 0 | H198: 0 | I198: 0 | J198: 0 | K198: 0 | L198: 0 | M198: 0 | N198: 0 | O198: 0 | P198: 0 | Q198: 0 | R198: 0 | S198: 0 | T198: 0 | U198: 0 | V198: 0 | W198: 0 | X198: 0 | Y198: 0 | Z198: 0 | AA198: 0 | AB198: =V198+P198 -> 0 | AC198: =W198+Q198 -> 0 | AD198: =X198+R198 -> 0 | AE198: =Y198+S198 -> 0 | AF198: =Z198+T198 -> 0 | AG198: =AA198+U198 -> 0
A199: 195 | B199: murta | C199: 38136.917071759257 | D199: 0 | E199: 0 | F199: 1 | G199: 0 | H199: 0 | I199: 0 | J199: 0 | K199: 0 | L199: 0 | M199: 0 | N199: 0 | O199: 0 | P199: 0 | Q199: 0 | R199: 0 | S199: 0 | T199: 0 | U199: 0 | V199: 0 | W199: 0 | X199: 0 | Y199: 0 | Z199: 0 | AA199: 0 | AB199: =V199+P199 -> 0 | AC199: =W199+Q199 -> 0 | AD199: =X199+R199 -> 0 | AE199: =Y199+S199 -> 0 | AF199: =Z199+T199 -> 0 | AG199: =AA199+U199 -> 0
A200: 196 | B200: carlosjr | C200: 38141.778252314813 | D200: 0 | E200: 0 | F200: 1 | G200: 0 | H200: 1 | I200: 0 | J200: 0 | K200: 1 | L200: 0 | M200: 0 | N200: 0 | O200: 2 | P200: 0 | Q200: 0 | R200: 1 | S200: 1 | T200: 0 | U200: 0 | V200: 0 | W200: 0 | X200: 4 | Y200: 4 | Z200: 0 | AA200: 0 | AB200: =V200+P200 -> 0 | AC200: =W200+Q200 -> 0 | AD200: =X200+R200 -> 5 | AE200: =Y200+S200 -> 5 | AF200: =Z200+T200 -> 0 | AG200: =AA200+U200 -> 0
A201: 197 | B201: anapaula | C201: 38169.490543981483 | D201: 0 | E201: 0 | F201: 4 | G201: 0 | H201: 24 | I201: 0 | J201: 0 | K201: 24 | L201: 0 | M201: 0 | N201: 0 | O201: 48 | P201: 0 | Q201: 0 | R201: 24 | S201: 24 | T201: 0 | U201: 0 | V201: 0 | W201: 0 | X201: 38 | Y201: 38 | Z201: 0 | AA201: 0 | AB201: =V201+P201 -> 0 | AC201: =W201+Q201 -> 0 | AD201: =X201+R201 -> 62 | AE201: =Y201+S201 -> 62 | AF201: =Z201+T201 -> 0 | AG201: =AA201+U201 -> 0
A202: 198 | B202: mlopes | C202: 38201.080671296295 | D202: 4 | E202: 0 | F202: 14 | G202: 0 | H202: 15 | I202: 0 | J202: 0 | K202: 15 | L202: 0 | M202: 0 | N202: 220 | O202: 30 | P202: 1 | Q202: 0 | R202: 235 | S202: 15 | T202: 0 | U202: 0 | V202: 3 | W202: 0 | X202: 603 | Y202: 28 | Z202: 0 | AA202: 0 | AB202: =V202+P202 -> 4 | AC202: =W202+Q202 -> 0 | AD202: =X202+R202 -> 838 | AE202: =Y202+S202 -> 43 | AF202: =Z202+T202 -> 0 | AG202: =AA202+U202 -> 0
A203: 199 | B203: mangan | C203: 38226.565798611111 | D203: 0 | E203: 0 | F203: 1 | G203: 0 | H203: 2 | I203: 0 | J203: 0 | K203: 1 | L203: 0 | M203: 0 | N203: 0 | O203: 3 | P203: 0 | Q203: 0 | R203: 1 | S203: 1 | T203: 0 | U203: 0 | V203: 0 | W203: 0 | X203: 4 | Y203: 4 | Z203: 0 | AA203: 0 | AB203: =V203+P203 -> 0 | AC203: =W203+Q203 -> 0 | AD203: =X203+R203 -> 5 | AE203: =Y203+S203 -> 5 | AF203: =Z203+T203 -> 0 | AG203: =AA203+U203 -> 0
A204: 200 | B204: mangan | C204: 38226.566053240742 | D204: 0 | E204: 0 | F204: 3 | G204: 0 | H204: 6 | I204: 0 | J204: 0 | K204: 3 | L204: 0 | M204: 0 | N204: 0 | O204: 9 | P204: 0 | Q204: 0 | R204: 3 | S204: 3 | T204: 0 | U204: 0 | V204: 0 | W204: 0 | X204: 77 | Y204: 77 | Z204: 0 | AA204: 0 | AB204: =V204+P204 -> 0 | AC204: =W204+Q204 -> 0 | AD204: =X204+R204 -> 80 | AE204: =Y204+S204 -> 80 | AF204: =Z204+T204 -> 0 | AG204: =AA204+U204 -> 0
A205: 201 | B205: mlopes | C205: 38233.222962962966 | D205: 0 | E205: 0 | F205: 3 | G205: 0 | H205: 10 | I205: 0 | J205: 0 | K205: 5 | L205: 0 | M205: 0 | N205: 0 | O205: 15 | P205: 0 | Q205: 0 | R205: 5 | S205: 5 | T205: 0 | U205: 0 | V205: 0 | W205: 0 | X205: 8 | Y205: 8 | Z205: 0 | AA205: 0 | AB205: =V205+P205 -> 0 | AC205: =W205+Q205 -> 0 | AD205: =X205+R205 -> 13 | AE205: =Y205+S205 -> 13 | AF205: =Z205+T205 -> 0 | AG205: =AA205+U205 -> 0
A206: 202 | B206: natanael | C206: 38234.114131944443 | D206: 37 | E206: 0 | F206: 0 | G206: 0 | H206: 0 | I206: 0 | J206: 0 | K206: 0 | L206: 0 | M206: 0 | N206: 0 | O206: 0 | P206: 1 | Q206: 0 | R206: 0 | S206: 0 | T206: 0 | U206: 0 | V206: 36 | W206: 0 | X206: 0 | Y206: 0 | Z206: 0 | AA206: 0 | AB206: =V206+P206 -> 37 | AC206: =W206+Q206 -> 0 | AD206: =X206+R206 -> 0 | AE206: =Y206+S206 -> 0 | AF206: =Z206+T206 -> 0 | AG206: =AA206+U206 -> 0
A207: 203 | B207: natanael | C207: 38235.052118055559 | D207: 0 | E207: 0 | F207: 42 | G207: 0 | H207: 84 | I207: 0 | J207: 0 | K207: 43 | L207: 0 | M207: 0 | N207: 0 | O207: 127 | P207: 0 | Q207: 0 | R207: 43 | S207: 43 | T207: 0 | U207: 0 | V207: 0 | W207: 0 | X207: 175 | Y207: 175 | Z207: 0 | AA207: 0 | AB207: =V207+P207 -> 0 | AC207: =W207+Q207 -> 0 | AD207: =X207+R207 -> 218 | AE207: =Y207+S207 -> 218 | AF207: =Z207+T207 -> 0 | AG207: =AA207+U207 -> 0
A208: 204 | B208: mlopes | C208: 38238.101898148147 | D208: 0 | E208: 0 | F208: 3 | G208: 0 | H208: 6 | I208: 0 | J208: 0 | K208: 3 | L208: 0 | M208: 0 | N208: 0 | O208: 9 | P208: 0 | Q208: 0 | R208: 3 | S208: 3 | T208: 0 | U208: 0 | V208: 0 | W208: 0 | X208: 5 | Y208: 5 | Z208: 0 | AA208: 0 | AB208: =V208+P208 -> 0 | AC208: =W208+Q208 -> 0 | AD208: =X208+R208 -> 8 | AE208: =Y208+S208 -> 8 | AF208: =Z208+T208 -> 0 | AG208: =AA208+U208 -> 0
A209: 205 | B209: mlopes | C209: 38238.820902777778 | D209: 0 | E209: 0 | F209: 4 | G209: 0 | H209: 24 | I209: 0 | J209: 0 | K209: 13 | L209: 0 | M209: 0 | N209: 0 | O209: 37 | P209: 0 | Q209: 0 | R209: 13 | S209: 13 | T209: 0 | U209: 0 | V209: 0 | W209: 0 | X209: 8 | Y209: 8 | Z209: 0 | AA209: 0 | AB209: =V209+P209 -> 0 | AC209: =W209+Q209 -> 0 | AD209: =X209+R209 -> 21 | AE209: =Y209+S209 -> 21 | AF209: =Z209+T209 -> 0 | AG209: =AA209+U209 -> 0
A210: 206 | B210: mlopes | C210: 38240.212754629632 | D210: 0 | E210: 0 | F210: 27 | G210: 0 | H210: 44 | I210: 0 | J210: 0 | K210: 24 | L210: 0 | M210: 0 | N210: 0 | O210: 68 | P210: 0 | Q210: 0 | R210: 24 | S210: 24 | T210: 0 | U210: 0 | V210: 0 | W210: 0 | X210: 140 | Y210: 140 | Z210: 0 | AA210: 0 | AB210: =V210+P210 -> 0 | AC210: =W210+Q210 -> 0 | AD210: =X210+R210 -> 164 | AE210: =Y210+S210 -> 164 | AF210: =Z210+T210 -> 0 | AG210: =AA210+U210 -> 0
A211: 207 | B211: mlopes | C211: 38240.795381944445 | D211: 0 | E211: 0 | F211: 1 | G211: 0 | H211: 2 | I211: 0 | J211: 0 | K211: 1 | L211: 0 | M211: 0 | N211: 0 | O211: 3 | P211: 0 | Q211: 0 | R211: 1 | S211: 1 | T211: 0 | U211: 0 | V211: 0 | W211: 0 | X211: 10 | Y211: 10 | Z211: 0 | AA211: 0 | AB211: =V211+P211 -> 0 | AC211: =W211+Q211 -> 0 | AD211: =X211+R211 -> 11 | AE211: =Y211+S211 -> 11 | AF211: =Z211+T211 -> 0 | AG211: =AA211+U211 -> 0
A212: 208 | B212: anapaula | C212: 38240.808645833335 | D212: 8 | E212: 0 | F212: 14 | G212: 0 | H212: 76 | I212: 0 | J212: 0 | K212: 38 | L212: 0 | M212: 0 | N212: 0 | O212: 114 | P212: 0 | Q212: 0 | R212: 38 | S212: 38 | T212: 0 | U212: 0 | V212: 0 | W212: 0 | X212: 135 | Y212: 129 | Z212: 2 | AA212: 0 | AB212: =V212+P212 -> 0 | AC212: =W212+Q212 -> 0 | AD212: =X212+R212 -> 173 | AE212: =Y212+S212 -> 167 | AF212: =Z212+T212 -> 2 | AG212: =AA212+U212 -> 0
A213: 209 | B213: mlopes | C213: 38243.17359953704 | D213: 0 | E213: 0 | F213: 5 | G213: 0 | H213: 6 | I213: 0 | J213: 0 | K213: 3 | L213: 0 | M213: 0 | N213: 0 | O213: 9 | P213: 0 | Q213: 0 | R213: 3 | S213: 3 | T213: 0 | U213: 0 | V213: 0 | W213: 0 | X213: 18 | Y213: 18 | Z213: 0 | AA213: 0 | AB213: =V213+P213 -> 0 | AC213: =W213+Q213 -> 0 | AD213: =X213+R213 -> 21 | AE213: =Y213+S213 -> 21 | AF213: =Z213+T213 -> 0 | AG213: =AA213+U213 -> 0
A214: 210 | B214: mlopes | C214: 38244.180393518516 | D214: 1 | E214: 0 | F214: 5 | G214: 0 | H214: 38 | I214: 0 | J214: 0 | K214: 19 | L214: 0 | M214: 0 | N214: 0 | O214: 57 | P214: 0 | Q214: 0 | R214: 19 | S214: 19 | T214: 0 | U214: 0 | V214: 0 | W214: 0 | X214: 62 | Y214: 61 | Z214: 0 | AA214: 0 | AB214: =V214+P214 -> 0 | AC214: =W214+Q214 -> 0 | AD214: =X214+R214 -> 81 | AE214: =Y214+S214 -> 80 | AF214: =Z214+T214 -> 0 | AG214: =AA214+U214 -> 0
A215: 211 | B215: natanael | C215: 38244.842719907407 | D215: 0 | E215: 0 | F215: 1 | G215: 0 | H215: 2 | I215: 0 | J215: 0 | K215: 1 | L215: 0 | M215: 0 | N215: 0 | O215: 3 | P215: 0 | Q215: 0 | R215: 1 | S215: 1 | T215: 0 | U215: 0 | V215: 0 | W215: 0 | X215: 5 | Y215: 5 | Z215: 0 | AA215: 0 | AB215: =V215+P215 -> 0 | AC215: =W215+Q215 -> 0 | AD215: =X215+R215 -> 6 | AE215: =Y215+S215 -> 6 | AF215: =Z215+T215 -> 0 | AG215: =AA215+U215 -> 0
A216: 212 | B216: natanael | C216: 38244.844942129632 | D216: 2 | E216: 0 | F216: 3 | G216: 0 | H216: 26 | I216: 0 | J216: 0 | K216: 13 | L216: 0 | M216: 0 | N216: 0 | O216: 39 | P216: 0 | Q216: 0 | R216: 13 | S216: 13 | T216: 2 | U216: 0 | V216: 0 | W216: 0 | X216: 39 | Y216: 39 | Z216: 0 | AA216: 0 | AB216: =V216+P216 -> 0 | AC216: =W216+Q216 -> 0 | AD216: =X216+R216 -> 52 | AE216: =Y216+S216 -> 52 | AF216: =Z216+T216 -> 2 | AG216: =AA216+U216 -> 0
A217: 213 | B217: mlopes | C217: 38245.573333333334 | D217: 0 | E217: 0 | F217: 1 | G217: 0 | H217: 2 | I217: 0 | J217: 0 | K217: 1 | L217: 0 | M217: 0 | N217: 0 | O217: 3 | P217: 0 | Q217: 0 | R217: 1 | S217: 1 | T217: 0 | U217: 0 | V217: 0 | W217: 0 | X217: 39 | Y217: 39 | Z217: 0 | AA217: 0 | AB217: =V217+P217 -> 0 | AC217: =W217+Q217 -> 0 | AD217: =X217+R217 -> 40 | AE217: =Y217+S217 -> 40 | AF217: =Z217+T217 -> 0 | AG217: =AA217+U217 -> 0
A218: 214 | B218: natanael | C218: 38245.752442129633 | D218: 0 | E218: 0 | F218: 1 | G218: 0 | H218: 2 | I218: 0 | J218: 0 | K218: 1 | L218: 0 | M218: 0 | N218: 0 | O218: 3 | P218: 0 | Q218: 0 | R218: 1 | S218: 1 | T218: 0 | U218: 0 | V218: 0 | W218: 0 | X218: 0 | Y218: 0 | Z218: 0 | AA218: 0 | AB218: =V218+P218 -> 0 | AC218: =W218+Q218 -> 0 | AD218: =X218+R218 -> 1 | AE218: =Y218+S218 -> 1 | AF218: =Z218+T218 -> 0 | AG218: =AA218+U218 -> 0
A219: 215 | B219: natanael | C219: 38245.75408564815 | D219: 0 | E219: 0 | F219: 2 | G219: 0 | H219: 4 | I219: 0 | J219: 0 | K219: 2 | L219: 0 | M219: 0 | N219: 0 | O219: 6 | P219: 0 | Q219: 0 | R219: 2 | S219: 2 | T219: 0 | U219: 0 | V219: 0 | W219: 0 | X219: 44 | Y219: 44 | Z219: 0 | AA219: 0 | AB219: =V219+P219 -> 0 | AC219: =W219+Q219 -> 0 | AD219: =X219+R219 -> 46 | AE219: =Y219+S219 -> 46 | AF219: =Z219+T219 -> 0 | AG219: =AA219+U219 -> 0
A220: 216 | B220: natanael | C220: 38245.763599537036 | D220: 0 | E220: 0 | F220: 1 | G220: 0 | H220: 2 | I220: 0 | J220: 0 | K220: 1 | L220: 0 | M220: 0 | N220: 0 | O220: 3 | P220: 0 | Q220: 0 | R220: 1 | S220: 1 | T220: 0 | U220: 0 | V220: 0 | W220: 0 | X220: 5 | Y220: 5 | Z220: 0 | AA220: 0 | AB220: =V220+P220 -> 0 | AC220: =W220+Q220 -> 0 | AD220: =X220+R220 -> 6 | AE220: =Y220+S220 -> 6 | AF220: =Z220+T220 -> 0 | AG220: =AA220+U220 -> 0
A221: 217 | B221: mlopes | C221: 38249.700196759259 | D221: 2 | E221: 0 | F221: 11 | G221: 0 | H221: 6 | I221: 0 | J221: 0 | K221: 5 | L221: 0 | M221: 0 | N221: 0 | O221: 11 | P221: 0 | Q221: 0 | R221: 5 | S221: 5 | T221: 0 | U221: 0 | V221: 0 | W221: 0 | X221: 63 | Y221: 63 | Z221: 0 | AA221: 0 | AB221: =V221+P221 -> 0 | AC221: =W221+Q221 -> 0 | AD221: =X221+R221 -> 68 | AE221: =Y221+S221 -> 68 | AF221: =Z221+T221 -> 0 | AG221: =AA221+U221 -> 0
A222: 218 | B222: mlopes | C222: 38249.783865740741 | D222: 0 | E222: 0 | F222: 1 | G222: 0 | H222: 2 | I222: 0 | J222: 0 | K222: 1 | L222: 0 | M222: 0 | N222: 0 | O222: 3 | P222: 0 | Q222: 0 | R222: 1 | S222: 1 | T222: 0 | U222: 0 | V222: 0 | W222: 0 | X222: 10 | Y222: 10 | Z222: 0 | AA222: 0 | AB222: =V222+P222 -> 0 | AC222: =W222+Q222 -> 0 | AD222: =X222+R222 -> 11 | AE222: =Y222+S222 -> 11 | AF222: =Z222+T222 -> 0 | AG222: =AA222+U222 -> 0
A223: 219 | B223: mlopes | C223: 38250.013009259259 | D223: 0 | E223: 0 | F223: 3 | G223: 0 | H223: 2 | I223: 0 | J223: 0 | K223: 1 | L223: 0 | M223: 0 | N223: 0 | O223: 3 | P223: 0 | Q223: 0 | R223: 1 | S223: 1 | T223: 0 | U223: 0 | V223: 0 | W223: 0 | X223: 10 | Y223: 10 | Z223: 0 | AA223: 0 | AB223: =V223+P223 -> 0 | AC223: =W223+Q223 -> 0 | AD223: =X223+R223 -> 11 | AE223: =Y223+S223 -> 11 | AF223: =Z223+T223 -> 0 | AG223: =AA223+U223 -> 0
A224: 220 | B224: mlopes | C224: 38250.032534722224 | D224: 0 | E224: 0 | F224: 5 | G224: 0 | H224: 42 | I224: 0 | J224: 0 | K224: 21 | L224: 0 | M224: 0 | N224: 0 | O224: 63 | P224: 0 | Q224: 0 | R224: 21 | S224: 21 | T224: 0 | U224: 0 | V224: 0 | W224: 0 | X224: 0 | Y224: 0 | Z224: 0 | AA224: 0 | AB224: =V224+P224 -> 0 | AC224: =W224+Q224 -> 0 | AD224: =X224+R224 -> 21 | AE224: =Y224+S224 -> 21 | AF224: =Z224+T224 -> 0 | AG224: =AA224+U224 -> 0
A225: 221 | B225: mlopes | C225: 38250.068287037036 | D225: 0 | E225: 0 | F225: 1 | G225: 0 | H225: 2 | I225: 0 | J225: 0 | K225: 1 | L225: 0 | M225: 0 | N225: 0 | O225: 3 | P225: 0 | Q225: 0 | R225: 1 | S225: 1 | T225: 0 | U225: 0 | V225: 0 | W225: 0 | X225: 6 | Y225: 6 | Z225: 0 | AA225: 0 | AB225: =V225+P225 -> 0 | AC225: =W225+Q225 -> 0 | AD225: =X225+R225 -> 7 | AE225: =Y225+S225 -> 7 | AF225: =Z225+T225 -> 0 | AG225: =AA225+U225 -> 0
A226: 222 | B226: aline | C226: 38250.7340625 | D226: 0 | E226: 0 | F226: 1 | G226: 0 | H226: 2 | I226: 0 | J226: 0 | K226: 1 | L226: 0 | M226: 0 | N226: 0 | O226: 3 | P226: 0 | Q226: 0 | R226: 1 | S226: 1 | T226: 0 | U226: 0 | V226: 0 | W226: 0 | X226: 39 | Y226: 39 | Z226: 0 | AA226: 0 | AB226: =V226+P226 -> 0 | AC226: =W226+Q226 -> 0 | AD226: =X226+R226 -> 40 | AE226: =Y226+S226 -> 40 | AF226: =Z226+T226 -> 0 | AG226: =AA226+U226 -> 0
A227: 223 | B227: mlopes | C227: 38251.780740740738 | D227: 0 | E227: 0 | F227: 8 | G227: 0 | H227: 12 | I227: 0 | J227: 0 | K227: 6 | L227: 0 | M227: 0 | N227: 0 | O227: 18 | P227: 0 | Q227: 0 | R227: 6 | S227: 6 | T227: 0 | U227: 0 | V227: 0 | W227: 0 | X227: 56 | Y227: 56 | Z227: 0 | AA227: 0 | AB227: =V227+P227 -> 0 | AC227: =W227+Q227 -> 0 | AD227: =X227+R227 -> 62 | AE227: =Y227+S227 -> 62 | AF227: =Z227+T227 -> 0 | AG227: =AA227+U227 -> 0
A228: 224 | B228: mlopes | C228: 38252.821932870371 | D228: 0 | E228: 0 | F228: 4 | G228: 0 | H228: 6 | I228: 0 | J228: 0 | K228: 3 | L228: 0 | M228: 0 | N228: 0 | O228: 9 | P228: 0 | Q228: 0 | R228: 3 | S228: 3 | T228: 0 | U228: 0 | V228: 0 | W228: 0 | X228: 8 | Y228: 8 | Z228: 0 | AA228: 0 | AB228: =V228+P228 -> 0 | AC228: =W228+Q228 -> 0 | AD228: =X228+R228 -> 11 | AE228: =Y228+S228 -> 11 | AF228: =Z228+T228 -> 0 | AG228: =AA228+U228 -> 0
A229: 225 | B229: aline | C229: 38253.099826388891 | D229: 0 | E229: 0 | F229: 3 | G229: 0 | H229: 0 | I229: 0 | J229: 0 | K229: 1 | L229: 0 | M229: 0 | N229: 0 | O229: 1 | P229: 0 | Q229: 0 | R229: 1 | S229: 1 | T229: 0 | U229: 0 | V229: 0 | W229: 0 | X229: 3 | Y229: 3 | Z229: 0 | AA229: 0 | AB229: =V229+P229 -> 0 | AC229: =W229+Q229 -> 0 | AD229: =X229+R229 -> 4 | AE229: =Y229+S229 -> 4 | AF229: =Z229+T229 -> 0 | AG229: =AA229+U229 -> 0
A230: 226 | B230: mlopes | C230: 38253.641435185185 | D230: 2 | E230: 1 | F230: 8 | G230: 0 | H230: 12 | I230: 0 | J230: 0 | K230: 7 | L230: 0 | M230: 0 | N230: 0 | O230: 19 | P230: 0 | Q230: 0 | R230: 7 | S230: 7 | T230: 0 | U230: 0 | V230: 0 | W230: 0 | X230: 61 | Y230: 59 | Z230: 0 | AA230: 0 | AB230: =V230+P230 -> 0 | AC230: =W230+Q230 -> 0 | AD230: =X230+R230 -> 68 | AE230: =Y230+S230 -> 66 | AF230: =Z230+T230 -> 0 | AG230: =AA230+U230 -> 0
A231: 227 | B231: mlopes | C231: 38253.762731481482 | D231: 0 | E231: 0 | F231: 2 | G231: 0 | H231: 2 | I231: 0 | J231: 0 | K231: 1 | L231: 0 | M231: 0 | N231: 0 | O231: 3 | P231: 0 | Q231: 0 | R231: 1 | S231: 1 | T231: 0 | U231: 0 | V231: 0 | W231: 0 | X231: 10 | Y231: 10 | Z231: 0 | AA231: 0 | AB231: =V231+P231 -> 0 | AC231: =W231+Q231 -> 0 | AD231: =X231+R231 -> 11 | AE231: =Y231+S231 -> 11 | AF231: =Z231+T231 -> 0 | AG231: =AA231+U231 -> 0
A232: 228 | B232: anapaula | C232: 38253.77884259259 | D232: 0 | E232: 0 | F232: 3 | G232: 0 | H232: 26 | I232: 0 | J232: 0 | K232: 13 | L232: 0 | M232: 0 | N232: 0 | O232: 39 | P232: 0 | Q232: 0 | R232: 13 | S232: 13 | T232: 0 | U232: 0 | V232: 0 | W232: 0 | X232: 80 | Y232: 80 | Z232: 0 | AA232: 0 | AB232: =V232+P232 -> 0 | AC232: =W232+Q232 -> 0 | AD232: =X232+R232 -> 93 | AE232: =Y232+S232 -> 93 | AF232: =Z232+T232 -> 0 | AG232: =AA232+U232 -> 0
A233: 229 | B233: mangan | C233: 38254.633043981485 | D233: 0 | E233: 0 | F233: 1 | G233: 0 | H233: 22 | I233: 0 | J233: 0 | K233: 11 | L233: 0 | M233: 0 | N233: 0 | O233: 33 | P233: 0 | Q233: 0 | R233: 11 | S233: 11 | T233: 0 | U233: 0 | V233: 0 | W233: 0 | X233: 0 | Y233: 0 | Z233: 0 | AA233: 0 | AB233: =V233+P233 -> 0 | AC233: =W233+Q233 -> 0 | AD233: =X233+R233 -> 11 | AE233: =Y233+S233 -> 11 | AF233: =Z233+T233 -> 0 | AG233: =AA233+U233 -> 0
A234: 230 | B234: carlosjr | C234: 38254.779791666668 | D234: 0 | E234: 0 | F234: 3 | G234: 0 | H234: 2 | I234: 0 | J234: 0 | K234: 2 | L234: 0 | M234: 0 | N234: 222 | O234: 4 | P234: 0 | Q234: 0 | R234: 224 | S234: 2 | T234: 0 | U234: 0 | V234: 0 | W234: 0 | X234: 636 | Y234: 13 | Z234: 0 | AA234: 0 | AB234: =V234+P234 -> 0 | AC234: =W234+Q234 -> 0 | AD234: =X234+R234 -> 860 | AE234: =Y234+S234 -> 15 | AF234: =Z234+T234 -> 0 | AG234: =AA234+U234 -> 0
A235: 231 | B235: mangan | C235: 38257.611458333333 | D235: 0 | E235: 0 | F235: 1 | G235: 0 | H235: 3 | I235: 0 | J235: 0 | K235: 1 | L235: 0 | M235: 0 | N235: 0 | O235: 4 | P235: 0 | Q235: 0 | R235: 1 | S235: 1 | T235: 0 | U235: 0 | V235: 0 | W235: 0 | X235: 5 | Y235: 5 | Z235: 0 | AA235: 0 | AB235: =V235+P235 -> 0 | AC235: =W235+Q235 -> 0 | AD235: =X235+R235 -> 6 | AE235: =Y235+S235 -> 6 | AF235: =Z235+T235 -> 0 | AG235: =AA235+U235 -> 0
A236: 232 | B236: mlopes | C236: 38257.632291666669 | D236: 0 | E236: 0 | F236: 2 | G236: 0 | H236: 6 | I236: 0 | J236: 0 | K236: 2 | L236: 0 | M236: 0 | N236: 0 | O236: 8 | P236: 0 | Q236: 0 | R236: 2 | S236: 2 | T236: 0 | U236: 0 | V236: 0 | W236: 0 | X236: 9 | Y236: 9 | Z236: 0 | AA236: 0 | AB236: =V236+P236 -> 0 | AC236: =W236+Q236 -> 0 | AD236: =X236+R236 -> 11 | AE236: =Y236+S236 -> 11 | AF236: =Z236+T236 -> 0 | AG236: =AA236+U236 -> 0
A237: 233 | B237: mangan | C237: 38257.717453703706 | D237: 0 | E237: 0 | F237: 1 | G237: 0 | H237: 3 | I237: 0 | J237: 0 | K237: 1 | L237: 0 | M237: 0 | N237: 0 | O237: 4 | P237: 0 | Q237: 0 | R237: 1 | S237: 1 | T237: 0 | U237: 0 | V237: 0 | W237: 0 | X237: 8 | Y237: 8 | Z237: 0 | AA237: 0 | AB237: =V237+P237 -> 0 | AC237: =W237+Q237 -> 0 | AD237: =X237+R237 -> 9 | AE237: =Y237+S237 -> 9 | AF237: =Z237+T237 -> 0 | AG237: =AA237+U237 -> 0
A238: 234 | B238: mlopes | C238: 38257.73541666667 | D238: 0 | E238: 0 | F238: 1 | G238: 0 | H238: 3 | I238: 0 | J238: 0 | K238: 1 | L238: 0 | M238: 0 | N238: 0 | O238: 4 | P238: 0 | Q238: 0 | R238: 1 | S238: 1 | T238: 0 | U238: 0 | V238: 0 | W238: 0 | X238: 10 | Y238: 10 | Z238: 0 | AA238: 0 | AB238: =V238+P238 -> 0 | AC238: =W238+Q238 -> 0 | AD238: =X238+R238 -> 11 | AE238: =Y238+S238 -> 11 | AF238: =Z238+T238 -> 0 | AG238: =AA238+U238 -> 0
A239: 235 | B239: mangan | C239: 38257.786215277774 | D239: 2 | E239: 0 | F239: 3 | G239: 0 | H239: 69 | I239: 0 | J239: 0 | K239: 23 | L239: 0 | M239: 0 | N239: 0 | O239: 92 | P239: 0 | Q239: 0 | R239: 23 | S239: 23 | T239: 0 | U239: 0 | V239: 0 | W239: 0 | X239: 46 | Y239: 46 | Z239: 2 | AA239: 0 | AB239: =V239+P239 -> 0 | AC239: =W239+Q239 -> 0 | AD239: =X239+R239 -> 69 | AE239: =Y239+S239 -> 69 | AF239: =Z239+T239 -> 2 | AG239: =AA239+U239 -> 0
A240: 236 | B240: mangan | C240: 38257.787199074075 | D240: 2 | E240: 0 | F240: 1 | G240: 0 | H240: 0 | I240: 0 | J240: 0 | K240: 0 | L240: 0 | M240: 0 | N240: 0 | O240: 0 | P240: 0 | Q240: 0 | R240: 0 | S240: 0 | T240: 0 | U240: 0 | V240: 0 | W240: 0 | X240: 0 | Y240: 0 | Z240: 2 | AA240: 0 | AB240: =V240+P240 -> 0 | AC240: =W240+Q240 -> 0 | AD240: =X240+R240 -> 0 | AE240: =Y240+S240 -> 0 | AF240: =Z240+T240 -> 2 | AG240: =AA240+U240 -> 0
A241: 237 | B241: mlopes | C241: 38257.813263888886 | D241: 0 | E241: 0 | F241: 2 | G241: 0 | H241: 36 | I241: 0 | J241: 0 | K241: 12 | L241: 0 | M241: 0 | N241: 0 | O241: 48 | P241: 0 | Q241: 0 | R241: 12 | S241: 12 | T241: 0 | U241: 0 | V241: 0 | W241: 0 | X241: 8 | Y241: 8 | Z241: 0 | AA241: 0 | AB241: =V241+P241 -> 0 | AC241: =W241+Q241 -> 0 | AD241: =X241+R241 -> 20 | AE241: =Y241+S241 -> 20 | AF241: =Z241+T241 -> 0 | AG241: =AA241+U241 -> 0
A242: 238 | B242: mangan | C242: 38257.829270833332 | D242: 0 | E242: 0 | F242: 1 | G242: 0 | H242: 0 | I242: 0 | J242: 0 | K242: 0 | L242: 0 | M242: 0 | N242: 0 | O242: 0 | P242: 0 | Q242: 0 | R242: 0 | S242: 0 | T242: 0 | U242: 0 | V242: 0 | W242: 0 | X242: 0 | Y242: 0 | Z242: 0 | AA242: 0 | AB242: =V242+P242 -> 0 | AC242: =W242+Q242 -> 0 | AD242: =X242+R242 -> 0 | AE242: =Y242+S242 -> 0 | AF242: =Z242+T242 -> 0 | AG242: =AA242+U242 -> 0
A243: 239 | B243: mangan | C243: 38257.829629629632 | D243: 0 | E243: 0 | F243: 1 | G243: 0 | H243: 33 | I243: 0 | J243: 0 | K243: 11 | L243: 0 | M243: 0 | N243: 0 | O243: 44 | P243: 0 | Q243: 0 | R243: 11 | S243: 11 | T243: 0 | U243: 0 | V243: 0 | W243: 0 | X243: 0 | Y243: 0 | Z243: 0 | AA243: 0 | AB243: =V243+P243 -> 0 | AC243: =W243+Q243 -> 0 | AD243: =X243+R243 -> 11 | AE243: =Y243+S243 -> 11 | AF243: =Z243+T243 -> 0 | AG243: =AA243+U243 -> 0
A244: 240 | B244: aline | C244: 38257.838518518518 | D244: 0 | E244: 0 | F244: 2 | G244: 0 | H244: 1 | I244: 0 | J244: 0 | K244: 1 | L244: 0 | M244: 0 | N244: 0 | O244: 2 | P244: 0 | Q244: 0 | R244: 1 | S244: 1 | T244: 0 | U244: 0 | V244: 0 | W244: 0 | X244: 3 | Y244: 3 | Z244: 0 | AA244: 0 | AB244: =V244+P244 -> 0 | AC244: =W244+Q244 -> 0 | AD244: =X244+R244 -> 4 | AE244: =Y244+S244 -> 4 | AF244: =Z244+T244 -> 0 | AG244: =AA244+U244 -> 0
A245: 241 | B245: anapaula | C245: 38257.844942129632 | D245: 2 | E245: 0 | F245: 13 | G245: 0 | H245: 45 | I245: 0 | J245: 0 | K245: 15 | L245: 0 | M245: 0 | N245: 0 | O245: 60 | P245: 0 | Q245: 0 | R245: 15 | S245: 15 | T245: 0 | U245: 0 | V245: 0 | W245: 0 | X245: 134 | Y245: 134 | Z245: 0 | AA245: 0 | AB245: =V245+P245 -> 0 | AC245: =W245+Q245 -> 0 | AD245: =X245+R245 -> 149 | AE245: =Y245+S245 -> 149 | AF245: =Z245+T245 -> 0 | AG245: =AA245+U245 -> 0
A246: 242 | B246: natanael | C246: 38257.850798611114 | D246: 0 | E246: 0 | F246: 1 | G246: 0 | H246: 3 | I246: 0 | J246: 0 | K246: 1 | L246: 0 | M246: 0 | N246: 0 | O246: 4 | P246: 0 | Q246: 0 | R246: 1 | S246: 1 | T246: 0 | U246: 0 | V246: 0 | W246: 0 | X246: 5 | Y246: 5 | Z246: 0 | AA246: 0 | AB246: =V246+P246 -> 0 | AC246: =W246+Q246 -> 0 | AD246: =X246+R246 -> 6 | AE246: =Y246+S246 -> 6 | AF246: =Z246+T246 -> 0 | AG246: =AA246+U246 -> 0
A247: 243 | B247: mangan | C247: 38258.630335648151 | D247: 0 | E247: 0 | F247: 3 | G247: 0 | H247: 36 | I247: 0 | J247: 0 | K247: 12 | L247: 0 | M247: 0 | N247: 0 | O247: 48 | P247: 0 | Q247: 0 | R247: 12 | S247: 12 | T247: 0 | U247: 0 | V247: 0 | W247: 0 | X247: 39 | Y247: 39 | Z247: 0 | AA247: 0 | AB247: =V247+P247 -> 0 | AC247: =W247+Q247 -> 0 | AD247: =X247+R247 -> 51 | AE247: =Y247+S247 -> 51 | AF247: =Z247+T247 -> 0 | AG247: =AA247+U247 -> 0
A248: 244 | B248: mlopes | C248: 38258.946828703702 | D248: 0 | E248: 1 | F248: 0 | G248: 0 | H248: 0 | I248: 0 | J248: 0 | K248: 0 | L248: 0 | M248: 0 | N248: 0 | O248: 0 | P248: 0 | Q248: 0 | R248: 0 | S248: 0 | T248: 0 | U248: 0 | V248: 0 | W248: 0 | X248: 0 | Y248: 0 | Z248: 0 | AA248: 0 | AB248: =V248+P248 -> 0 | AC248: =W248+Q248 -> 0 | AD248: =X248+R248 -> 0 | AE248: =Y248+S248 -> 0 | AF248: =Z248+T248 -> 0 | AG248: =AA248+U248 -> 0
A249: 245 | B249: mlopes | C249: 38258.980370370373 | D249: 0 | E249: 0 | F249: 2 | G249: 0 | H249: 6 | I249: 0 | J249: 0 | K249: 2 | L249: 0 | M249: 0 | N249: 0 | O249: 8 | P249: 0 | Q249: 0 | R249: 2 | S249: 2 | T249: 0 | U249: 0 | V249: 0 | W249: 0 | X249: 13 | Y249: 13 | Z249: 0 | AA249: 0 | AB249: =V249+P249 -> 0 | AC249: =W249+Q249 -> 0 | AD249: =X249+R249 -> 15 | AE249: =Y249+S249 -> 15 | AF249: =Z249+T249 -> 0 | AG249: =AA249+U249 -> 0
A250: 246 | B250: anapaula | C250: 38259.706620370373 | D250: 0 | E250: 0 | F250: 9 | G250: 0 | H250: 42 | I250: 0 | J250: 0 | K250: 14 | L250: 0 | M250: 0 | N250: 0 | O250: 56 | P250: 0 | Q250: 0 | R250: 14 | S250: 14 | T250: 0 | U250: 0 | V250: 0 | W250: 0 | X250: 64 | Y250: 64 | Z250: 0 | AA250: 0 | AB250: =V250+P250 -> 0 | AC250: =W250+Q250 -> 0 | AD250: =X250+R250 -> 78 | AE250: =Y250+S250 -> 78 | AF250: =Z250+T250 -> 0 | AG250: =AA250+U250 -> 0
A251: 247 | B251: aline | C251: 38259.800439814811 | D251: 0 | E251: 0 | F251: 4 | G251: 0 | H251: 4 | I251: 0 | J251: 0 | K251: 2 | L251: 0 | M251: 0 | N251: 0 | O251: 6 | P251: 0 | Q251: 0 | R251: 2 | S251: 2 | T251: 0 | U251: 0 | V251: 0 | W251: 0 | X251: 13 | Y251: 13 | Z251: 0 | AA251: 0 | AB251: =V251+P251 -> 0 | AC251: =W251+Q251 -> 0 | AD251: =X251+R251 -> 15 | AE251: =Y251+S251 -> 15 | AF251: =Z251+T251 -> 0 | AG251: =AA251+U251 -> 0
A252: 248 | B252: natanael | C252: 38260.706307870372 | D252: 0 | E252: 0 | F252: 1 | G252: 0 | H252: 3 | I252: 0 | J252: 0 | K252: 1 | L252: 0 | M252: 0 | N252: 0 | O252: 4 | P252: 0 | Q252: 0 | R252: 1 | S252: 1 | T252: 0 | U252: 0 | V252: 0 | W252: 0 | X252: 18 | Y252: 18 | Z252: 0 | AA252: 0 | AB252: =V252+P252 -> 0 | AC252: =W252+Q252 -> 0 | AD252: =X252+R252 -> 19 | AE252: =Y252+S252 -> 19 | AF252: =Z252+T252 -> 0 | AG252: =AA252+U252 -> 0
A253: 249 | B253: anapaula | C253: 38260.725312499999 | D253: 0 | E253: 0 | F253: 1 | G253: 0 | H253: 3 | I253: 0 | J253: 0 | K253: 1 | L253: 0 | M253: 0 | N253: 0 | O253: 4 | P253: 0 | Q253: 0 | R253: 1 | S253: 1 | T253: 0 | U253: 0 | V253: 0 | W253: 0 | X253: 34 | Y253: 34 | Z253: 0 | AA253: 0 | AB253: =V253+P253 -> 0 | AC253: =W253+Q253 -> 0 | AD253: =X253+R253 -> 35 | AE253: =Y253+S253 -> 35 | AF253: =Z253+T253 -> 0 | AG253: =AA253+U253 -> 0
A254: 250 | B254: aline | C254: 38260.827743055554 | D254: 0 | E254: 0 | F254: 6 | G254: 0 | H254: 10 | I254: 0 | J254: 0 | K254: 4 | L254: 0 | M254: 0 | N254: 0 | O254: 14 | P254: 0 | Q254: 0 | R254: 4 | S254: 4 | T254: 0 | U254: 0 | V254: 0 | W254: 0 | X254: 26 | Y254: 26 | Z254: 0 | AA254: 0 | AB254: =V254+P254 -> 0 | AC254: =W254+Q254 -> 0 | AD254: =X254+R254 -> 30 | AE254: =Y254+S254 -> 30 | AF254: =Z254+T254 -> 0 | AG254: =AA254+U254 -> 0
A255: 251 | B255: mlopes | C255: 38261.28087962963 | D255: 0 | E255: 0 | F255: 8 | G255: 0 | H255: 9 | I255: 0 | J255: 0 | K255: 3 | L255: 0 | M255: 0 | N255: 0 | O255: 12 | P255: 0 | Q255: 0 | R255: 3 | S255: 3 | T255: 0 | U255: 0 | V255: 0 | W255: 0 | X255: 38 | Y255: 38 | Z255: 0 | AA255: 0 | AB255: =V255+P255 -> 0 | AC255: =W255+Q255 -> 0 | AD255: =X255+R255 -> 41 | AE255: =Y255+S255 -> 41 | AF255: =Z255+T255 -> 0 | AG255: =AA255+U255 -> 0
A256: 252 | B256: artur | C256: 38261.756122685183 | D256: 0 | E256: 0 | F256: 5 | G256: 0 | H256: 15 | I256: 0 | J256: 0 | K256: 5 | L256: 0 | M256: 0 | N256: 0 | O256: 20 | P256: 0 | Q256: 0 | R256: 5 | S256: 5 | T256: 0 | U256: 0 | V256: 0 | W256: 0 | X256: 92 | Y256: 92 | Z256: 0 | AA256: 0 | AB256: =V256+P256 -> 0 | AC256: =W256+Q256 -> 0 | AD256: =X256+R256 -> 97 | AE256: =Y256+S256 -> 97 | AF256: =Z256+T256 -> 0 | AG256: =AA256+U256 -> 0
A257: 253 | B257: mlopes | C257: 38261.80736111111 | D257: 0 | E257: 0 | F257: 10 | G257: 0 | H257: 15 | I257: 0 | J257: 0 | K257: 5 | L257: 0 | M257: 0 | N257: 0 | O257: 20 | P257: 0 | Q257: 0 | R257: 5 | S257: 5 | T257: 0 | U257: 0 | V257: 0 | W257: 0 | X257: 33 | Y257: 33 | Z257: 0 | AA257: 0 | AB257: =V257+P257 -> 0 | AC257: =W257+Q257 -> 0 | AD257: =X257+R257 -> 38 | AE257: =Y257+S257 -> 38 | AF257: =Z257+T257 -> 0 | AG257: =AA257+U257 -> 0
A258: 254 | B258: mangan | C258: 38265.092453703706 | D258: 3 | E258: 0 | F258: 6 | G258: 0 | H258: 3 | I258: 0 | J258: 0 | K258: 1 | L258: 0 | M258: 0 | N258: 0 | O258: 4 | P258: 0 | Q258: 0 | R258: 1 | S258: 1 | T258: 0 | U258: 0 | V258: 0 | W258: 0 | X258: 0 | Y258: 0 | Z258: 0 | AA258: 0 | AB258: =V258+P258 -> 0 | AC258: =W258+Q258 -> 0 | AD258: =X258+R258 -> 1 | AE258: =Y258+S258 -> 1 | AF258: =Z258+T258 -> 0 | AG258: =AA258+U258 -> 0
A259: 255 | B259: mangan | C259: 38265.102060185185 | D259: 1 | E259: 0 | F259: 3 | G259: 0 | H259: 6 | I259: 0 | J259: 0 | K259: 2 | L259: 0 | M259: 0 | N259: 0 | O259: 8 | P259: 0 | Q259: 0 | R259: 2 | S259: 2 | T259: 0 | U259: 0 | V259: 0 | W259: 0 | X259: 42 | Y259: 41 | Z259: 0 | AA259: 0 | AB259: =V259+P259 -> 0 | AC259: =W259+Q259 -> 0 | AD259: =X259+R259 -> 44 | AE259: =Y259+S259 -> 43 | AF259: =Z259+T259 -> 0 | AG259: =AA259+U259 -> 0
A260: 256 | B260: mangan | C260: 38265.110972222225 | D260: 0 | E260: 2 | F260: 1 | G260: 0 | H260: 0 | I260: 0 | J260: 0 | K260: 0 | L260: 0 | M260: 0 | N260: 0 | O260: 0 | P260: 0 | Q260: 0 | R260: 0 | S260: 0 | T260: 0 | U260: 0 | V260: 0 | W260: 0 | X260: 0 | Y260: 0 | Z260: 0 | AA260: 2 | AB260: =V260+P260 -> 0 | AC260: =W260+Q260 -> 0 | AD260: =X260+R260 -> 0 | AE260: =Y260+S260 -> 0 | AF260: =Z260+T260 -> 0 | AG260: =AA260+U260 -> 2
A261: 257 | B261: mangan | C261: 38265.111863425926 | D261: 0 | E261: 0 | F261: 1 | G261: 0 | H261: 0 | I261: 0 | J261: 0 | K261: 0 | L261: 0 | M261: 0 | N261: 0 | O261: 0 | P261: 0 | Q261: 0 | R261: 0 | S261: 0 | T261: 0 | U261: 0 | V261: 0 | W261: 0 | X261: 0 | Y261: 0 | Z261: 0 | AA261: 0 | AB261: =V261+P261 -> 0 | AC261: =W261+Q261 -> 0 | AD261: =X261+R261 -> 0 | AE261: =Y261+S261 -> 0 | AF261: =Z261+T261 -> 0 | AG261: =AA261+U261 -> 0
A262: 258 | B262: mangan | C262: 38265.145682870374 | D262: 0 | E262: 0 | F262: 1 | G262: 0 | H262: 0 | I262: 0 | J262: 0 | K262: 0 | L262: 0 | M262: 0 | N262: 0 | O262: 0 | P262: 0 | Q262: 0 | R262: 0 | S262: 0 | T262: 0 | U262: 0 | V262: 0 | W262: 0 | X262: 0 | Y262: 0 | Z262: 0 | AA262: 0 | AB262: =V262+P262 -> 0 | AC262: =W262+Q262 -> 0 | AD262: =X262+R262 -> 0 | AE262: =Y262+S262 -> 0 | AF262: =Z262+T262 -> 0 | AG262: =AA262+U262 -> 0
A263: 259 | B263: mangan | C263: 38267.674513888887 | D263: 0 | E263: 0 | F263: 1 | G263: 0 | H263: 33 | I263: 0 | J263: 0 | K263: 11 | L263: 0 | M263: 0 | N263: 0 | O263: 44 | P263: 0 | Q263: 0 | R263: 11 | S263: 11 | T263: 0 | U263: 0 | V263: 0 | W263: 0 | X263: 42 | Y263: 42 | Z263: 0 | AA263: 0 | AB263: =V263+P263 -> 0 | AC263: =W263+Q263 -> 0 | AD263: =X263+R263 -> 53 | AE263: =Y263+S263 -> 53 | AF263: =Z263+T263 -> 0 | AG263: =AA263+U263 -> 0
A264: 260 | B264: mangan | C264: 38267.688368055555 | D264: 0 | E264: 0 | F264: 1 | G264: 0 | H264: 0 | I264: 0 | J264: 0 | K264: 0 | L264: 0 | M264: 0 | N264: 0 | O264: 0 | P264: 0 | Q264: 0 | R264: 0 | S264: 0 | T264: 0 | U264: 0 | V264: 0 | W264: 0 | X264: 0 | Y264: 0 | Z264: 0 | AA264: 0 | AB264: =V264+P264 -> 0 | AC264: =W264+Q264 -> 0 | AD264: =X264+R264 -> 0 | AE264: =Y264+S264 -> 0 | AF264: =Z264+T264 -> 0 | AG264: =AA264+U264 -> 0
A265: 261 | B265: mangan | C265: 38267.688807870371 | D265: 0 | E265: 0 | F265: 1 | G265: 0 | H265: 3 | I265: 0 | J265: 0 | K265: 1 | L265: 0 | M265: 0 | N265: 0 | O265: 4 | P265: 0 | Q265: 0 | R265: 1 | S265: 1 | T265: 0 | U265: 0 | V265: 0 | W265: 0 | X265: 0 | Y265: 0 | Z265: 0 | AA265: 0 | AB265: =V265+P265 -> 0 | AC265: =W265+Q265 -> 0 | AD265: =X265+R265 -> 1 | AE265: =Y265+S265 -> 1 | AF265: =Z265+T265 -> 0 | AG265: =AA265+U265 -> 0
A266: 262 | B266: artur | C266: 38267.817060185182 | D266: 0 | E266: 0 | F266: 3 | G266: 0 | H266: 3 | I266: 0 | J266: 0 | K266: 1 | L266: 0 | M266: 0 | N266: 0 | O266: 4 | P266: 0 | Q266: 0 | R266: 1 | S266: 1 | T266: 0 | U266: 0 | V266: 0 | W266: 0 | X266: 39 | Y266: 39 | Z266: 0 | AA266: 0 | AB266: =V266+P266 -> 0 | AC266: =W266+Q266 -> 0 | AD266: =X266+R266 -> 40 | AE266: =Y266+S266 -> 40 | AF266: =Z266+T266 -> 0 | AG266: =AA266+U266 -> 0
A267: 263 | B267: mangan | C267: 38268.496921296297 | D267: 0 | E267: 0 | F267: 1 | G267: 0 | H267: 0 | I267: 0 | J267: 0 | K267: 0 | L267: 0 | M267: 0 | N267: 0 | O267: 0 | P267: 0 | Q267: 0 | R267: 0 | S267: 0 | T267: 0 | U267: 0 | V267: 0 | W267: 0 | X267: 0 | Y267: 0 | Z267: 0 | AA267: 0 | AB267: =V267+P267 -> 0 | AC267: =W267+Q267 -> 0 | AD267: =X267+R267 -> 0 | AE267: =Y267+S267 -> 0 | AF267: =Z267+T267 -> 0 | AG267: =AA267+U267 -> 0
A268: 264 | B268: artur | C268: 38268.811886574076 | D268: 0 | E268: 0 | F268: 5 | G268: 0 | H268: 6 | I268: 0 | J268: 0 | K268: 2 | L268: 0 | M268: 0 | N268: 0 | O268: 8 | P268: 0 | Q268: 0 | R268: 2 | S268: 2 | T268: 0 | U268: 0 | V268: 0 | W268: 0 | X268: 81 | Y268: 81 | Z268: 0 | AA268: 0 | AB268: =V268+P268 -> 0 | AC268: =W268+Q268 -> 0 | AD268: =X268+R268 -> 83 | AE268: =Y268+S268 -> 83 | AF268: =Z268+T268 -> 0 | AG268: =AA268+U268 -> 0
A269: 265 | B269: artur | C269: 38275.80572916667 | D269: 0 | E269: 0 | F269: 1 | G269: 0 | H269: 33 | I269: 0 | J269: 0 | K269: 11 | L269: 0 | M269: 0 | N269: 0 | O269: 44 | P269: 0 | Q269: 0 | R269: 11 | S269: 11 | T269: 0 | U269: 0 | V269: 0 | W269: 0 | X269: 0 | Y269: 0 | Z269: 0 | AA269: 0 | AB269: =V269+P269 -> 0 | AC269: =W269+Q269 -> 0 | AD269: =X269+R269 -> 11 | AE269: =Y269+S269 -> 11 | AF269: =Z269+T269 -> 0 | AG269: =AA269+U269 -> 0
A270: 266 | B270: artur | C270: 38275.806342592594 | D270: 1 | E270: 0 | F270: 0 | G270: 0 | H270: 3 | I270: 0 | J270: 0 | K270: 1 | L270: 0 | M270: 0 | N270: 0 | O270: 4 | P270: 0 | Q270: 0 | R270: 1 | S270: 1 | T270: 0 | U270: 0 | V270: 0 | W270: 0 | X270: 7 | Y270: 6 | Z270: 0 | AA270: 0 | AB270: =V270+P270 -> 0 | AC270: =W270+Q270 -> 0 | AD270: =X270+R270 -> 8 | AE270: =Y270+S270 -> 7 | AF270: =Z270+T270 -> 0 | AG270: =AA270+U270 -> 0
A271: 267 | B271: artur | C271: 38280.809537037036 | D271: 0 | E271: 0 | F271: 2 | G271: 0 | H271: 6 | I271: 0 | J271: 0 | K271: 2 | L271: 0 | M271: 0 | N271: 0 | O271: 8 | P271: 0 | Q271: 0 | R271: 2 | S271: 2 | T271: 0 | U271: 0 | V271: 0 | W271: 0 | X271: 38 | Y271: 38 | Z271: 0 | AA271: 0 | AB271: =V271+P271 -> 0 | AC271: =W271+Q271 -> 0 | AD271: =X271+R271 -> 40 | AE271: =Y271+S271 -> 40 | AF271: =Z271+T271 -> 0 | AG271: =AA271+U271 -> 0
A272: 268 | B272: artur | C272: 38285.735601851855 | D272: 0 | E272: 0 | F272: 1 | G272: 0 | H272: 3 | I272: 0 | J272: 0 | K272: 1 | L272: 0 | M272: 0 | N272: 0 | O272: 4 | P272: 0 | Q272: 0 | R272: 1 | S272: 1 | T272: 0 | U272: 0 | V272: 0 | W272: 0 | X272: 39 | Y272: 39 | Z272: 0 | AA272: 0 | AB272: =V272+P272 -> 0 | AC272: =W272+Q272 -> 0 | AD272: =X272+R272 -> 40 | AE272: =Y272+S272 -> 40 | AF272: =Z272+T272 -> 0 | AG272: =AA272+U272 -> 0
A273: 269 | B273: natanael | C273: 38286.549131944441 | D273: 0 | E273: 0 | F273: 1 | G273: 0 | H273: 3 | I273: 0 | J273: 0 | K273: 1 | L273: 0 | M273: 0 | N273: 0 | O273: 4 | P273: 0 | Q273: 0 | R273: 1 | S273: 1 | T273: 0 | U273: 0 | V273: 0 | W273: 0 | X273: 0 | Y273: 0 | Z273: 0 | AA273: 0 | AB273: =V273+P273 -> 0 | AC273: =W273+Q273 -> 0 | AD273: =X273+R273 -> 1 | AE273: =Y273+S273 -> 1 | AF273: =Z273+T273 -> 0 | AG273: =AA273+U273 -> 0
A274: 270 | B274: natanael | C274: 38286.601631944446 | D274: 0 | E274: 0 | F274: 1 | G274: 0 | H274: 3 | I274: 0 | J274: 0 | K274: 1 | L274: 0 | M274: 0 | N274: 0 | O274: 4 | P274: 0 | Q274: 0 | R274: 1 | S274: 1 | T274: 0 | U274: 0 | V274: 0 | W274: 0 | X274: 0 | Y274: 0 | Z274: 0 | AA274: 0 | AB274: =V274+P274 -> 0 | AC274: =W274+Q274 -> 0 | AD274: =X274+R274 -> 1 | AE274: =Y274+S274 -> 1 | AF274: =Z274+T274 -> 0 | AG274: =AA274+U274 -> 0
A275: 271 | B275: natanael | C275: 38286.833298611113 | D275: 0 | E275: 0 | F275: 4 | G275: 0 | H275: 81 | I275: 0 | J275: 0 | K275: 27 | L275: 0 | M275: 0 | N275: 0 | O275: 108 | P275: 0 | Q275: 0 | R275: 27 | S275: 27 | T275: 0 | U275: 0 | V275: 0 | W275: 0 | X275: 76 | Y275: 76 | Z275: 0 | AA275: 0 | AB275: =V275+P275 -> 0 | AC275: =W275+Q275 -> 0 | AD275: =X275+R275 -> 103 | AE275: =Y275+S275 -> 103 | AF275: =Z275+T275 -> 0 | AG275: =AA275+U275 -> 0
A276: 272 | B276: natanael | C276: 38294.592268518521 | D276: 1 | E276: 0 | F276: 0 | G276: 0 | H276: 0 | I276: 0 | J276: 0 | K276: 0 | L276: 0 | M276: 0 | N276: 0 | O276: 0 | P276: 0 | Q276: 0 | R276: 0 | S276: 0 | T276: 0 | U276: 0 | V276: 0 | W276: 0 | X276: 0 | Y276: 0 | Z276: 1 | AA276: 0 | AB276: =V276+P276 -> 0 | AC276: =W276+Q276 -> 0 | AD276: =X276+R276 -> 0 | AE276: =Y276+S276 -> 0 | AF276: =Z276+T276 -> 1 | AG276: =AA276+U276 -> 0
A277: 273 | B277: artur | C277: 38296.700243055559 | D277: 0 | E277: 0 | F277: 201 | G277: 0 | H277: 254 | I277: 0 | J277: 0 | K277: 86 | L277: 0 | M277: 0 | N277: 0 | O277: 340 | P277: 0 | Q277: 0 | R277: 86 | S277: 86 | T277: 0 | U277: 0 | V277: 0 | W277: 0 | X277: 439 | Y277: 438 | Z277: 0 | AA277: 0 | AB277: =V277+P277 -> 0 | AC277: =W277+Q277 -> 0 | AD277: =X277+R277 -> 525 | AE277: =Y277+S277 -> 524 | AF277: =Z277+T277 -> 0 | AG277: =AA277+U277 -> 0
A278: 274 | B278: artur | C278: 38328.73710648148 | D278: 0 | E278: 0 | F278: 2 | G278: 0 | H278: 6 | I278: 0 | J278: 0 | K278: 2 | L278: 0 | M278: 0 | N278: 0 | O278: 8 | P278: 0 | Q278: 0 | R278: 2 | S278: 2 | T278: 0 | U278: 0 | V278: 0 | W278: 0 | X278: 74 | Y278: 74 | Z278: 0 | AA278: 0 | AB278: =V278+P278 -> 0 | AC278: =W278+Q278 -> 0 | AD278: =X278+R278 -> 76 | AE278: =Y278+S278 -> 76 | AF278: =Z278+T278 -> 0 | AG278: =AA278+U278 -> 0
A279: 275 | B279: artur | C279: 38330.748888888891 | D279: 0 | E279: 0 | F279: 4 | G279: 0 | H279: 6 | I279: 0 | J279: 0 | K279: 2 | L279: 0 | M279: 0 | N279: 0 | O279: 8 | P279: 0 | Q279: 0 | R279: 2 | S279: 2 | T279: 0 | U279: 0 | V279: 0 | W279: 0 | X279: 38 | Y279: 38 | Z279: 0 | AA279: 0 | AB279: =V279+P279 -> 0 | AC279: =W279+Q279 -> 0 | AD279: =X279+R279 -> 40 | AE279: =Y279+S279 -> 40 | AF279: =Z279+T279 -> 0 | AG279: =AA279+U279 -> 0
A280: 276 | B280: artur | C280: 38337.703761574077 | D280: 7 | E280: 0 | F280: 9 | G280: 0 | H280: 174 | I280: 0 | J280: 0 | K280: 58 | L280: 0 | M280: 0 | N280: 0 | O280: 232 | P280: 0 | Q280: 0 | R280: 58 | S280: 58 | T280: 0 | U280: 0 | V280: 0 | W280: 0 | X280: 77 | Y280: 77 | Z280: 0 | AA280: 0 | AB280: =V280+P280 -> 0 | AC280: =W280+Q280 -> 0 | AD280: =X280+R280 -> 135 | AE280: =Y280+S280 -> 135 | AF280: =Z280+T280 -> 0 | AG280: =AA280+U280 -> 0
A281: 277 | B281: artur | C281: 38337.766736111109 | D281: 0 | E281: 0 | F281: 5 | G281: 0 | H281: 39 | I281: 0 | J281: 0 | K281: 13 | L281: 0 | M281: 0 | N281: 0 | O281: 52 | P281: 0 | Q281: 0 | R281: 13 | S281: 13 | T281: 0 | U281: 0 | V281: 0 | W281: 0 | X281: 45 | Y281: 38 | Z281: 0 | AA281: 0 | AB281: =V281+P281 -> 0 | AC281: =W281+Q281 -> 0 | AD281: =X281+R281 -> 58 | AE281: =Y281+S281 -> 51 | AF281: =Z281+T281 -> 0 | AG281: =AA281+U281 -> 0
A282: 278 | B282: artur | C282: 38341.574479166666 | D282: 1 | E282: 0 | F282: 3 | G282: 0 | H282: 48 | I282: 0 | J282: 0 | K282: 16 | L282: 0 | M282: 0 | N282: 0 | O282: 64 | P282: 0 | Q282: 0 | R282: 16 | S282: 16 | T282: 0 | U282: 0 | V282: 0 | W282: 0 | X282: 36 | Y282: 36 | Z282: 0 | AA282: 0 | AB282: =V282+P282 -> 0 | AC282: =W282+Q282 -> 0 | AD282: =X282+R282 -> 52 | AE282: =Y282+S282 -> 52 | AF282: =Z282+T282 -> 0 | AG282: =AA282+U282 -> 0
A283: 279 | B283: artur | C283: 38342.806377314817 | D283: 0 | E283: 0 | F283: 4 | G283: 0 | H283: 72 | I283: 0 | J283: 0 | K283: 24 | L283: 0 | M283: 0 | N283: 0 | O283: 96 | P283: 0 | Q283: 0 | R283: 24 | S283: 24 | T283: 0 | U283: 0 | V283: 0 | W283: 0 | X283: 45 | Y283: 45 | Z283: 0 | AA283: 0 | AB283: =V283+P283 -> 0 | AC283: =W283+Q283 -> 0 | AD283: =X283+R283 -> 69 | AE283: =Y283+S283 -> 69 | AF283: =Z283+T283 -> 0 | AG283: =AA283+U283 -> 0
A284: 280 | B284: artur | C284: 38343.775185185186 | D284: 2 | E284: 0 | F284: 10 | G284: 0 | H284: 138 | I284: 0 | J284: 0 | K284: 46 | L284: 0 | M284: 0 | N284: 0 | O284: 184 | P284: 0 | Q284: 0 | R284: 46 | S284: 46 | T284: 0 | U284: 0 | V284: 0 | W284: 0 | X284: 59 | Y284: 58 | Z284: 0 | AA284: 0 | AB284: =V284+P284 -> 0 | AC284: =W284+Q284 -> 0 | AD284: =X284+R284 -> 105 | AE284: =Y284+S284 -> 104 | AF284: =Z284+T284 -> 0 | AG284: =AA284+U284 -> 0
A285: 281 | B285: artur | C285: 38357.043078703704 | D285: 0 | E285: 0 | F285: 2 | G285: 0 | H285: 36 | I285: 0 | J285: 0 | K285: 12 | L285: 0 | M285: 0 | N285: 0 | O285: 48 | P285: 0 | Q285: 0 | R285: 12 | S285: 12 | T285: 0 | U285: 0 | V285: 0 | W285: 0 | X285: 24 | Y285: 23 | Z285: 0 | AA285: 0 | AB285: =V285+P285 -> 0 | AC285: =W285+Q285 -> 0 | AD285: =X285+R285 -> 36 | AE285: =Y285+S285 -> 35 | AF285: =Z285+T285 -> 0 | AG285: =AA285+U285 -> 0
A286: 282 | B286: artur | C286: 38359.087395833332 | D286: 2 | E286: 0 | F286: 8 | G286: 0 | H286: 75 | I286: 0 | J286: 0 | K286: 25 | L286: 0 | M286: 0 | N286: 0 | O286: 100 | P286: 0 | Q286: 0 | R286: 25 | S286: 25 | T286: 0 | U286: 0 | V286: 0 | W286: 0 | X286: 103 | Y286: 102 | Z286: 2 | AA286: 0 | AB286: =V286+P286 -> 0 | AC286: =W286+Q286 -> 0 | AD286: =X286+R286 -> 128 | AE286: =Y286+S286 -> 127 | AF286: =Z286+T286 -> 2 | AG286: =AA286+U286 -> 0
A287: 283 | B287: artur | C287: 38362.677766203706 | D287: 0 | E287: 0 | F287: 3 | G287: 0 | H287: 69 | I287: 0 | J287: 0 | K287: 23 | L287: 0 | M287: 0 | N287: 0 | O287: 92 | P287: 0 | Q287: 0 | R287: 23 | S287: 23 | T287: 0 | U287: 0 | V287: 0 | W287: 0 | X287: 22 | Y287: 22 | Z287: 0 | AA287: 0 | AB287: =V287+P287 -> 0 | AC287: =W287+Q287 -> 0 | AD287: =X287+R287 -> 45 | AE287: =Y287+S287 -> 45 | AF287: =Z287+T287 -> 0 | AG287: =AA287+U287 -> 0
A288: 284 | B288: artur | C288: 38362.690949074073 | D288: 0 | E288: 0 | F288: 1 | G288: 0 | H288: 3 | I288: 0 | J288: 0 | K288: 1 | L288: 0 | M288: 0 | N288: 0 | O288: 4 | P288: 0 | Q288: 0 | R288: 1 | S288: 1 | T288: 0 | U288: 0 | V288: 0 | W288: 0 | X288: 11 | Y288: 11 | Z288: 0 | AA288: 0 | AB288: =V288+P288 -> 0 | AC288: =W288+Q288 -> 0 | AD288: =X288+R288 -> 12 | AE288: =Y288+S288 -> 12 | AF288: =Z288+T288 -> 0 | AG288: =AA288+U288 -> 0
A289: 285 | B289: cristine | C289: 38371.829884259256 | D289: 0 | E289: 0 | F289: 4 | G289: 0 | H289: 6 | I289: 0 | J289: 0 | K289: 2 | L289: 0 | M289: 0 | N289: 0 | O289: 8 | P289: 0 | Q289: 0 | R289: 2 | S289: 2 | T289: 0 | U289: 0 | V289: 0 | W289: 0 | X289: 5 | Y289: 5 | Z289: 0 | AA289: 0 | AB289: =V289+P289 -> 0 | AC289: =W289+Q289 -> 0 | AD289: =X289+R289 -> 7 | AE289: =Y289+S289 -> 7 | AF289: =Z289+T289 -> 0 | AG289: =AA289+U289 -> 0
A290: 286 | B290: regiane | C290: 38371.90247685185 | D290: 0 | E290: 0 | F290: 1 | G290: 0 | H290: 0 | I290: 0 | J290: 0 | K290: 0 | L290: 0 | M290: 0 | N290: 0 | O290: 0 | P290: 0 | Q290: 0 | R290: 0 | S290: 0 | T290: 0 | U290: 0 | V290: 0 | W290: 0 | X290: 0 | Y290: 0 | Z290: 0 | AA290: 0 | AB290: =V290+P290 -> 0 | AC290: =W290+Q290 -> 0 | AD290: =X290+R290 -> 0 | AE290: =Y290+S290 -> 0 | AF290: =Z290+T290 -> 0 | AG290: =AA290+U290 -> 0
A291: 287 | B291: artur | C291: 38376.764293981483 | D291: 0 | E291: 0 | F291: 4 | G291: 0 | H291: 69 | I291: 0 | J291: 0 | K291: 23 | L291: 0 | M291: 0 | N291: 0 | O291: 92 | P291: 0 | Q291: 0 | R291: 23 | S291: 23 | T291: 0 | U291: 0 | V291: 0 | W291: 0 | X291: 22 | Y291: 22 | Z291: 0 | AA291: 0 | AB291: =V291+P291 -> 0 | AC291: =W291+Q291 -> 0 | AD291: =X291+R291 -> 45 | AE291: =Y291+S291 -> 45 | AF291: =Z291+T291 -> 0 | AG291: =AA291+U291 -> 0
A292: 288 | B292: hamilton | C292: 38378.810034722221 | D292: 0 | E292: 0 | F292: 2 | G292: 0 | H292: 6 | I292: 0 | J292: 0 | K292: 2 | L292: 0 | M292: 0 | N292: 0 | O292: 8 | P292: 0 | Q292: 0 | R292: 2 | S292: 2 | T292: 0 | U292: 0 | V292: 0 | W292: 0 | X292: 17 | Y292: 17 | Z292: 0 | AA292: 0 | AB292: =V292+P292 -> 0 | AC292: =W292+Q292 -> 0 | AD292: =X292+R292 -> 19 | AE292: =Y292+S292 -> 19 | AF292: =Z292+T292 -> 0 | AG292: =AA292+U292 -> 0
A293: 289 | B293: cristine | C293: 38379.571412037039 | D293: 0 | E293: 0 | F293: 1 | G293: 0 | H293: 3 | I293: 0 | J293: 0 | K293: 1 | L293: 0 | M293: 0 | N293: 0 | O293: 4 | P293: 0 | Q293: 0 | R293: 1 | S293: 1 | T293: 0 | U293: 0 | V293: 0 | W293: 0 | X293: 0 | Y293: 0 | Z293: 0 | AA293: 0 | AB293: =V293+P293 -> 0 | AC293: =W293+Q293 -> 0 | AD293: =X293+R293 -> 1 | AE293: =Y293+S293 -> 1 | AF293: =Z293+T293 -> 0 | AG293: =AA293+U293 -> 0
A294: 290 | B294: artur | C294: 38380.107187499998 | D294: 0 | E294: 0 | F294: 1 | G294: 0 | H294: 3 | I294: 0 | J294: 0 | K294: 1 | L294: 0 | M294: 0 | N294: 0 | O294: 4 | P294: 0 | Q294: 0 | R294: 1 | S294: 1 | T294: 0 | U294: 0 | V294: 0 | W294: 0 | X294: 39 | Y294: 39 | Z294: 0 | AA294: 0 | AB294: =V294+P294 -> 0 | AC294: =W294+Q294 -> 0 | AD294: =X294+R294 -> 40 | AE294: =Y294+S294 -> 40 | AF294: =Z294+T294 -> 0 | AG294: =AA294+U294 -> 0
A295: 291 | B295: artur | C295: 38388.101643518516 | D295: 2 | E295: 0 | F295: 5 | G295: 0 | H295: 72 | I295: 0 | J295: 0 | K295: 24 | L295: 0 | M295: 0 | N295: 0 | O295: 96 | P295: 0 | Q295: 0 | R295: 24 | S295: 24 | T295: 0 | U295: 0 | V295: 0 | W295: 0 | X295: 44 | Y295: 44 | Z295: 0 | AA295: 0 | AB295: =V295+P295 -> 0 | AC295: =W295+Q295 -> 0 | AD295: =X295+R295 -> 68 | AE295: =Y295+S295 -> 68 | AF295: =Z295+T295 -> 0 | AG295: =AA295+U295 -> 0
A296: 292 | B296: artur | C296: 38398.691759259258 | D296: 1 | E296: 1 | F296: 1 | G296: 0 | H296: 3 | I296: 0 | J296: 0 | K296: 1 | L296: 0 | M296: 0 | N296: 0 | O296: 4 | P296: 0 | Q296: 0 | R296: 1 | S296: 1 | T296: 0 | U296: 0 | V296: 0 | W296: 0 | X296: 41 | Y296: 39 | Z296: 0 | AA296: 0 | AB296: =V296+P296 -> 0 | AC296: =W296+Q296 -> 0 | AD296: =X296+R296 -> 42 | AE296: =Y296+S296 -> 40 | AF296: =Z296+T296 -> 0 | AG296: =AA296+U296 -> 0
A297: 293 | B297: artur | C297: 38399.73878472222 | D297: 0 | E297: 0 | F297: 2 | G297: 0 | H297: 6 | I297: 0 | J297: 0 | K297: 2 | L297: 0 | M297: 0 | N297: 0 | O297: 8 | P297: 0 | Q297: 0 | R297: 2 | S297: 2 | T297: 0 | U297: 0 | V297: 0 | W297: 0 | X297: 49 | Y297: 49 | Z297: 0 | AA297: 0 | AB297: =V297+P297 -> 0 | AC297: =W297+Q297 -> 0 | AD297: =X297+R297 -> 51 | AE297: =Y297+S297 -> 51 | AF297: =Z297+T297 -> 0 | AG297: =AA297+U297 -> 0
A298: 294 | B298: artur | C298: 38401.542743055557 | D298: 0 | E298: 0 | F298: 2 | G298: 0 | H298: 3 | I298: 0 | J298: 0 | K298: 1 | L298: 0 | M298: 0 | N298: 0 | O298: 4 | P298: 0 | Q298: 0 | R298: 1 | S298: 1 | T298: 0 | U298: 0 | V298: 0 | W298: 0 | X298: 41 | Y298: 41 | Z298: 0 | AA298: 0 | AB298: =V298+P298 -> 0 | AC298: =W298+Q298 -> 0 | AD298: =X298+R298 -> 42 | AE298: =Y298+S298 -> 42 | AF298: =Z298+T298 -> 0 | AG298: =AA298+U298 -> 0
A299: 295 | B299: artur | C299: 38401.588703703703 | D299: 0 | E299: 0 | F299: 3 | G299: 0 | H299: 3 | I299: 0 | J299: 0 | K299: 1 | L299: 0 | M299: 0 | N299: 0 | O299: 4 | P299: 0 | Q299: 0 | R299: 1 | S299: 1 | T299: 0 | U299: 0 | V299: 0 | W299: 0 | X299: 41 | Y299: 41 | Z299: 0 | AA299: 0 | AB299: =V299+P299 -> 0 | AC299: =W299+Q299 -> 0 | AD299: =X299+R299 -> 42 | AE299: =Y299+S299 -> 42 | AF299: =Z299+T299 -> 0 | AG299: =AA299+U299 -> 0
A300: 296 | B300: artur | C300: 38404.83666666667 | D300: 0 | E300: 0 | F300: 2 | G300: 0 | H300: 3 | I300: 0 | J300: 0 | K300: 1 | L300: 0 | M300: 0 | N300: 0 | O300: 4 | P300: 0 | Q300: 0 | R300: 1 | S300: 1 | T300: 0 | U300: 0 | V300: 0 | W300: 0 | X300: 41 | Y300: 41 | Z300: 0 | AA300: 0 | AB300: =V300+P300 -> 0 | AC300: =W300+Q300 -> 0 | AD300: =X300+R300 -> 42 | AE300: =Y300+S300 -> 42 | AF300: =Z300+T300 -> 0 | AG300: =AA300+U300 -> 0
A301: 297 | B301: murta | C301: 38407.084444444445 | D301: 0 | E301: 0 | F301: 1 | G301: 0 | H301: 0 | I301: 0 | J301: 0 | K301: 0 | L301: 0 | M301: 0 | N301: 0 | O301: 0 | P301: 0 | Q301: 0 | R301: 0 | S301: 0 | T301: 0 | U301: 0 | V301: 0 | W301: 0 | X301: 0 | Y301: 0 | Z301: 0 | AA301: 0 | AB301: =V301+P301 -> 0 | AC301: =W301+Q301 -> 0 | AD301: =X301+R301 -> 0 | AE301: =Y301+S301 -> 0 | AF301: =Z301+T301 -> 0 | AG301: =AA301+U301 -> 0
A302: 298 | B302: artur | C302: 38407.135347222225 | D302: 2 | E302: 0 | F302: 12 | G302: 0 | H302: 138 | I302: 0 | J302: 0 | K302: 46 | L302: 0 | M302: 0 | N302: 0 | O302: 184 | P302: 0 | Q302: 0 | R302: 46 | S302: 46 | T302: 0 | U302: 0 | V302: 0 | W302: 0 | X302: 39 | Y302: 39 | Z302: 0 | AA302: 0 | AB302: =V302+P302 -> 0 | AC302: =W302+Q302 -> 0 | AD302: =X302+R302 -> 85 | AE302: =Y302+S302 -> 85 | AF302: =Z302+T302 -> 0 | AG302: =AA302+U302 -> 0
A303: 299 | B303: artur | C303: 38408.807118055556 | D303: 0 | E303: 0 | F303: 1 | G303: 0 | H303: 3 | I303: 0 | J303: 0 | K303: 1 | L303: 0 | M303: 0 | N303: 0 | O303: 4 | P303: 0 | Q303: 0 | R303: 1 | S303: 1 | T303: 0 | U303: 0 | V303: 0 | W303: 0 | X303: 0 | Y303: 0 | Z303: 0 | AA303: 0 | AB303: =V303+P303 -> 0 | AC303: =W303+Q303 -> 0 | AD303: =X303+R303 -> 1 | AE303: =Y303+S303 -> 1 | AF303: =Z303+T303 -> 0 | AG303: =AA303+U303 -> 0
A304: 300 | B304: artur | C304: 38411.75582175926 | D304: 0 | E304: 0 | F304: 1 | G304: 0 | H304: 3 | I304: 0 | J304: 0 | K304: 1 | L304: 0 | M304: 0 | N304: 0 | O304: 4 | P304: 0 | Q304: 0 | R304: 1 | S304: 1 | T304: 0 | U304: 0 | V304: 0 | W304: 0 | X304: 10 | Y304: 10 | Z304: 0 | AA304: 0 | AB304: =V304+P304 -> 0 | AC304: =W304+Q304 -> 0 | AD304: =X304+R304 -> 11 | AE304: =Y304+S304 -> 11 | AF304: =Z304+T304 -> 0 | AG304: =AA304+U304 -> 0
A305: 301 | B305: regiane | C305: 38411.829201388886 | D305: 0 | E305: 0 | F305: 1 | G305: 0 | H305: 33 | I305: 0 | J305: 0 | K305: 11 | L305: 0 | M305: 0 | N305: 0 | O305: 44 | P305: 0 | Q305: 0 | R305: 11 | S305: 11 | T305: 0 | U305: 0 | V305: 0 | W305: 0 | X305: 42 | Y305: 42 | Z305: 0 | AA305: 0 | AB305: =V305+P305 -> 0 | AC305: =W305+Q305 -> 0 | AD305: =X305+R305 -> 53 | AE305: =Y305+S305 -> 53 | AF305: =Z305+T305 -> 0 | AG305: =AA305+U305 -> 0
A306: 302 | B306: regiane | C306: 38411.830555555556 | D306: 1 | E306: 0 | F306: 7 | G306: 0 | H306: 3 | I306: 0 | J306: 0 | K306: 1 | L306: 0 | M306: 0 | N306: 0 | O306: 4 | P306: 0 | Q306: 0 | R306: 1 | S306: 1 | T306: 0 | U306: 0 | V306: 0 | W306: 0 | X306: 15 | Y306: 15 | Z306: 0 | AA306: 0 | AB306: =V306+P306 -> 0 | AC306: =W306+Q306 -> 0 | AD306: =X306+R306 -> 16 | AE306: =Y306+S306 -> 16 | AF306: =Z306+T306 -> 0 | AG306: =AA306+U306 -> 0
A307: 303 | B307: regiane | C307: 38411.830960648149 | D307: 0 | E307: 0 | F307: 1 | G307: 0 | H307: 3 | I307: 0 | J307: 0 | K307: 1 | L307: 0 | M307: 0 | N307: 0 | O307: 4 | P307: 0 | Q307: 0 | R307: 1 | S307: 1 | T307: 0 | U307: 0 | V307: 0 | W307: 0 | X307: 14 | Y307: 14 | Z307: 0 | AA307: 0 | AB307: =V307+P307 -> 0 | AC307: =W307+Q307 -> 0 | AD307: =X307+R307 -> 15 | AE307: =Y307+S307 -> 15 | AF307: =Z307+T307 -> 0 | AG307: =AA307+U307 -> 0
A308: 304 | B308: regiane | C308: 38411.833032407405 | D308: 0 | E308: 0 | F308: 3 | G308: 0 | H308: 9 | I308: 0 | J308: 0 | K308: 3 | L308: 0 | M308: 0 | N308: 0 | O308: 12 | P308: 0 | Q308: 0 | R308: 3 | S308: 3 | T308: 0 | U308: 0 | V308: 0 | W308: 0 | X308: 58 | Y308: 58 | Z308: 0 | AA308: 0 | AB308: =V308+P308 -> 0 | AC308: =W308+Q308 -> 0 | AD308: =X308+R308 -> 61 | AE308: =Y308+S308 -> 61 | AF308: =Z308+T308 -> 0 | AG308: =AA308+U308 -> 0
A309: 305 | B309: regiane | C309: 38411.835231481484 | D309: 2 | E309: 0 | F309: 0 | G309: 0 | H309: 0 | I309: 0 | J309: 0 | K309: 0 | L309: 0 | M309: 0 | N309: 0 | O309: 0 | P309: 0 | Q309: 0 | R309: 0 | S309: 0 | T309: 0 | U309: 0 | V309: 0 | W309: 0 | X309: 0 | Y309: 0 | Z309: 2 | AA309: 0 | AB309: =V309+P309 -> 0 | AC309: =W309+Q309 -> 0 | AD309: =X309+R309 -> 0 | AE309: =Y309+S309 -> 0 | AF309: =Z309+T309 -> 2 | AG309: =AA309+U309 -> 0
A310: 306 | B310: regiane | C310: 38411.835462962961 | D310: 3 | E310: 0 | F310: 0 | G310: 0 | H310: 0 | I310: 0 | J310: 0 | K310: 0 | L310: 0 | M310: 0 | N310: 0 | O310: 0 | P310: 0 | Q310: 0 | R310: 0 | S310: 0 | T310: 0 | U310: 0 | V310: 0 | W310: 0 | X310: 0 | Y310: 0 | Z310: 3 | AA310: 0 | AB310: =V310+P310 -> 0 | AC310: =W310+Q310 -> 0 | AD310: =X310+R310 -> 0 | AE310: =Y310+S310 -> 0 | AF310: =Z310+T310 -> 3 | AG310: =AA310+U310 -> 0
A311: 307 | B311: artur | C311: 38412.818541666667 | D311: 0 | E311: 2 | F311: 12 | G311: 0 | H311: 177 | I311: 0 | J311: 0 | K311: 59 | L311: 0 | M311: 0 | N311: 0 | O311: 236 | P311: 0 | Q311: 0 | R311: 59 | S311: 59 | T311: 0 | U311: 0 | V311: 0 | W311: 0 | X311: 104 | Y311: 102 | Z311: 0 | AA311: 0 | AB311: =V311+P311 -> 0 | AC311: =W311+Q311 -> 0 | AD311: =X311+R311 -> 163 | AE311: =Y311+S311 -> 161 | AF311: =Z311+T311 -> 0 | AG311: =AA311+U311 -> 0
A312: Total | D312: =SUM(D5:D311) -> 3031 | E312: =SUM(E5:E311) -> 154 | F312: =SUM(F5:F311) -> 1563 | G312: =SUM(G5:G311) -> 0 | H312: =SUM(H5:H311) -> 2574 | I312: =SUM(I5:I311) -> 0 | J312: =SUM(J5:J311) -> 0 | K312: =SUM(K5:K311) -> 2330 | L312: =SUM(L5:L311) -> 0 | M312: =SUM(M5:M311) -> 58 | N312: =SUM(N5:N311) -> 662 | O312: =SUM(O5:O311) -> 4904 | P312: =SUM(P5:P311) -> 165 | Q312: =SUM(Q5:Q311) -> 0 | R312: =SUM(R5:R311) -> 3050 | S312: =SUM(S5:S311) -> 2330 | T312: =SUM(T5:T311) -> 24 | U312: =SUM(U5:U311) -> 14 | V312: =SUM(V5:V311) -> 596 | W312: =SUM(W5:W311) -> 0 | X312: =SUM(X5:X311) -> 9560 | Y312: =SUM(Y5:Y311) -> 7694 | Z312: =SUM(Z5:Z311) -> 164 | AA312: =SUM(AA5:AA311) -> 130 | AB312: =SUM(AB5:AB311) -> 761 | AC312: =SUM(AC5:AC311) -> 0 | AD312: =SUM(AD5:AD311) -> 12610 | AE312: =SUM(AE5:AE311) -> 10024 | AF312: =SUM(AF5:AF311) -> 188 | AG312: =SUM(AG5:AG311) -> 144